date,time,title,abstract
2014-09-10,5:25 PM,REFILE-UPDATE 1-Danish reformer gets EU antitrust stick; German to police the Internet,"BRUSSELS, Sept 10 Europe's incoming competition and telecoms chiefs will have their plates full for the next five years as one tackles global companies suspected of acting unfairly while the other seeks to keep the Internet open and let online services flow freely."
2014-09-10,6:55 PM,"Google buys high-tech spoon maker, expands healthcare focus","SAN FRANCISCO, Sept 10 Google Inc   has acquired the maker of a high-tech spoon that helps people suffering from neurodegenerative tremors to eat, the Internet company's latest foray into the healthcare and biotechnology market."
2014-09-10,7:00 PM,"Google buys high-tech spoon maker, expands healthcare focus","SAN FRANCISCO Google Inc has acquired the maker of a high-tech spoon that helps people suffering from neurodegenerative tremors to eat, the Internet company's latest foray into the healthcare and biotechnology market."
2014-09-10,7:20 PM,U.S. court revives Microsoft co-founder's patent suit vs tech companies,"A U.S. appeals court on Wednesday revived part of a patent lawsuit brought by Microsoft co-founder Paul Allen against AOL, Apple, Google and Yahoo, saying a lower court incorrectly found that the tech companies didn't infringe one of its patents."
2014-09-10,10:06 AM,Deals of the day- Mergers and acquisitions,"(Adds Google, Itaú Unibanco Holding, Chiquita, UBS, AngloGold Ashanti, Telecom Italia SpA, Aspen, Kommunalkredit, Lamda, Visteon, Locke Lord)"
2014-09-12,3:30 PM,Ebay stock jumps; traders cite rumor of Google interest,"NEW YORK, Sept 12 Shares of eBay Inc  rose about 4 percent in heavy volume on Friday, with two European-based traders and one U.S.-based trader citing rumors that Google Inc would possibly take a large stake in eBay as the reason for the move."
2014-09-12,4:01 PM,"US STOCKS-EBay pares sharp gain, dismisses Google stake talk","NEW YORK, Sept 12 Shares of eBay were up but paring earlier sharp gains on Friday after a company spokesman said eBay has had no conversations with Google   about acquiring a stake in the company."
2014-09-12,4:01 PM,UPDATE 1-EBay shares backtrack after it dismisses talk of Google stake,"(Recasts with eBay's and Google's comments, updates shares)"
2014-09-12,3:32 PM,EBay shares backtrack after it dismisses talk of Google stake,NEW YORK/SAN FRANCISCO Shares of eBay Inc  lost much of their Friday gains after the online retailer dismissed market speculation that Google Inc  may be preparing to buy a slice of the company.
2014-09-12,4:41 PM,US STOCKS-Wall St slips at midday; energy a drag,"NEW YORK, Sept 12 U.S. stocks were lower at midday on Friday, with energy shares extending recent losses after the Treasury department announced new sanctions against Russia."
2014-09-12,5:26 PM,US STOCKS-Wall St falls in afternoon; set to snap 5 weeks of gains,"NEW YORK, Sept 12 U.S. stocks were lower in afternoon trading on Friday, with energy shares extending recent losses after the Treasury department announced new sanctions against Russia."
2014-09-12,7:01 PM,EU's Almunia denies decision on Google was postponed to appease lobbyists,"BRUSSELS, Sept 12 Europe's antitrust chief hit back on Friday at media reports suggesting that he had bowed to political lobbying by delaying a final decision on alleged anti-competitive behaviour by Google."
2014-09-12,7:05 PM,EU's Almunia denies decision on Google was postponed to appease lobbyists,BRUSSELS Europe's antitrust chief hit back on Friday at media reports suggesting that he had bowed to political lobbying by delaying a final decision on alleged anti-competitive behavior by Google.
2014-09-12,10:33 AM,Deals of the day- Mergers and acquisitions,"(Updates ThyssenKrupp; Adds EBay, Shell, HP, Porsche, Tottenham Hotspur, Digital First Media, Darden, DirecTV, Newcastle United and Snam)"
2014-09-15,6:31 AM,"Google launches Android One, phones to be priced at around $105","NEW DELHI/MUMBAI, Sept 15 Google Inc  launched in India on Monday the first smartphones powered by its Android One operating system, pricing them at around 6,399 rupees ($105) to capture the low-cost segement of the world's fastest growing smartphone market."
2014-09-15,7:35 AM,UPDATE 2-Google launches $105 Android One; eyes low-price smartphone boom,"* Partners with Micromax, Karbonn and Spice for low-cost phones"
2014-09-15,7:05 AM,Google launches $105 Android One; eyes low-price smartphone boom,"NEW DELHI/MUMBAI Google Inc launched in India on Monday a $105 smartphone, the first device from its ""Android One"" initiative which is aimed at boosting sales in key emerging markets through cheaper prices and better quality software."
2014-09-15,6:05 PM,Governments pressure Google for more user information,Sept 15 Google Inc said it was facing increasing pressure from governments around the world to reveal user information in criminal investigations amid ongoing revelations about national surveillance programs.
2014-09-15,6:10 PM,Governments pressure Google for more user information,Google Inc said it was facing increasing pressure from governments around the world to reveal user information in criminal investigations amid ongoing revelations about national surveillance programs.
2014-09-15,6:30 PM,Second actor sues Google over 'Innocence of Muslims' movie trailer,"Sept 15 A second actor has sued Google Inc  over a movie trailer called ""Innocence of Muslims"" that mocked the Prophet Mohammad and led to riots in 2012, six months after a U.S. appeals court ruled for another actor and ordered the film taken off YouTube."
2014-09-15,6:37 PM,Second actor sues Google over 'Innocence of Muslims' movie trailer,"A second actor has sued Google Inc over a movie trailer called ""Innocence of Muslims"" that mocked the Prophet Mohammad and led to riots in 2012, six months after a U.S. appeals court ruled for another actor and ordered the film taken off YouTube."
2014-09-16,12:02 PM,New global plans unveiled to crack down on corporate tax avoidance,"LONDON, Sept 16 Plans for a major rewriting of international tax rules unveiled on Tuesday could eliminate structures that have allowed companies like Google Inc  and Amazon.com Inc to shave billions of dollars off their tax bills."
2014-09-16,4:46 PM,UPDATE 1-OECD unveils proposals to curb corporate tax avoidance,"* Rules aim to end ""double non-taxation"" - OECD   (Adds expert and NGO comment)"
2014-09-16,12:15 PM,OECD unveils proposals to curb corporate tax avoidance,LONDON New international tax rules proposed on Tuesday could eliminate structures that have allowed companies such as Google Inc  and Amazon.com Inc  to shave billions of dollars off their tax bills.
2014-09-17,7:36 PM,"EU regulators preparing guidelines for ""right to be forgotten"" complaints","BRUSSELS, Sept 17 European regulators are working on guidelines for appeals from people whose requests to remove information from search results under their name have been turned down by search engines such as Google."
2014-09-18,11:01 AM,Alibaba cash could fund small spending spree at Yahoo,"SAN FRANCISCO/BOSTON, Sept 18 Alibaba Group Holding Ltd's upcoming public offering will give Yahoo Inc billions of dollars for a potential shopping spree that investors hope will jumpstart its comeback."
2014-09-18,3:10 PM,"UPDATE 1-EU regulators agree on guidelines for ""right to be forgotten"" complaints","* Regulators seek ""toolbox"" to weigh privacy vs public interest"
2014-09-18,3:20 PM,EU regulators agree on guidelines for 'right to be forgotten' complaints,"BRUSSELS European regulators have agreed on criteria for judging appeals for the ""right to be forgotten"", taking into account public profiles or crime for example, when search engines such as Google turn down requests to have information deleted from search results."
2014-09-18,4:35 PM,"UPDATE 1-Google, Mercedes, Audi get California permits for self-driving cars","(Adds Google as having most permits, background from California DMV)"
2014-09-18,3:55 PM,"Google, Mercedes, Audi get California permits for self-driving cars","California issued its first 29 permits this week to three companies to test self-driving cars on public roads, state officials said on Thursday."
2014-09-19,3:10 AM,INDIA PRESS-Google earmarks 1 bln rupees for Android One campaign in India - Economic Times,Note: Reuters has not verified this story and does not vouch for its accuracy.   (Compiled by Derek Francis in Bangalore)
2014-09-22,3:05 AM,INDIA PRESS-Sterlite Tech working on Google Fibre project clone-Economic Times,Note: Reuters has not verified this story and does not vouch for its accuracy.   (Compiled by Aby Jose Koilparambil in Bangalore)
2014-09-22,2:50 AM,REFILE-INDIA PRESS-Google in talks with Airtel to usher in carrier billing - Economic Times,(Refiles to add source in headline) (http://bit.ly/1C2mvGz)
2014-09-22,7:00 AM,Google selects HTC for upcoming Nexus tablet - WSJ,"Sept 22 Google Inc has selected HTC Corp to make its upcoming 9-inch Nexus tablet, the Wall Street Journal reported, citing people familiar with the matter."
2014-09-22,8:55 AM,UPDATE 1-Google selects HTC for upcoming Nexus tablet - WSJ,"Sept 22 Google Inc has selected HTC Corp to make its upcoming 9-inch Nexus tablet, the Wall Street Journal reported, citing people familiar with the matter."
2014-09-22,7:10 AM,Google selects HTC for upcoming Nexus tablet: WSJ,"Google Inc has selected HTC Corp to make its upcoming 9-inch Nexus tablet, the Wall Street Journal reported, citing people familiar with the matter."
2014-09-23,9:57 AM,Google to build 600 mln euro data centre in the Netherlands,"AMSTERDAM, Sept 23 Google will build a 600 million euro (773.58 million US dollar) data centre in the northern Netherlands, the company said on Tuesday."
2014-09-23,10:26 AM,Google to build 600 million euro data center in the Netherlands,"AMSTERDAM Google will build a 600 million euro ($773.58 million) data center in the northern Netherlands, the company said on Tuesday."
2014-09-23,3:30 PM,EU's Almunia says may probe Google's non-search services,"* Google's non-search services such as Google+, YouTube under fire"
2014-09-23,3:33 PM,EU's Almunia says may probe Google's non-search services,"BRUSSELS Google Inc, the target of an EU antitrust investigation into its internet search engine, may face further scrutiny over its other services following several complaints, Europe's antitrust chief said on Tuesday."
2014-09-25,2:46 AM,"INDIA PRESS-GroupM, Google join hands to launch festive sales online - Economic Times",Note: Reuters has not verified this story and does not vouch for its accuracy.   (Compiled by Aby Jose Koilparambil in Bangalore)
2014-09-25,5:29 PM,EU privacy watchdogs give Google guidelines to change privacy practices,"BRUSSELS, Sept 25 European data privacy regulators on Thursday handed Google a package of guidelines to help it bring the way it collects and stores user data in line with EU law after six regulators opened investigations into the internet giant."
2014-09-25,8:59 PM,Driving while texting with Google Glass as distracting as phone -study,"ORLANDO, Fla., Sept 25 The first scientific study of driving while texting with Google Glass found that the hands-free eyewear is no safer to use on the road than a smartphone."
2014-09-25,9:09 PM,Driving while texting with Google Glass as distracting as phone: study,ORLANDO Fla. The first scientific study of driving while texting with Google Glass found that the hands-free eyewear is no safer to use on the road than a smartphone.
2014-09-25,9:53 PM,"Google fires back at News Corp; defends search, piracy practices","SAN FRANCISCO, Sept 25 Google Inc hit back at News Corp on Thursday for calling it a platform for piracy and an ""unaccountable bureaucracy,"" in a point-by-point rebuttal that stressed the Internet search company's commitment to fighting online crime."
2014-09-25,10:03 PM,"Google fires back at News Corp; defends search, piracy practices","SAN FRANCISCO Google Inc hit back at News Corp on Thursday for calling it a platform for piracy and an ""unaccountable bureaucracy,"" in a point-by-point rebuttal that stressed the Internet search company's commitment to fighting online crime."
2014-09-26,12:20 AM,UPDATE 3-Hackers exploit 'Shellshock' bug with worms in early attacks,(Adds bulletins from Amazon and Google in seventh paragraph)
2014-09-26,1:15 AM,UPDATE 1-Driving while texting with Google Glass as distracting as phone -study,"ORLANDO, Fla., Sept 25 The first scientific study of driving while texting with Google Glass found that the hands-free eyewear is no safer to use on the road than a smartphone."
2014-09-26,1:21 AM,Driving while texting with Google Glass as distracting as phone: study,ORLANDO Fla. The first scientific study of driving while texting with Google Glass found that the hands-free eyewear is no safer to use on the road than a smartphone.
2014-09-26,10:47 AM,REFILE-EU privacy watchdogs give Google guidelines to change privacy practices,"BRUSSELS, Sept 25 European data privacy regulators on Thursday handed Google a package of guidelines to help it bring the way it collects and stores user data in line with EU law after six regulators opened investigations into the internet giant."
2014-09-26,10:57 AM,EU privacy watchdogs give Google guidelines to change privacy practices,BRUSSELS European data privacy regulators on Thursday handed Google a package of guidelines to help it bring the way it collects and stores user data in line with EU law after six regulators opened investigations into the internet giant.
2014-09-29,6:32 PM,"Taxes, fees: the worldwide battle between utilities and solar",MADRID/SYDNEY (This version of the Sept. 28 story has been repeated with no changes in text)
2014-09-29,8:25 PM,"Canada's TV watchdog to ignore Netflix, Google after data denial","TORONTO, Sept 29 Canada's broadcast regulator said on Monday it will ignore evidence from Internet-based video providers Netflix Inc and Google Inc when making new rules for television after the companies refused to hand over some data."
2014-09-29,8:30 PM,"Canada's TV watchdog to ignore Netflix, Google after data denial",TORONTO Canada's broadcast regulator said on Monday it will ignore evidence from Internet-based video providers Netflix Inc and Google Inc when making new rules for television after the companies refused to hand over some data.
2014-09-29,10:11 PM,EU telecoms nominee stands up for net neutrality,"BRUSSELS, Sept 29 Telecoms operators should not be allowed to strike lucrative deals with bandwidth-hungry content providers such as Netflix and Google  to provide them with quicker Internet access, the incoming EU telecoms commissioner said on Monday."
2014-09-29,10:15 PM,EU telecoms nominee stands up for net neutrality,"BRUSSELS Telecoms operators should not be allowed to strike lucrative deals with bandwidth-hungry content providers such as Netflix and Google to provide them with quicker Internet access, the incoming EU telecoms commissioner said on Monday."
2014-09-30,11:00 AM,Google searches for right note in online music business,"SAN FRANCISCO, Sept 30 Google Inc   is planning new and revamped streaming-music services in coming weeks, searching for a way to stand out in an increasingly crowded field of rivals from Apple Inc and Amazon.com Inc to Spotify."
2014-09-30,11:10 AM,Google searches for right note in online music business,"SAN FRANCISCO Google Inc is planning new and revamped streaming-music services in coming weeks, searching for a way to stand out in an increasingly crowded field of rivals from Apple Inc and Amazon.com Inc to Spotify."
2014-09-30,6:00 PM,"U.S. attorney general criticizes Apple, Google data encryption","WASHINGTON, Sept 30 Joining a cry from law enforcement officials concerned about data encryption on Apple's  newest operating system, U.S. Attorney General Eric Holder said on Tuesday that officers should not be blocked from the information they need to investigate a crime."
2014-09-30,6:05 PM,"U.S. attorney general criticizes Apple, Google data encryption","WASHINGTON Joining a cry from law enforcement officials concerned about data encryption on Apple's newest operating system, U.S. Attorney General Eric Holder said on Tuesday that officers should not be blocked from the information they need to investigate a crime."
2014-09-30,7:20 PM,German privacy watchdog tells Google to restrict use of data,"FRANKFURT, Sept 30 A German data protection watchdog told Google Inc on Tuesday to seek users' permission for creating data profiles from its various services, adding to pressure on the U.S. technology giant in Europe over its privacy policy."
2014-09-30,7:26 PM,German privacy watchdog tells Google to restrict use of data,"FRANKFURT A German data protection watchdog told Google Inc on Tuesday to seek users' permission for creating data profiles from its various services, adding to pressure on the U.S. technology giant in Europe over its privacy policy."
2014-10-01,8:52 AM,Cyberark listing puts Israeli venture capital fund in the spotlight,* Firm has invested around $1 billion in scores of start-ups
2014-10-02,10:05 AM,CORRECTED-Dubai detectives to get Google Glass to fight crime,(Corrects headline to show recognition database software developed by police not Google)
2014-10-02,10:20 AM,Dubai detectives to get Google Glass to fight crime,"DUBAI Dubai police plan to issue detectives with Google Glass hands-free eyewear to help them fight crime using facial recognition technology, a police spokesman in the wealthy Gulf Arab emirate said."
2014-10-02,4:15 PM,Google threatened with lawsuit over leaked celebrity photos-reports,"Oct 2 A lawyer who represents about a dozen female celebrities whose private photos were posted online by hackers has threatened to sue Google Inc for failing to take the photos off its websites, according to reports."
2014-10-02,7:45 PM,UPDATE 1-Google threatened with lawsuit over leaked celebrity photos -NY Post,"Oct 2 A lawyer who represents about a dozen female celebrities whose private photos were posted online by hackers has threatened to sue Google Inc for failing to take the photos off its websites, according to the New York Post."
2014-10-02,4:30 PM,Google threatened with lawsuit over leaked celebrity photos: NY Post,"A lawyer who represents about a dozen female celebrities whose private photos were posted online by hackers has threatened to sue Google Inc for failing to take the photos off its websites, according to the New York Post."
2014-10-02,11:36 PM,Ex-Googler leads Softbank invasion of Hollywood,"Oct 2 Softbank Corp's investment in a Hollywood movie studio represents the coming out party for two new players in the U.S. entertainment industry -- the Japanese telecommunications company and Nikesh Arora, the former Google Inc executive running a new media and internet company."
2014-10-02,11:41 PM,Ex-Googler leads Softbank invasion of Hollywood,"Softbank Corp’s investment in a Hollywood movie studio represents the coming out party for two new players in the U.S. entertainment industry -- the Japanese telecommunications company and Nikesh Arora, the former Google Inc executive running a new media and internet company."
2014-10-03,4:16 AM,Google to launch own mobile chat app -Economic Times,"Oct 3 Software giant Google Inc plans to launch a mobile messaging app it is likely to test in India and other emerging markets, the Economic Times newspaper reported on Friday, citing sources."
2014-10-03,4:16 AM,Google to launch own mobile chat app: Economic Times,"Software giant Google Inc plans to launch a mobile messaging app it is likely to test in India and other emerging markets, the Economic Times newspaper reported on Friday, citing sources."
2014-10-03,5:56 AM,UPDATE 1-Market Chatter-Corporate finance press digest,"(Adds items on RadioShack, Google, Goldman Sachs, Facebook. Removes Anadolu Group)"
2014-10-03,11:01 AM,RPT-Ex-Googler leads Softbank invasion of Hollywood,"Oct 2 Softbank Corp's investment in a Hollywood movie studio represents the coming out party for two new players in the U.S. entertainment industry -- the Japanese telecommunications company and Nikesh Arora, the former Google Inc executive running a new media and internet company."
2014-10-03,3:26 PM,Exclusive: Acting head of U.S. patent office considered for top job permanently- sources,"WASHINGTON The acting head of the U.S. Patent and Trademark Office, former Google Inc executive Michelle Lee, is being seriously considered to permanently head the agency, sources have told Reuters."
2014-10-07,6:30 PM,Twitter sues U.S. Justice Dept for right to reveal surveillance requests,"SAN FRANCISCO, Oct 7 Twitter Inc has sued the U.S. Department of Justice and the Federal Bureau of Investigation seeking the right to provide more specifics about the extent of U.S. government surveillance and requests for information from federal agencies."
2014-10-07,6:35 PM,Twitter sues U.S. Justice Department for right to reveal surveillance requests,"SAN FRANCISCO Twitter Inc  sued the U.S. Department of Justice on Tuesday, intensifying its battle with federal agencies as the Internet industry's self-described champion of free speech seeks the right to reveal the extent of U.S. government surveillance."
2014-10-07,9:15 PM,"Investors, activists press eBay, others to break up with ALEC","WASHINGTON, Oct 7 More than 80 environmental, labor and civic groups on Tuesday urged eBay Inc to end its association with the political group the American Legislative Exchange Council (ALEC), weeks after Google Inc  abruptly left ALEC over its views on climate change."
2014-10-07,9:15 PM,"Investors, activists press eBay, others to break up with ALEC","WASHINGTON More than 80 environmental, labor and civic groups on Tuesday urged eBay Inc to end its association with the political group the American Legislative Exchange Council (ALEC), weeks after Google Inc abruptly left ALEC over its views on climate change."
2014-10-08,9:51 PM,Google asks U.S. Supreme Court to enter Oracle copyright fight,"SAN FRANCISCO, Oct 8 Google Inc has asked the U.S. Supreme Court to wade into contentious litigation against Oracle Corp and reverse a lower court ruling that found parts of the Java programming language subject to copyright protection."
2014-10-08,10:26 PM,UPDATE 1-Google asks U.S. Supreme Court to decide Oracle copyright fight,"(Adds quote from Google brief, background on the case, paragraphs 3-8)"
2014-10-08,9:55 PM,Google asks Supreme Court to decide Oracle copyright fight,"SAN FRANCISCO Google Inc  has asked the U.S. Supreme Court to wade into contentious litigation against Oracle Corp , arguing that the high court must act to protect innovation in high tech."
2014-10-09,4:50 PM,Google wins bid on which court to fight Rockstar over patents,"WASHINGTON, Oct 9 Google Inc will fight patent holder Rockstar Consortium in a California court instead of a Texas court that lawyers consider more friendly toward plaintiffs."
2014-10-10,4:15 PM,"Ireland likely to phase out ""Double Irish"" tax regime - sources",* Dublin set to change tax residency rules in Oct. 14 budget
2014-10-10,4:21 PM,Ireland likely to phase out 'Double Irish' tax regime: sources,"DUBLIN Ireland is set to announce legal changes next week to phase out the ""Double Irish"" tax arrangement that has let firms such as Google  save billions of dollars, two sources familiar with the matter said."
2014-10-13,8:35 AM,Xiaomi signs former Google exec as India lead products manager,Oct 13 Chinese smartphone company Xiaomi has named a new lead products manager for its India unit as the company ramps up its team in the world's third biggest smartphone market.
2014-10-14,5:20 PM,Google expands shopping delivery service in U.S.,"Oct 14 Google Inc said it would expand its same-day shopping delivery service to three new U.S. cities and start charging customers for the service, which competes with Amazon.com Inc."
2014-10-14,2:35 PM,"UPDATE 3-Ireland calls time on austerity, ""Double Irish"" tax dodge",* Ireland to end tax regime that saved multinationals billions
2014-10-14,5:25 PM,Google expands shopping delivery service in U.S.,"Google Inc said it would expand its same-day shopping delivery service to three new U.S. cities and start charging customers for the service, which competes with Amazon.com Inc."
2014-10-14,10:07 AM,Deals of the day- Mergers and acquisitions,"Oct 14 The following bids, mergers, acquisitions and disposals were reported by 2000 GMT on Tuesday:"
2014-10-14,8:26 PM,German vice chancellor urges stricter rules for Google and peers,"BERLIN, Oct 14 Germany's economy minister warned during a debate with Google chairman Eric Schmidt on Tuesday that the tech giant's dominant position might undermine democratic rights and hamper competition, adding that stricter regulation is needed."
2014-10-14,8:45 PM,"Tech workers ask appeals court to reject Apple, Google bid","SAN FRANCISCO, Oct 14 Employees suing Apple , Google and two other tech companies over hiring practices said an appeals court should not approve a $324.5 million settlement in the case, according to a court filing on Tuesday."
2014-10-14,9:35 PM,"UPDATE 1-Tech workers ask appeals court to reject Apple, Google bid","(Adds Intel and Apple declined to comment, additional background)"
2014-10-14,8:50 PM,"Tech workers ask appeals court to reject Apple, Google bid","SAN FRANCISCO Employees suing Apple, Google and two other tech companies over hiring practices said an appeals court should not approve a $324.5 million settlement in the case, according to a court filing on Tuesday."
