date,time,title,abstract
2016-02-01,9:11 PM,"Alphabet surpasses Apple, now biggest traded US company","Feb 1 Alphabet Inc surpassed Apple Inc  as the most valuable company in the United States in after-hours trading on Monday, knocking the iPhone maker from the top spot that it has held for the better part of four years."
2016-02-02,9:07 PM,UPDATE 3-Alphabet profit sends shares up; overtakes Apple in value,"Feb 1 Alphabet Inc easily beat Wall Street's quarterly profit forecasts on Monday, helped by strong mobile advertising sales, sending the shares of Google's parent higher in after-hours trading to surpass Apple Inc as the most valuable U.S. company."
2016-02-02,1:17 AM,PRESS DIGEST- Financial Times - Feb 2,Feb 2 The following are the top stories in the Financial Times. Reuters has not verified these stories and does not vouch for their accuracy.
2016-02-02,2:48 AM,Alphabet passes Apple to become most valuable traded U.S. company,"NEW YORK Alphabet Inc  surpassed Apple Inc  as the most valuable company in the United States in after-hours trading on Monday, knocking the iPhone maker from the top spot that it has held for the better part of four years. | Video"
2016-02-02,2:12 PM,Magic Leap raises $793.5 mln in funding round led by Alibaba,"Feb 2 Magic Leap Inc, a startup focused on augmented reality technology, said on Tuesday it had raised $793.5 million in a funding round led by Chinese ecommerce giant Alibaba Group Holding Ltd."
2016-02-02,9:07 PM,Alphabet profit sends shares up; overtakes Apple in value,"Alphabet Inc easily beat Wall Street's quarterly profit forecasts on Monday, helped by strong mobile advertising sales, sending the shares of Google's parent higher in after-hours trading to surpass Apple Inc as the most valuable U.S. company. | Video"
2016-02-03,4:55 AM,Lenovo's Q3 revenue falls 8 pct to $12.9 bln; net profit beats estimates,"HONG KONG, Feb 3 The world's largest personal computer (PC) maker Lenovo Group Ltd said on Wednesday its third-quarter revenue fell 8 percent to $12.9 billion due to slower global PC demand and weaker smartphone sales."
2016-02-03,9:07 PM,Google's search business chief Amit Singhal to leave,"Feb 3 Amit Singhal, the senior vice president of Google's Internet search business at Alphabet Inc, said he would leave at the end of the month after 15 years with the company."
2016-02-04,9:10 PM,"Google search chief Singhal to quit, to be replaced by AI head","Google parent Alphabet Inc  said Amit Singhal, the longtime chief of its Internet search business, will leave the company and be replaced by the head of the technology giant's artificial intelligence business."
2016-02-08,4:35 PM,Cloud and data analytics stocks extend losses after bloodbath,"Feb 8 Shares of companies offering data analytics and cloud services, including Tableau Software Inc , fell sharply again on Monday amid worries that their customers were cutting spending."
2016-02-08,4:38 PM,"UPDATE 2-Tech stocks extend losses, valuations dented","Feb 8 Technology shares with lofty valuations, including those of midcap data analytics company Tableau Software Inc and Internet giant Facebook Inc, extended their losses on Monday following a gutting selloff in the previous session."
2016-02-09,2:17 AM,UPDATE 1-Google CEO Pichai receives stock grant worth about $199 mln,"Feb 8 Google Chief Executive Sundar Pichai received restricted stock worth about $199 million, according to a regulatory filing by Google parent company Alphabet Inc  ."
2016-02-09,2:17 AM,Google CEO Pichai receives stock grant worth about $199 million,"Google Chief Executive Sundar Pichai received restricted stock worth about $199 million, according to a regulatory filing by Google parent company Alphabet Inc  ."
2016-02-10,1:29 AM,"In boost to self-driving cars, U.S. tells Google computers can qualify as drivers","WASHINGTON/DETROIT U.S. vehicle safety regulators have said the artificial intelligence system piloting a self-driving Google car could be considered the driver under federal law, a major step toward ultimately winning approval for autonomous vehicles on the roads."
2016-02-10,7:00 PM,Google to scrub web search results more widely to soothe EU objections,"* EU court ruled Europeans had a ""right to be forgotten"" online"
2016-02-10,12:14 AM,"Exclusive: In boost to self-driving cars, U.S. tells Google computers can qualify as drivers","WASHINGTON/DETROIT U.S. vehicle safety regulators have said the artificial intelligence system piloting a self-driving Google car could be considered the driver under federal law, a major step toward ultimately winning approval for autonomous vehicles on the roads. | Video"
2016-02-11,12:37 PM,Italy opens tax probe on Google managers-sources,"MILAN, Feb 11 Italian prosecutors are investigating at least three managers at Alphabet Inc's Google  as part of a probe into the company's suspected evasion of taxes worth 227 million euros ($257 million), investigative sources said on Thursday."
2016-02-11,4:10 PM,UPDATE 1-Italy opens tax probe on Google managers-sources,"MILAN, Feb 11 Prosecutors are investigating five managers at Alphabet Inc's Google as part of a probe into allegations the firm evaded taxes worth 227 million euros ($257 million) in Italy, investigative sources said on Thursday."
2016-02-11,4:10 PM,Italy opens tax probe on Google managers: sources,"MILAN Prosecutors are investigating five managers at Alphabet Inc's Google as part of a probe into allegations the firm evaded taxes worth 227 million euros ($257 million) in Italy, investigative sources said on Thursday."
2016-02-11,3:52 PM,UK lawmakers tell Google to come clean on tax,"LONDON UK lawmakers accused Google on Thursday of trying to fool Britons into believing it was a proponent of tax reform while remaining a prime beneficiary of loopholes in existing rules, and said if it was sincere the company would be more  transparent over its tax affairs. | Video"
2016-02-12,8:00 PM,Google says will not participate in 2016 U.S. airwaves auction,"NEW YORK/SAN FRANCISCO, Feb 12 Alphabet Inc's  Google will not participate in the U.S. Federal Communications Commission's upcoming auction of broadcast airwaves for wireless industry use, a spokeswoman told Reuters on Friday."
2016-02-19,12:41 PM,Google accounts show 11 bln euros moved via low tax 'Dutch sandwich' in 2014,"AMSTERDAM/LONDON, Feb 19 Google moved 10.7 billion euros ($12 billion) through the Netherlands to Bermuda in 2014, as part of a structure which allows it to earn most of its foreign income tax free."
2016-03-03,7:50 PM,Google Fiber's video subscriber growth surges 79 percent in 2015,"Alphabet Inc's much-talked about high-speed internet service, Google Fiber, had 53,000 video subscribers as of December end, up 79 percent from a year earlier, brokerage MoffettNathanson said, citing numbers from the U.S. Copyright Office."
2016-03-04,9:25 AM,UPDATE 2-UK lawmakers say Facebook may have broken tax rules,"* Facebook says is compliant with UK tax law   (Adds MPs comment, academics, recasts)"
2016-03-04,6:10 PM,"More jobs, higher prices: restaurants show U.S. economy's bite","SAN RAMON, Calif., March 4 What does a nice meal out say about the U.S. economy?"
2016-03-04,9:25 AM,UK lawmakers say Facebook may have broken tax rules,"LONDON Facebook  said it would ditch a corporate structure that helps minimize its UK tax bill, prompting lawmakers and campaigners to ask whether the arrangement had ever complied with UK tax rules. | Video"
2016-03-07,8:45 PM,Alphabet's Project Fi exiting invite-only mode,"March 7 People across the United States interested in Alphabet Inc's wireless service, Project Fi, need not wait for an invite to sign up, starting Monday."
2016-03-10,3:18 PM,U.S. auto safety agency seeking details of Google self-driving crash,"WASHINGTON, March 10 The top U.S. auto safety regulator said Thursday the agency is seeking additional details of a recent crash of an Alphabet Inc Google self-driving car in California."
2016-03-14,5:55 PM,Google to urge Congress to help get self-driving cars on roads,"WASHINGTON, March 14 The head of Alphabet Inc's  Google self-driving car program will urge the U.S. Congress on Tuesday to grant national auto safety regulators new authority to speed the introduction of self-driving cars on American roads."
2016-03-15,8:01 PM,Amazon being probed for alleged tax evasion in Italy-Bloomberg,"March 15 Amazon.com Inc is under investigation in Italy for alleged tax evasion, the company's chief for Italy and Spain  Francois Nyuts told Bloomberg."
2016-03-17,4:30 AM,Apple signs up for Google's cloud services - Re/code,"March 16 Apple Inc recently started using Google's cloud service even as it simultaneously builds its own data centers to reduce its reliance on third-party service providers, technology news website Re/code reported, citing sources familiar with the deal."
2016-03-17,4:30 AM,Apple signs up for Google's cloud services: Re/code,"Apple Inc recently started using Google's cloud service even as it simultaneously builds its own data centers to reduce its reliance on third-party service providers, technology news website Re/code reported, citing sources familiar with the deal."
2016-03-17,5:32 PM,Alphabet puts robot-maker Boston Dynamics up for sale-Bloomberg,"March 17 Alphabet Inc has put Boston Dynamics, part of its robotics division, up for sale for lack of revenue potential, Bloomberg reported, citing people familiar with the plans."
2016-03-18,8:54 PM,UPDATE 2-U.S. FCC says it receives 104 bids to participate in spectrum auction,"WASHINGTON/NEW YORK March 18 The U.S. Federal Communications Commission said on Friday that it had received 104 applications to take part in an auction of valuable low-frequency airwaves relinquished by TV broadcasters,     including many wireless companies who want to use the airwaves to build new networks or improve existing coverage."
2016-03-29,6:25 PM,Alphabet introduces home phone service,"March 29 Alphabet Inc's high-speed internet service, Google Fiber, is introducing a home phone service, Fiber Phone, the company said on its blog on Tuesday."
2016-03-29,6:25 PM,Alphabet introduces home phone service,"Alphabet Inc's  high-speed internet service, Google Fiber, is introducing a home phone service, Fiber Phone, the company said on its blog on Tuesday."
2016-04-07,7:15 PM,"Verizon plans bid for Yahoo, Google weighs offer - Bloomberg","April 7 Verizon Communications Inc plans to make a first-round bid for Yahoo Inc's web business next week, Bloomberg reported, citing people familiar with the matter."
2016-04-07,12:00 PM,Deals of the day- Mergers and acquisitions,"April 7 The following bids, mergers, acquisitions and disposals were reported by 2000 GMT on Thursday:"
2016-04-07,7:15 PM,UPDATE 2-Verizon plans bid for Yahoo and its Yahoo Japan stake -Bloomberg,"SAN FRANCISCO, April 7 Verizon Communications Inc is ready to make a bid for Yahoo's web business, and hopes to make a merger more successful by also making an offer for a stake in Yahoo's Japan subsidiary, Bloomberg reported on Thursday, citing a source familiar with the matter."
2016-04-08,12:50 AM,Adobe issues emergency update to Flash after ransomware attacks,"BOSTON, April 7 Adobe Systems Inc  issued an emergency update on Thursday to its widely used Flash software for Internet browsers after researchers discovered a security flaw that was being exploited to deliver ransomware to Windows PCs."
2016-04-15,10:00 AM,Obama urges agency to open competition in cable TV boxes,"WASHINGTON, April 15 The Obama administration on Friday weighed into the debate over allowing consumers to switch pricey cable television boxes for less expensive devices, urging an agency to set an example for other parts of government to boost competition."
2016-04-19,3:20 PM,"TIMELINE-Google wins some, loses some in global antitrust battles","FRANKFURT, April 19 For more than a decade, Internet search and advertising giant Google, now a unit of holding company Alphabet Inc, has sparred with competitors in an expanding range of industries from Internet to media to telecoms to automobiles."
2016-04-19,3:31 PM,"Timeline: Google wins some, loses some in global antitrust battles","FRANKFURT For more than a decade, Internet search and advertising giant Google, now a unit of holding company Alphabet Inc, has sparred with competitors in an expanding range of industries from Internet to media to telecoms to automobiles."
2016-04-21,8:10 PM,Alphabet's quarterly revenue rises 17.4 pct,"April 21 Google's parent Alphabet Inc  reported a 17.4 percent rise in quarterly revenue, driven by strong advertising sales on mobile devices."
2016-04-21,8:35 PM,BRIEF-Alphabet reports 1st-qtr adj earnings of $7.50/shr,* Q1 Google segment revenue $20.09 billion versus $17.18 billion last year
2016-04-21,8:30 PM,CORRECTED-UPDATE 2-Google's parent Alphabet misses Wall Street view,"April 21 Google's parent Alphabet Inc  missed Wall Street targets for first-quarter profit and revenue on Thursday, driving shares of the Web search company down more than 4 percent in late trading on Thursday."
2016-04-22,3:30 PM,"Microsoft, Google agree to drop complaints against each other","April 22 Microsoft Corp and Alphabet Inc's Google have reached a deal to withdraw all the regulatory complaints against each other, the companies told Reuters."
2016-04-22,3:30 PM,"Microsoft, Google agree to drop complaints against each other","Microsoft Corp and Alphabet Inc's Google have reached a deal to withdraw all the regulatory complaints against each other, the companies told Reuters."
2016-04-22,3:51 PM,"Microsoft, Google agree to drop complaints against each other","Microsoft Corp and Alphabet Inc's  Google have reached a deal to withdraw all the regulatory complaints against each other, the companies told Reuters."
2016-04-22,6:20 PM,"US STOCKS-Wall Street mixed as Alphabet, Microsoft tumble","* Indexes: Dow +0.04 pct, S&P -0.12 pct, Nasdaq -0.99 pct   (Updates to afternoon)"
2016-04-22,12:51 PM,US STOCKS-Wall Street ends flat; Alphabet and Microsoft tumble,* Alphabet has worst day since 2012; Microsoft drags on indexes
2016-04-22,5:55 PM,BRIEF-Moody's comments on EU's antitrust charges against Alphabet,* Moody's says the European Union's new antitrust charges against Alphabet will not likely impact its AA2 credit ratings
2016-04-26,1:45 PM,BRIEF-Alphabet announces 84 pct final participation in exchange offers,* Alphabet Inc. announces 84 pct final participation in exchange offers and consent solicitations  Source text for Eikon:  Further company coverage:    (Bengaluru Newsroom: +1 646 223 8780)
2016-04-26,11:50 AM,"Google, Ford, Uber launch coalition to further self-driving cars","WASHINGTON Alphabet Inc's Google unit , Ford Motor Co , the ride-sharing service Uber [UBER.UL] and two other companies said on Tuesday they are forming a coalition to push for federal action to help speed self-driving cars to market."
2016-04-26,7:55 PM,BRIEF-S&P rates Alphabet's Senior unsecured notes 'AA' issue-level rating,* Alphabet Inc. Senior unsecured notes assigned 'AA' issue-level rating following Google Inc. Note exchange offer  Source (http://bit.ly/1WopBQF) Further company coverage:
2016-04-27,4:10 PM,UPDATE 4-Apple's 9-year iPhone juggernaut stops with first sales decline,April 26 Apple Inc on Tuesday posted its first-ever decline in iPhone sales and its first revenue drop in 13 years as the company credited with inventing the smartphone struggles with an increasingly saturated market.
2016-04-28,8:12 PM,REFILE-UPDATE 4-Facebook revenue smashes expectations as mobile ad sales surge,"April 27 Facebook Inc's quarterly revenue rose more than 50 percent, handily beating Wall Street expectations as its wildly popular mobile app and a push into live video lured new advertisers and encouraged existing ones to boost spending."
2016-04-28,5:10 PM,"Fiat Chrysler, Alphabet in technology partnership talks: WSJ","Fiat Chrysler Automobiles NV is in late-stage talks with Alphabet Inc's self-driving car division for a technology partnership, the Wall Street Journal reported, citing a person familiar with the discussions."
2016-05-03,10:35 AM,BRIEF-Alphabet says Canadian Competition Bureau closed antitrust probe,"* In April 2016, the Canadian Competition Bureau informed co that it was closing its antitrust investigations of co's business practices  Source text for Eikon: [(http://1.usa.gov/1Tt12Ny )] Further company coverage:    (Bengaluru Newsroom: +1 646 223 8780)"
2016-05-05,10:43 AM,Digital farming could spell shake-up for crop chemicals sector," (Corrects May 4 story to show AgFunder is an online investment platform, not a market research firm, paragraph 19.)"
2016-05-11,8:20 PM,FTC taking second look at Google search - Politico,"May 11 The U.S. Federal Trade Commission officials are asking questions again about whether Alphabet Inc's Google has abused its dominance in the Internet search market, Politico reported, citing sources familiar with the discussions."
2016-05-11,8:20 PM,FTC taking second look at Google search: Politico,"The U.S. Federal Trade Commission officials are asking questions again about whether Alphabet Inc's Google has abused its dominance in the Internet search market, Politico reported, citing sources familiar with the discussions."
2016-05-13,9:15 PM,BRIEF-Third Point LLC takes share stake in Alphabet Inc - SEC Filing,"Third Point Takes Share Stake Of 700,000 Class A Shares In Alphabet Inc - SEC Filing"
2016-05-13,9:20 PM,"Dan Loeb's Third Point adds 700,000 shares of Alphabet: filing","NEW YORK Dan Loeb's hedge fund Third Point LLC bought more than a half a million Class A share position of Google parent Alphabet Inc, according to a Securities and Exchange Commission filing late Friday."
2016-05-18,5:00 AM,PRESS DIGEST- New York Times business news - May 18,May 18 The following are the top stories on the New York Times business pages. Reuters has not verified these stories and does not vouch for their accuracy.
2016-05-18,5:55 PM,"Google unveils Google Home, looks to compete with Amazon's Echo","May 18 Google, a unit of Alphabet Inc, unveiled a new hardware device called Google Home at the company's annual conference on Wednesday."
2016-05-19,6:00 PM,Google doubles down on artificial intelligence with Home and Allo,"MOUNTAIN VIEW, California Alphabet's Google Inc  unveiled its answer to Amazon's  Alexa virtual assistant along with new messaging and virtual reality products at its annual I/O developer conference on Wednesday, doubling down on artificial intelligence and machine learning as the keys to its future. | Video"
2016-05-24,11:28 AM,UPDATE 3-Investigators raid Google Paris HQ in tax evasion inquiry,"PARIS, May 24 Dozens of French police raided Google's Paris headquarters on Tuesday, escalating an investigation into the digital giant on suspicion of tax evasion."
2016-05-25,8:50 PM,"For some U.S. companies, millennials are giving way to Generation Z","NEW YORK, May 25 A small but growing number of companies are starting to target Generation Z - the 69 million high school-age kids and younger who will soon outnumber the millennials before them - and they are not just pitching typical teen products such as acne creams and video games."
2016-05-26,5:25 PM,"REFILE-UPDATE 2-Microsoft, Facebook to build transatlantic subsea cable",May 26 Microsoft Corp and Facebook Inc  have agreed to jointly build a subsea cable across the Atlantic Ocean to meet growing demand for high-speed cloud and online services.
2016-05-27,8:50 PM,BRIEF-Moody's says Alphabet's victory in code copyright case is credit positive,* Moody's says alphabet inc.'s victory in code copyright case is credit positive; ratings unchanged
2016-05-31,2:00 PM,Russian watchdog again puts off decision on Google fine,"MOSCOW, May 31 Russia's state competition watchdog has again postponed a decision on a possible fine on Alphabet Inc's Google, the agency said on Tuesday."
2016-05-31,2:00 PM,Russian watchdog again puts off decision on Google fine,"MOSCOW Russia's state competition watchdog has again postponed a decision on a possible fine on Alphabet Inc's Google, the agency said on Tuesday."
2016-06-01,5:35 AM,Toyota in talks to buy robotics divisions from Alphabet -Nikkei,"TOKYO, June 1 Toyota Motor Corp is in talks to buy two robotics divisions from Google parent Alphabet Inc, the Nikkei reported on Wednesday."
2016-06-01,5:35 AM,Toyota in talks to buy robotics divisions from Alphabet: Nikkei,"TOKYO Toyota Motor Corp is in talks to buy two robotics divisions from Google parent Alphabet Inc, the Nikkei reported on Wednesday."
2016-06-03,3:31 PM,"UPDATE 2-Tiger Global climbs in May, other funds post gains as well","BOSTON, June 3 Investment firm Tiger Global, known for making big bets on technology companies, told clients on Thursday that its hedge fund climbed 2.3 percent last month, helping shrink its year-to-date losses, a source familiar with the numbers said."
2016-06-03,3:31 PM,"Tiger Global climbs in May, other funds post gains as well","BOSTON Investment firm Tiger Global, known for making big bets on technology companies, told clients on Thursday that its hedge fund climbed 2.3 percent last month, helping shrink its year-to-date losses, a source familiar with the numbers said."
2016-06-03,8:25 PM,Alphabet Inc unit Nest's CEO to step down,"June 3 Alphabet Inc unit Nest, which makes smart thermostats, said Chief Executive Tony Fadell would step down."
2016-06-03,8:34 PM,UPDATE 2-CEO of Alphabet Inc's Nest unit steps down,"June 3 Tony Fadell, a well-known Silicon Valley executive who was once  expected to play a central role in Alphabet Inc's hardware efforts, has stepped down as chief executive of the search giant's Nest unit, the company said."
2016-06-07,4:02 PM,"GM CEO says keep steering wheels, brakes in self-driving cars","DETROIT, June 7 General Motors Co Chief Executive Mary Barra on Tuesday said she believes self-driving vehicles should keep steering wheels and brakes and accelerators in them as the technology develops."
2016-06-09,4:55 PM,"Congress scrutinizes pay TV billing, competitive practices","WASHINGTON, June 9 A U.S. Senate panel disclosed Thursday it is investigating pay TV competition and customer service issues and will call executives from top cable and satellite providers to testify."
2016-06-09,5:28 PM,"UPDATE 1-U.S. Congress scrutinizes pay TV billing, competitive practices","WASHINGTON, June 9 A U.S. Senate panel disclosed Thursday it is investigating pay TV competition and customer service issues and will call executives from top cable and satellite providers to testify."
2016-06-09,5:28 PM,"U.S. Congress scrutinizes pay TV billing, competitive practices",WASHINGTON A U.S. Senate panel disclosed Thursday it is investigating pay TV competition and customer service issues and will call executives from top cable and satellite providers to testify.
2016-06-13,11:00 AM,Apple expected to showcase new powers for Siri at developer event,June 13 Apple Inc is expected to show off new abilities for its Siri digital assistant on Monday by debuting tools to let developers work with the company's artificial intelligence.
2016-06-20,5:50 AM,Toyota to build artificial intelligence-based driving systems in 5 years,"* TRI CEO Pratt: AI to enable cars to anticipate, avoid obstacles"
2016-06-29,1:40 PM,BRIEF-Alphabet Inc appoints Roger Ferguson member of board,"* Alphabet Inc says on June 24, 2016, board of directors appointed Roger Ferguson to serve as a member of board and audit committee of board"
2016-07-11,9:29 PM,"Google notifies users of 4,000 state-sponsored cyber attacks per month - exec","July 11 A senior executive of Alphabet Inc's  Google unit said on Monday that the company was notifying customers of 4,000 state-sponsored cyber attacks per month."
2016-07-12,9:29 PM,"Google notifies users of 4,000 state-sponsored cyber attacks per month: executive","A senior executive of Alphabet Inc's  Google unit said on Monday that the company was notifying customers of 4,000 state-sponsored cyber attacks per month."
2016-07-14,10:20 AM,Google says will respond to EU antitrust cases in coming weeks,"BRUSSELS, July 14 Alphabet Inc's Google  said it would examine EU antitrust regulators' third charge against the company and provide a detailed response in the coming weeks, adding it believed it promoted competition."
2016-07-20,12:30 PM,Uber driver tells UK tribunal he earned less than the minimum wage,"LONDON, July 20 An Uber driver told a British tribunal on Wednesday he had earned less than the minimum wage, despite the firm saying he received nearly three times as much, in a case that could threaten the app's business model."
2016-07-20,12:30 PM,Uber driver tells UK tribunal he earned less than the minimum wage,"LONDON An Uber driver told a British tribunal on Wednesday he had earned less than the minimum wage, despite the firm saying he received nearly three times as much, in a case that could threaten the app's business model."
2016-07-22,12:49 PM,REFILE-UPDATE 3-Verizon emerges as front-runner in Yahoo auction -sources,"July 22 Yahoo Inc is focusing on U.S. telecommunications company Verizon Communications Inc as the buyer of its core business after reviewing final bids that it received this week, people familiar with the matter said on Friday."
2016-07-28,8:10 PM,Google-parent Alphabet revenue up 21.3 percent,"July 28 Google-parent Alphabet Inc  posted a 21.3 percent rise in second-quarter revenue, driven by strong advertising sales on mobile devices and for video content."
2016-07-28,9:00 PM,BRIEF-Alphabet Inc reports Q2 GAAP EPS for Class A and B common stock $7,* Q2 non-GAAP EPS for class A and B common stock and class C capital stock  $8.42
