date,time,title,abstract
2013-01-07,8:00 PM,"Sharp says pondering weak finances, no talks with Intel now","SAN FRANCISCO, Jan 7 Sharp Corp is considering new ways to shore up its crumbling finances but is not talking with Intel Corp at the moment about any investment from the U.S. chipmaker, executives from the Japanese firm said on Monday."
2013-01-07,10:20 PM,Intel bets big on thin PCs and phones at Las Vegas show,"LAS VEGAS, Jan 7 Top chipmaker Intel Corp  on Monday announced shipments of a new low-power chip and showed off next-generation ultra thin laptops and convertible tablets in its latest bid to prove that the struggling PC industry still has a bright future."
2013-01-07,11:00 PM,Intel bets big on thin PCs and phones at Las Vegas show,LAS VEGAS Top chipmaker Intel Corp on Monday announced shipments of a new low-power chip and showed off next-generation ultra thin laptops and convertible tablets in its latest bid to prove that the struggling PC industry still has a bright future.
2013-01-16,10:00 PM,PC titans take notes from tablets to regain customers,"SAN FRANCISCO Personal computer makers, trying to beat back a tablet mania that's eating into their sales, are making what may be a last-ditch attempt to sway customers by mimicking the competition."
2013-01-17,9:01 PM,BRIEF-Intel shares up following results,"NEW YORK, Jan 17 Intel Corp : * Shares up nearly 4 percent following results"
2013-01-17,9:06 PM,Intel fourth-quarter revenue meets expectations,"SAN FRANCISCO, Jan 17 Intel Corp posted fourth-quarter revenue of $13.5 billion and net earnings of $2.5 billion, or 48 cents a share, as the personal computer industry wrestles with falling sales and a shift toward tablets and smartphones."
2013-01-17,10:01 PM,BRIEF-Intel shares reverse course; down 3.6 pct,"NEW YORK, Jan 17 Intel Corp :  * Shares reverse course in extended trade following results; down 3.6 percent"
2013-01-17,9:46 PM,"Instant View: Intel revenue forecast falls short, capex swells","SAN FRANCISCO Intel Corp forecast current-quarter revenue that was slightly below expectations, as the personal computer industry grapples with falling sales and a fundamental shift in consumer preferences toward tablets and smartphones."
2013-01-17,9:21 PM,"UPDATE 4-Intel's weak outlook, spending hikes unnerve Wall St",* Analysts say PC doldrums may leave Intel with surplus capacity   (Adds details from conference call)
2013-01-17,11:51 PM,BRIEF-Intel says capex on core business to be roughly flat with 2012,"SAN FRANCISCO, Jan 17 Intel Corp :  * CFO says capital spending on core business in 2013 to be roughly flat with"
2013-01-17,9:06 PM,"Intel's weak outlook, spending hikes unnerve Wall Street","SAN FRANCISCO Intel Corp's current-quarter revenue forecast disappointed Wall Street, while a sharp rise in planned 2013 capital spending unnerved investors who expect personal computer demand to dwindle. | Video"
2013-01-18,12:25 AM,"Intel's weak outlook, spending hikes unnerve Wall Street",SAN FRANCISCO Intel Corp forecast quarterly revenue that disappointed Wall Street and a sharp increase in capital spending it plans for 2013 unnerved investors already concerned about slow demand for personal computers. | Video
2013-01-18,12:30 PM,US STOCKS-Futures dip as Intel offsets China data; earnings in focus,"NEW YORK, Jan 18 U.S. stock index futures were slightly lower on Friday after a disappointing earnings outlook from Intel offset news of better-than-expected economic growth in China."
2013-01-18,1:26 PM,"US STOCKS-Futures mixed as Intel offsets Morgan Stanley, China data","* Futures: S&P up 0.2 pt, Dow down 3 pts, Nasdaq down 8 pts"
2013-01-18,3:30 PM,"US STOCKS-Wall Street little changed; Intel drags, Morgan Stanley up","NEW YORK, Jan 18 U.S. stocks opened little changed on Friday, a day after the S&P 500 rose to its highest level in five years, as a weak outlook from Intel offset a fourth-quarter profit at Morgan Stanley."
2013-01-18,3:46 PM,New data-center technology to hit Finisar: Jefferies,"Jan 18 Jefferies & Co downgraded Finisar Corp's  stock, saying demand for the company's traditional optical communication components could be hit by new silicon-photonics products from Intel Corp and Cisco Systems Inc."
2013-01-18,5:01 PM,US STOCKS-Wall St edges lower after disappointing Intel results,"NEW YORK, Jan 18 U.S. stocks edged lower on Friday from a five-year high for the S&P 500 as a weak outlook from tech heavyweight Intel offset a better-than-expected quarterly profit at Morgan Stanley."
2013-01-18,6:01 PM,US STOCKS-Wall St slips after disappointing Intel results,"NEW YORK, Jan 18 U.S. stocks edged lower on Friday from a five-year high for the S&P 500 as a weak outlook from tech heavyweight Intel offset a better-than-expected quarterly profit at Morgan Stanley."
2013-01-18,8:21 PM,"US STOCKS-Market flat on mixed earnings from Intel, Morgan Stanley","NEW YORK, Jan 18 U.S. stocks were little changed on Friday as a weak outlook from tech heavyweight Intel offset a better-than-expected quarterly profit at Morgan Stanley."
2013-01-18,9:16 PM,Intel may have little choice in big manufacturing bet,"SAN FRANCISCO, Jan 18 Intel Corp's  decision to spend $13 billion in 2013 to develop and build future manufacturing technology has not gone down well on Wall Street but it may be necessary if it wants to stay on top of rivals in coming years."
2013-01-18,9:25 PM,Intel may have little choice in big manufacturing bet,SAN FRANCISCO Intel Corp's decision to spend $13 billion in 2013 to develop and build future manufacturing technology has not gone down well on Wall Street but it may be necessary if it wants to stay on top of rivals in coming years.
2013-01-31,10:50 AM,Chipmaker Intel faces long march to mobile salvation,"Jan 31 Intel Corp, the world's biggest chipmaker, opened a new front on Thursday in a long and stuttering campaign to get its processors into mobile phones, although it appears to still have a long way to go."
2013-01-31,11:00 AM,Chipmaker Intel faces long march to mobile salvation,"Intel Corp, the world's biggest chipmaker, opened a new front on Thursday in a long and stuttering campaign to get its processors into mobile phones, although it appears to still have a long way to go."
2013-01-31,9:00 PM,RPT-Chipmaker Intel faces long march to mobile salvation,"Jan 31 Intel Corp, the world's biggest chipmaker, opened a new front on Thursday in a long and stuttering campaign to get its processors into mobile phones, although it appears to still have a long way to go."
2013-02-01,12:12 AM,Informant in Galleon insider-trading case gets a year in prison,"NEW YORK Roomy Khan, a one-time technology company executive who became a key FBI informant in the insider-trading case against hedge-fund manager Raj Rajaratnam, was sentenced to 12 months in prison on Thursday."
2013-02-01,2:00 AM,CORRECTED-Chipmaker Intel faces long march to mobile salvation,"Jan 31 Intel Corp, the world's biggest chipmaker, opened a new front on Thursday in a long and stuttering campaign to get its processors into mobile phones, although it appears to still have a long way to go."
2013-02-07,9:36 PM,AppliedMicro sees future in low-power server chips,"SUNNYVALE, California Chipmaker Applied Micro Circuits Corp believes selling low-power processors for cloud data centers run by the likes of Facebook, Google and Amazon.com Inc could account for half of its business within three years."
2013-02-12,6:41 PM,Intel plans to launch online TV service this year,"DANA POINT, Calif., Feb 12 Intel Corp  plans to launch an online television service this year that will stream live TV as well as provide content on demand, confirming reports that the world's top chipmaker is getting into the media market."
2013-02-12,6:46 PM,BRIEF-Intel confirms developing a television Internet platform,"SAN FRANCISCO, Feb 12 Intel Corp :  * Media gm huggers confirms developing a television internet platform  * Intel's huggers says over-the-top service will deliver live broadcasts, and"
2013-02-12,7:51 PM,UPDATE 3-Intel plans online TV service as PC chip sales wane,"DANA POINT, Calif., Feb 12 Top chipmaker Intel Corp plans to launch an Internet television service this year with live and on-demand content, entering a hotly competitive race as its core PC business erodes."
2013-02-12,6:40 PM,Intel plans online TV service as PC chip sales wane,"DANA POINT, California Top chipmaker Intel Corp plans to launch an Internet television service this year with live and on-demand content, entering a hotly competitive race as its core PC business erodes."
2013-02-25,9:20 PM,REFILE-Altera says Intel to manufacture future chips,"SAN FRANCISCO, Feb 25 Altera announced an agreement with Intel Corp to manufacture Altera's programmable chips on Intel's cutting-edge 14 nanometer technology."
2013-02-25,9:55 PM,UPDATE 3-Intel takes big step in chip foundry business,"SAN FRANCISCO, Feb 25 Intel Corp has agreed to make chips on behalf of Altera, a significant step toward opening its prized manufacturing technology to customers on a larger scale, potentially including Apple ."
2013-02-25,9:25 PM,Intel takes big step in chip foundry business,"SAN FRANCISCO Intel Corp has agreed to make chips on behalf of Altera, a significant step toward opening its prized manufacturing technology to customers on a larger scale, potentially including Apple."
2013-02-26,12:05 AM,Intel takes big step in chip foundry business,"SAN FRANCISCO Intel Corp has agreed to make chips on behalf of Altera, a significant step toward opening its prized manufacturing technology to customers on a larger scale, potentially including Apple."
2013-02-26,6:00 PM,Intel launches latest platform for crunching Big Data,"SAN FRANCISCO, Feb 26 Intel launched a new software platform for number-crunching on a massive scale, its latest offering in a growing field that it hopes will boost sales of its powerful server chips."
2013-03-07,8:13 AM,"Analysis: Next Intel CEO to guide new business, maybe Apple deal","SAN FRANCISCO/NEW YORK Intel's next CEO is likely to shepherd the top chipmaker into a growing contract-manufacturing business, a strategic shift that could lead to a deal with Apple Inc and give it a fighting chance to make inroads in the mobile arena."
2013-03-18,5:26 PM,Global PC shipments falling more than expected -IDC,"SAN FRANCISCO, March 18 Global PC shipments, already hit by consumers' growing preferences for tablets and smartphones, are falling more than previously predicted due to weakness in China, according to market research firm IDC."
2013-03-18,6:26 PM,UPDATE 1-Global PC shipments falling more than expected -IDC,"SAN FRANCISCO, March 18 Global PC shipments, already hit by consumers' growing preferences for tablets and smartphones, are falling more than previously predicted due to weakness in China, according to market research firm IDC."
2013-03-18,5:35 PM,Global PC shipments falling more than expected: IDC,"SAN FRANCISCO Global PC shipments, already hit by consumers' growing preferences for tablets and smartphones, are falling more than previously predicted due to weakness in China, according to market research firm IDC."
2013-03-19,12:55 AM,Intel's media unit on hiring spree to prep for TV debut,"SAN FRANCISCO, March 18 Intel Corp's  media group has been on a hiring spree as it prepares to launch an Internet television service later this year, underscoring the chip maker's seriousness about the new business."
2013-03-19,1:00 AM,Intel's media unit on hiring spree to prep for TV debut,"SAN FRANCISCO Intel Corp's media group has been on a hiring spree as it prepares to launch an Internet television service later this year, underscoring the chip maker's seriousness about the new business."
2013-03-26,2:40 PM,COLUMN-Intel's new approach to retirement: encore careers,"CHICAGO, Mar 26 Intel Corp. has something new inside: A $25,000 retiree benefit to help older workers transition into new careers in non-profit organizations."
2013-03-26,2:41 PM,Intel's new approach to retirement: encore careers,"CHICAGO Intel Corp. has something new inside: A $25,000 retiree benefit to help older workers transition into new careers in non-profit organizations."
2013-04-10,5:01 PM,"US STOCKS SNAPSHOT-Dow gains more than 1 pct, led by tech stocks","NEW YORK, April 10 The Dow Jones Industrial Average index was up 1 percent in afternoon trading Wednesday, led by gains in blue chip technology stocks, including Cisco and Intel."
2013-04-11,11:36 AM,BRIEF-Intel shares down 2.7 pct premarket,"NEW YORK, April 11 Intel Corp :  * Shares down 2.7 percent premarket after pc sales data"
2013-04-16,8:06 PM,BRIEF-Intel shares up in extended trade following results,"NEW YORK, April 16 Intel Corp :  * Shares up 2 percent in extended trade following results"
2013-04-16,8:10 PM,Intel's quarterly revenue meets expectations,"April 16 Intel Corp posted first-quarter revenue of $12.58 billion and net earnings of $2.0 billion, or 40 cents a share, as the personal computer industry grapples with falling sales and a shift toward tablets and smartphones."
2013-04-16,9:51 PM,BRIEF-Intel says CEO transition is on track,"SAN FRANCISCO, April 16 Intel Corp :  * Exec says process on track to replace outgoing CEO  * Exec says board's goal remains to name successor by the time otellini retires"
2013-04-16,8:21 PM,UPDATE 3-Intel's foresees Q2 sales decline as PC market shrinks,"SAN FRANCISCO, April 16 Intel Corp said its current-quarter revenue would decline as much as 8 percent and trimmed its 2013 capital spending plans, as personal computer sales drop due to the growing popularity of tablets and smartphones."
2013-04-16,8:16 PM,Intel's foresees second-quarter sales decline as PC market shrinks,"SAN FRANCISCO Intel Corp said its current-quarter revenue would decline as much as 8 percent and trimmed its 2013 capital spending plans, as personal computer sales drop due to the growing popularity of tablets and smartphones. | Video"
2013-04-17,12:45 AM,REFILE-UPDATE 3-Intel foresees Q2 sales decline as PC market shrinks,"SAN FRANCISCO, April 16 Intel Corp said its current-quarter revenue would decline as much as 8 percent and trimmed its 2013 capital spending plans, as personal computer sales drop due to the growing popularity of tablets and smartphones."
2013-04-17,1:00 AM,Tech industry cautiously welcomes Senate immigration bill,"WASHINGTON Tech industry officials welcomed a bipartisan U.S. Senate immigration bill on Tuesday, saying they hoped it would make it easier to hire highly skilled workers from abroad, while laying the groundwork to renegotiate portions they oppose."
2013-04-17,12:47 AM,Intel foresees second quarter sales decline as PC market shrinks,"SAN FRANCISCO Intel Corp said its current-quarter revenue would decline as much as 8 percent and trimmed its 2013 capital spending plans, as personal computer sales drop due to the growing popularity of tablets and smartphones. | Video"
2013-04-17,11:39 AM,"US STOCKS-Futures fall as commodities, earnings weigh","* Futures down: Dow 96 pts, S&P 11.9 pts, Nasdaq 23.5 pts"
2013-04-18,8:32 PM,UPDATE 2-AMD results beat expectations in declining PC market,"(Adds details on results, analyst comment, after-hours stock movement)"
2013-04-18,8:32 PM,AMD results beat expectations in declining PC market,Advanced Micro Devices Inc forecast current-quarter revenue above Wall Street's expectations as it rushes to find new markets to offset its declining core business of PC chips.
2013-04-30,2:35 AM,Intel CEO backs SoftBank's bid for Sprint over Dish's offer,"April 29 Intel Corp Chief Executive Paul Otellini said in a letter to the Federal Communications Commission that he supports SoftBank's bid for Sprint Nextel Corp, rather than Dish Network's counter offer."
2013-04-30,2:46 AM,Intel CEO backs SoftBank's bid for Sprint over Dish's offer,"Intel Corp Chief Executive Paul Otellini said in a letter to the Federal Communications Commission that he supports SoftBank's bid for Sprint Nextel Corp, rather than Dish Network's counter offer."
2013-05-02,5:11 AM,Lehman Brothers sues Intel over $1 bln in seized collateral,"May 2 Bankrupt investment bank Lehman Brothers has sued Intel Corp, accusing the chip maker of seizing $1 billion in collateral in breach of a swap agreement, a court filing showed."
2013-05-02,5:29 AM,Lehman Brothers sues Intel over $1 billion in seized collateral,"Bankrupt investment bank Lehman Brothers has sued Intel Corp, accusing the chip maker of seizing $1 billion in collateral in breach of a swap agreement, a court filing showed."
2013-05-02,2:35 PM,Analyst View: Intel names COO Krzanich as new CEO,"Intel Corp on Thursday promoted Chief Operating Officer Brian Krzanich to CEO, effective May 16."
2013-05-02,1:55 PM,"UPDATE 4-Intel picks insider as CEO, dashing hopes for shakeup","SAN FRANCISCO/NEW YORK, May 2 Intel Corp  chose veteran insider Brian Krzanich as chief executive, disappointing some investors who hoped an outsider would push for aggressive changes to help the world's largest chipmaker catch up in the mobile revolution."
2013-05-02,1:15 PM,"Intel picks insider as CEO, dashing hopes for shakeup","SAN FRANCISCO/NEW YORK Intel Corp chose veteran insider Brian Krzanich as chief executive, disappointing some investors who hoped an outsider would push for aggressive changes to help the world's largest chipmaker catch up in the mobile revolution."
2013-05-03,7:55 PM,"Run silent, run deep: The life of Brian Krzanich at Intel","SAN FRANCISCO It took him 30 years, but Brian Krzanich - the understated, analytical engineer who started his career at an Intel chip factory in New Mexico - quietly worked his way up to the top. Now, the man who once prided himself on halving production times will have to act swiftly to move the company into new areas of growth."
2013-05-06,6:56 AM,UPDATE 1-McAfee offers to buy Finland's Stonesoft for $389 mln,"HELSINKI, May 6 Intel Corp's security software division McAfee said it plans to buy Finland's network firewall maker Stonesoft Oyj for around $389 million in cash, a 128 percent premium to the company's stock market value at Friday's close."
2013-05-06,6:40 AM,McAfee offers to buy Finland's Stonesoft for $389 million,"HELSINKI Intel Corp's  security software division McAfee said it plans to buy Finland's network firewall maker Stonesoft Oyj  for around $389 million in cash, a 128 percent premium to the company's stock market value at Friday's close."
2013-05-06,6:01 PM,Intel revamps Atom chips in bid to find mobile footing,"SANTA CLARA, California, May 6 Intel Corp  on Monday unveiled the most extensive overhaul of its Atom mobile processors, with improved performance that the PC chipmaker expects will help it challenge Qualcomm in smartphones and tablets."
2013-05-06,6:15 PM,Intel revamps Atom chips in bid to find mobile footing,"SANTA CLARA, California Intel Corp on Monday unveiled the most extensive overhaul of its Atom mobile processors, with improved performance that the PC chipmaker expects will help it challenge Qualcomm in smartphones and tablets."
2013-05-16,6:10 PM,New CEO vows Intel will be more responsive in mobile push,SAN FRANCISCO Intel Corp's new CEO Brian Krzanich said on Thursday that under his leadership the top chipmaker will be more responsive to customers in an intensified focus on the fast-growing smartphone and tablet market where it lags its rivals.
2013-05-21,3:56 PM,"Intel CEO shakes up divisions, creates 'new devices' unit -source","SAN FRANCISCO, May 21 Intel Corp new Chief Executive Officer Brian Krzanich has re-organized key business groups and created a ""new devices"" unit, according to a source who has seen an internal email, shaking up the world's top chipmaker days after formally assuming control."
2013-05-21,4:10 PM,"Intel CEO shakes up divisions, creates 'new devices' unit -source","SAN FRANCISCO Intel Corp new Chief Executive Officer Brian Krzanich has re-organized key business groups and created a ""new devices"" unit, according to a source who has seen an internal email, shaking up the world's top chipmaker days after formally assuming control."
2013-05-21,6:42 PM,"UPDATE 4-Intel CEO shakes up units, creates 'new devices' group","SAN FRANCISCO, May 21 Intel Corp's new chief executive, Brian Krzanich, has launched a sweeping company reorganization and created a unit aimed at growing its market share in mobile technology."
2013-05-28,6:11 PM,ST-Ericsson sells GPS business to Intel,"PARIS/SAN FRANCISCO ST-Ericsson, a money-losing joint venture being wound down by owners STMicroelectronics and Ericsson, has sold its GPS mobile business to Intel."
2013-05-30,9:32 PM,Intel scores major win in new Samsung Galaxy tablet -source,"SAN FRANCISCO, May 30 Samsung Electronics  has chosen an Intel Corp processor to power a new version of one of its top-tier Android tablets, a source with knowledge of the plans told Reuters, in a major victory for the U.S. chipmaker, which is  struggling to find its footing in the mobile market."
2013-05-30,9:40 PM,UPDATE 2-Intel scores major win in new Samsung Galaxy tablet -source,"SAN FRANCISCO, May 30 Samsung Electronics  has chosen an Intel Corp processor to power a new version of one of its top-tier Android tablets, a source with knowledge of the plans told Reuters, in a major victory for the U.S. chipmaker, which is  struggling to find its footing in the mobile market."
2013-05-30,10:06 PM,RPT-UPDATE 2-Intel scores major win in new Samsung Galaxy tablet -source,"SAN FRANCISCO, May 30 Samsung Electronics  has chosen an Intel Corp processor to power a new version of one of its top-tier Android tablets, a source with knowledge of the plans told Reuters, in a major victory for the U.S. chipmaker, which is  struggling to find its footing in the mobile market."
2013-06-03,8:16 AM,CORRECTED-Samsung unveils first Android tablet using Intel chip,"(Corrects final paragraph to say Samsung introduces two tablets, not three)"
2013-06-03,8:21 AM,Samsung unveils first Android tablet using Intel chip,"SEOUL Samsung Electronics Co said on Monday it will use Intel Corp processors to power a new version of one of its top-tier Android tablets, a major victory for the U.S. chipmaker, which is struggling to find its footing in the mobile market."
2013-06-03,8:51 AM,UPDATE 1-Samsung unveils first Android tablet using Intel chip,"SEOUL, June 3 Samsung Electronics Co  said on Monday it will use Intel Corp processors to power a new version of one of its top-tier Android tablets."
2013-06-04,6:36 AM,Intel sees tablet-chip efforts paying off this year,"TAIPEI Intel Corp is ramping up its efforts to have more of its chips used in mobile devices, a market it was initially slow to respond to, as officials said on Monday they expect more than 30 tablets using its processors hitting the market this year."
2013-06-05,6:41 AM,BRIEF-Mcafee extends tender offer for Stonesoft shares,"HELSINKI, June 5 Intel Corp :  * Mcafee extends the acceptance period under its tender offer for all the"
2013-06-07,10:20 PM,Intel offers to pay up for Internet TV programming deals,"June 7 Intel Corp's talks to buy content from media companies for its new TV service are advancing, and the chipmaker is offering to pay as much as 75 percent more than traditional cable rates, people familiar with the talks said."
2013-06-07,10:25 PM,Intel offers to pay up for Internet TV programming deals,"Intel Corp's talks to buy content from media companies for its new TV service are advancing, and the chipmaker is offering to pay as much as 75 percent more than traditional cable rates, people familiar with the talks said."
2013-06-10,12:01 PM,RPT-Intel offers to pay up for Internet TV programming deals,"June 7 Intel Corp's talks to buy content from media companies for its new TV service are advancing, and the chipmaker is offering to pay as much as 75 percent more than traditional cable rates, people familiar with the talks said."
2013-06-19,11:17 PM,"REUTERS SUMMIT-ARM sees strength in numbers against Intel, Nvidia","SAN FRANCISCO, June 19 Chip designer ARM  said the size and depth of its partner network across hardware and software gave it an edge in mobile technology that top chipmaker Intel Corp and new graphics rival Nvidia Corp  would struggle to match."
2013-06-19,11:22 PM,"ARM sees strength in numbers against Intel, Nvidia",SAN FRANCISCO Chip designer ARM  said the size and depth of its partner network across hardware and software gave it an edge in mobile technology that top chipmaker Intel Corp  and new graphics rival Nvidia Corp  would struggle to match.
2013-06-20,12:30 AM,"REFILE-John McAfee resurfaces as ranting video star, mocks McAfee software",* Eccentric software pioneer making series of YouTube videos
2013-06-20,12:29 AM,"John McAfee resurfaces as ranting video star, mocks McAfee software",BOSTON Eccentric software pioneer John McAfee is back in the spotlight - lashing out at the anti-virus software that bears his name in a profanity-laced video.
2013-06-20,10:27 AM,"ARM sees strength in numbers against Intel, Nvidia",SAN FRANCISCO Chip designer ARM  said the size and depth of its partner network across hardware and software gave it an edge in mobile technology that top chipmaker Intel Corp  and new graphics rival Nvidia Corp  would struggle to match.
2013-06-28,5:36 PM,Intel executives see focus on Atom mobile chip,"SAN FRANCISCO, June 28 Intel Corp's top executives said on Friday the microprocessor company would speed up development and roll-out of its Atom chips for mobile devices, as the computing world moves away from the traditional personal computer."
2013-06-28,6:06 PM,"UPDATE 2-Intel's new CEO focused on mobile chips, cautious on TV","SAN FRANCISCO, June 28 Intel Corp's new CEO said on Friday he would speed up the rollout of chips for smartphones, tablets and wearable devices as consumers move away from personal computers."
