date,time,title,abstract
2014-12-01,12:45 PM,UPDATE 2-Intel acquires Canadian IT security firm PasswordBox,"TORONTO, Dec 1 Intel Corp said on Monday it has acquired PasswordBox, a Montreal-based identity management service that gives users a convenient way to log into websites and applications from any device without having to type or remember passwords."
2014-12-01,11:35 AM,Intel acquires Canadian IT security firm PasswordBox,"TORONTO Intel Corp  said on Monday it has acquired PasswordBox, a Montreal-based identity management service that gives users a convenient way to log into websites and applications from any device without having to type or remember passwords."
2014-12-02,4:05 PM,"Stephen Hawking hails ""life changing"" speech upgrade","LONDON, Dec 2 Theoretical physicist Stephen Hawking can communicate with the world faster and easier thanks to new technology from Intel Corp and SwiftKey which replaces the decades-old platform that made his computerised voice recognisable around the world."
2014-12-02,4:11 PM,Stephen Hawking hails 'life changing' speech upgrade,LONDON Theoretical physicist Stephen Hawking can communicate with the world faster and easier thanks to new technology from Intel Corp and SwiftKey which replaces the decades-old platform that made his computerized voice recognizable around the world.
2014-12-03,1:00 PM,Luxottica signs deal with Intel to develop computerised eyewear,"MILAN, Dec 3 Italy's Luxottica is joining forces with U.S. chipmaker Intel Corp to develop hi-tech glasses as the world's largest eyewear group pushes further into so-called wearable technology."
2014-12-03,5:55 PM,Luxottica signs deal with Intel to develop hi-tech glasses,"MILAN, Dec 3 Italy's Luxottica is joining forces with U.S. chipmaker Intel Corp to develop glasses that combine its top fashion brands with technology that could allow wearers to access information about their health or location."
2014-12-03,1:05 PM,Luxottica signs deal with Intel to develop hi-tech glasses,MILAN Italy's Luxottica is joining forces with U.S. chipmaker Intel Corp to develop glasses that combine its top fashion brands with technology that could allow wearers to access information about their health or location.
2014-12-04,6:31 AM,Intel to invest $1.6 billion in China factory,"BEIJING, Dec 4 Intel Corp will invest $1.6 billion to upgrade its factory in the city of Chengdu in western China, the latest sign of how the chipmaker is deepening ties in a market that is proving increasingly troublesome for some U.S. technology peers."
2014-12-04,6:34 AM,Intel to invest $1.6 billion in China factory,"BEIJING Intel Corp  will invest $1.6 billion to upgrade its factory in the city of Chengdu in western China, the latest sign of how the chipmaker is deepening ties in a market that is proving increasingly troublesome for some U.S. technology peers."
2014-12-04,6:51 AM,"European Factors to Watch-Shares seen higher, focus on ECB","LONDON, Dec 4 European shares headed for a stronger open on Thursday, tracking gains in the United States and Asia, with improving U.S. economic outlook and expectations of further stimulus from the European Central Bank boosting sentiment.     ECB President Mario Draghi will present the bank's updated forecasts for growth in output as well as inflation at a policy meeting later in the day. The ECB could extend a scheme to buy rebundled debt to purchasing corporate bonds, but it is u"
2014-12-04,5:01 AM,Italy - Factors to watch on December 4,The following factors could affect Italian markets on Thursday.
2014-12-04,5:55 PM,Exclusive: Intel Security CTO Michael Fey joins Blue Coat as COO,"Michael Fey has left Intel Security Group to become chief operating officer at Blue Coat Systems Inc, a privately owned network security company."
2014-12-09,7:00 PM,Intel unveils platform to simplify connectivity of products,"SAN FRANCISCO, Dec 9 Intel Corp on Tuesday unveiled a new platform to make it easier for companies to create Internet-connected smart products using its chips, security and software."
2014-12-22,6:10 PM,US STOCKS-Wall St edges up after three-day run; tech lifts Dow,"* Indexes up: Dow 0.6 pct, S&P 0.1 pct, Nasdaq 0.2 pct   (Updates to afternoon trading)"
2014-12-22,7:50 PM,US STOCKS-Wall St on track for four-day rally; tech lifts Dow,"* Indexes up: Dow 0.6 pct, S&P 0.1 pct, Nasdaq 0.2 pct   (Updates prices)"
2014-12-22,9:20 PM,US STOCKS-Wall St up for fourth straight day; S&P ends at record,"* Indexes up: Dow 0.9 pct, S&P 0.4 pct, Nasdaq 0.3 pct   (Updates to close)"
2014-12-22,9:50 PM,"US STOCKS-Dow, S&P end at records in 4th straight day of gains for Wall St","* Dow boosted by gains at Intel, IBM; Dow, S&P end at record"
2015-01-03,12:10 AM,Vuzix says received Intel investment for smart glasses,"SAN FRANCISCO, Jan 2 Vuzix Corporation said on Friday that Intel Corp invested $24.8 million in the company to speed up the launch of Internet-connected eyewear."
2015-01-03,12:15 AM,Vuzix says received Intel investment for smart glasses,SAN FRANCISCO Vuzix Corporation said on Friday that Intel Corp invested $24.8 million in the company to speed up the launch of Internet-connected eyewear.
2015-01-07,2:51 AM,Intel Corp chief shows wrist-worn drone; promises to employ more women,"SAN FRANCISCO, Jan 6 Intel Corp Chief Executive Brian Krzanich showed off a computer built into a jacket button and a wristband that transforms into a selfie-snapping flying camera, as the chipmaker extends its push into smart wearable gadgets."
2015-01-07,2:55 AM,Intel Corp chief shows wrist-worn drone; promises to employ more women,"SAN FRANCISCO Intel Corp  Chief Executive Brian Krzanich showed off a computer built into a jacket button and a wristband that transforms into a selfie-snapping flying camera, as the chipmaker extends its push into smart wearable gadgets. | Video"
2015-01-12,9:46 PM,"Disney, Sony, DreamWorks seek to throw out anti-poaching lawsuit","Jan 12 Walt Disney Co, Sony Corp  and DreamWorks Animation SKG Inc urged a federal judge to throw out a antitrust lawsuit accusing them of conspiring not to poach each other's animators in order to keep wages down."
2015-01-15,9:21 PM,Intel revenue rises 6.4 pct,Jan 15 Intel Corp reported a 6.4 percent rise in quarterly revenue as sales of personal computers stabilized.
2015-01-15,10:35 PM,US STOCKS-Wall St drops for 5th day on global weakness worry; Intel down late,* Swiss National Bank scraps three-year-old euro cap on franc
2015-01-15,10:15 PM,UPDATE 2-Intel forecasts disappointing revenue; shares fall,"Jan 15 Chipmaker Intel Corp forecast current-quarter revenue and gross margins that disappointed investors, sending its shares down more than 2 percent in extended trading."
2015-01-15,9:24 PM,Intel forecasts disappointing revenue; shares fall,"Chipmaker Intel Corp  forecast current-quarter revenue and gross margins that disappointed investors, sending its shares down more than 2 percent in extended trading."
2015-01-16,12:25 AM,UPDATE 3-Intel forecasts disappointing revenue; shares fall,"Jan 15 Chipmaker Intel Corp forecast revenue and gross margins for this quarter that disappointed investors, sending its shares down 2.7 percent in extended trading."
2015-01-16,12:15 PM,"US STOCKS-Futures fall, Wall Street set to post weekly decline","NEW YORK, Jan 16 U.S. stock index futures edged lower on Friday, following five straight days of losses for major indexes, setting Wall Street up for its fourth negative week out of the past six."
2015-01-16,12:35 PM,US STOCKS-Futures fall in wake of Swiss move; Wall St to drop for week,"* Futures off: Dow 68 pts, S&P 7.5 pts, Nasdaq 29 pts   (Adds FXCM, Interactive Brokers)"
2015-01-16,1:15 PM,Kynikos' Chanos says he is short Intel Corp - CNBC,"NEW YORK, Jan 16 Jim Chanos, founder of hedge fund firm Kynikos Associates, said Friday that he is betting against the shares of Intel Corp."
2015-01-16,2:00 PM,UPDATE 1-Hedge fund founder Chanos says shorting Intel shares - CNBC,"NEW YORK, Jan 16 Jim Chanos, founder of hedge fund firm Kynikos Associates, said on Friday he is betting against the shares of chipmaker Intel Corp."
2015-01-16,1:20 PM,Hedge fund founder Chanos says shorting Intel shares: CNBC,"NEW YORK Jim Chanos, founder of hedge fund firm Kynikos Associates, said on Friday he is betting against the shares of chipmaker Intel Corp."
2015-01-16,2:15 PM,"US STOCKS-Wall St to dip at open on heels of Swiss move, data","* Futures off: Dow 58 pts, S&P 5 pts, Nasdaq 16 pts   (Adds quote, data)"
2015-01-16,3:00 PM,"US STOCKS-Wall St steadies on heels of Swiss move, data","* Indexes up: Dow 0.14 pct, S&P 0.31 pct, Nasdaq 0.43 pct   (Adds quote, data)"
2015-01-20,11:35 PM,UPDATE 1-AMD first-quarter revenue forecast disappoints,"Jan 20 U.S. chipmaker Advanced Micro Devices Inc  forecast weaker-than-expected first-quarter revenue and said it taking steps to return its computing and graphics businesses to a ""healthy trajectory"" from the second quarter."
2015-01-21,12:10 AM,AMD first-quarter revenue forecast disappoints,"U.S. chipmaker Advanced Micro Devices Inc  forecast weaker-than-expected first-quarter revenue and said it taking steps to return its computing and graphics businesses to a ""healthy trajectory"" from the second quarter."
2015-01-21,7:35 AM,UPDATE 5-ASML shares hit record after fourth quarter tops forecasts,"* Shares hit record high before easing, up 0.6 percent   (Updates shares, writes through)"
2015-02-02,9:30 AM,"Intel buys former Infineon ""Internet of Things"" chip unit Lantiq","FRANKFURT, Feb 2 Intel has agreed to buy German network chipmaker Lantiq for an undisclosed amount to expand its range of chips used in Internet-connected gadgets, the companies said on Monday."
2015-02-02,9:36 AM,Intel buys former Infineon 'Internet of Things' chip unit Lantiq,"FRANKFURT Intel has agreed to buy German network chipmaker Lantiq for an undisclosed amount to expand its range of chips used in Internet-connected gadgets, the companies said on Monday."
2015-02-02,7:52 PM,"Intel buys former Infineon ""Internet of Things"" chip unit Lantiq","FRANKFURT Intel has agreed to buy German network chipmaker Lantiq for an undisclosed amount to expand its range of chips used in Internet-connected gadgets, the companies said on Monday."
2015-02-06,6:21 PM,"Chipmaker Intel promotes senior executives, duties unchanged","SAN FRANCISCO, Feb 6 Chipmaker Intel Corp  said on Friday it promoted five top executives to senior vice president and that their duties would remain largely the same."
2015-02-06,6:25 PM,"Chipmaker Intel promotes senior executives, duties unchanged",SAN FRANCISCO Chipmaker Intel Corp said on Friday it promoted five top executives to senior vice president and that their duties would remain largely the same.
2015-02-18,12:55 AM,"Soros bet on Devon Energy, Transocean ahead of oil price rise","NEW YORK, Feb 17 Soros Fund Management LLC took new positions in the energy sector in the fourth quarter, including stakes in Devon Energy Corp and Transocean Ltd , a regulatory filing showed Tuesday."
2015-02-24,4:05 PM,Former McAfee president leaves Intel to run ForeScout,"Feb 24 Mike DeCesare, a senior executive with Intel Corp's security group, has left the company and taken a job running privately held cybersecurity firm ForeScout."
2015-02-24,4:10 PM,Former McAfee president leaves Intel to run ForeScout,"Mike DeCesare, a senior executive with Intel Corp's security group, has left the company and taken a job running privately held cybersecurity firm ForeScout."
2015-02-26,11:06 AM,'Jihadi John' killer from Islamic State beheading videos unmasked as Londoner,"LONDON/WASHINGTON The masked ""Jihadi John"" killer who fronted Islamic State beheading videos has been identified as Mohammed Emwazi, a British computer programming graduate from a well-to-do London family who was known to the security services."
2015-02-27,12:07 AM,'Jihadi John' killer from Islamic State beheading videos unmasked as Londoner,"LONDON/WASHINGTON The masked ""Jihadi John"" killer who fronted Islamic State beheading videos has been identified as Mohammed Emwazi, a British computer programming graduate from a well-to-do London family who was known to the security services."
2015-02-27,4:50 PM,UPDATE 1-Lenovo to allay security concerns with free McAfee LiveSafe,"Feb 27 China's Lenovo Group Ltd on Friday said it will offer free subscriptions to Intel Corp  security software to customers who bought laptops that were shipped with a program known as ""Superfish,"" which made PCs vulnerable to cyberattacks."
2015-02-27,11:36 AM,British PM Cameron vows to hunt down 'Jihadi John',"LONDON British Prime Minister David Cameron vowed on Friday to use all means at his disposal to hunt down militants such as ""Jihadi John"" after the killer was identified as a Kuwaiti-born computer programming graduate from London. | Video"
2015-02-27,5:14 PM,British TV shows student picture of 'Jihadi John' in baseball cap,"LONDON British television broadcast the first picture of Mohammed Emwazi as a student on Friday, showing the man identified as the Islamic State ""Jihadi John"" killer with a mustache and goatee beard wearing a large baseball cap. | Video"
2015-03-02,7:46 AM,'Jihadi John' part of network linked to failed London bombers: court papers,"LONDON Islamist militant Mohammed Emwazi, identified as 'Jihadi John,' was a  member of a network in contact with one of the men convicted of trying to bomb the British capital's underground railway in 2005, according to the government."
2015-03-02,8:16 AM,"BRIEF-Ericsson, Intel CEOs say in partnership to develop cloud based software and hardware products","* Ericsson, Intel CEOs say in partnership to develop cloud based software and hardware products  Further company coverage:"
2015-03-02,2:00 PM,Ericsson joins with Intel to help telecoms firms get in the cloud,"BARCELONA, March 2 Telecom equipment maker Ericsson and chipmaker Intel have agreed a partnership deal to help network operator customers build datacentres, putting them on a more competitive footing against big, cloud-based Internet firms such as Google, Facebook and Amazon."
2015-03-02,2:00 PM,Intel launches chip for new push into low-price smartphones,"SAN FRANCISCO, March 2 Intel Corp is shipping new mobile chips that represent the semiconductor company's biggest hope for making progress in smartphones this year."
2015-03-02,2:05 PM,Ericsson joins with Intel to help telecoms firms get in the cloud,"BARCELONA Telecom equipment maker Ericsson and chipmaker Intel have agreed a partnership deal to help network operator customers build datacenters, putting them on a more competitive footing against big, cloud-based Internet firms such as Google, Facebook and Amazon."
2015-03-02,2:05 PM,Intel launches chip for new push into low-price smartphones,SAN FRANCISCO Intel Corp is shipping new mobile chips that represent the semiconductor company's biggest hope for making progress in smartphones this year.
2015-03-03,11:45 AM,Israel's TowerJazz to produce sensors for Intel's 3D cameras,"TEL AVIV, March 3 TowerJazz has won a contract from Intel Corp to produce infrared sensors for Intel's 3D cameras, the Israeli chip manufacturer said on Tuesday."
2015-03-05,5:34 AM,"Huawei, Intel expand tie-up amid China's rising scrutiny of U.S. tech firms","BEIJING, March 5 China's Huawei Technologies Co Ltd and Intel Corp are expanding an existing alliance to provide cloud computing to global telecoms carriers, as U.S. tech firms vie for Chinese tie-ups to retain access to a tough mainland market."
2015-03-05,5:36 AM,"Huawei, Intel expand tie-up amid China's rising scrutiny of U.S. tech firms","BEIJING China's Huawei Technologies Co Ltd [HWT.UL] and Intel Corp are expanding an existing alliance to provide cloud computing to global telecoms carriers, as U.S. tech firms vie for Chinese tie-ups to retain access to a tough mainland market."
2015-03-11,10:29 AM,Swiss makers quietly gear up with smartwatches of their own,* Industry starting to think Apple Watch may boost luxury sales
2015-03-12,1:35 PM,"US STOCKS SNAPSHOT-Wall St opens higher, Intel weighs on Nasdaq","March 12 U.S. stocks opened higher on Thursday, rebounding after two days of declines, though shares of Intel Corp weighed on Nasdaq after the company warned that first-quarter revenue would be weaker than expected."
2015-03-12,1:55 PM,US STOCKS-Wall St up after recent declines; Intel weighs,"* Indexes up: Dow 0.9 pct, S&P 0.7 pct, Nasdaq 0.3 pct   (Updates to market open, adds Intel outlook)"
2015-03-12,3:00 PM,"US STOCKS-Wall St up in broad rally, but Intel weighs on Nasdaq","* Indexes up: Dow 0.9 pct, S&P 0.8 pct, Nasdaq 0.4 pct   (Updates to mid-morning trading)"
2015-03-12,4:20 PM,US STOCKS-Wall St up 1 pct in broad rally; Intel weighs on Nasdaq,"* Indexes up: Dow 1 pct, S&P 0.9 pct, Nasdaq 0.5 pct   (Updates to afternoon trading)"
2015-03-12,6:30 PM,Fitch: Intel Outlook Could Signal PC Market Hasn't Stabilized,"(The following statement was released by the rating agency) CHICAGO, March 12 (Fitch) Intel's negative pre-announcement this morning  suggests the end of support for Windows XP was a more significant factor than  previously estimated in last year's perceived stabilizing personal computer (PC)  demand, according to Fitch Ratings. Consequently, extended PC refresh cycles may  result in a resumption of negative PC sales growth. Intel Thursday changed its first-quarter revenue outlook as a function"
2015-03-12,7:05 PM,US STOCKS-Wall St bounces back in broad rally; bank shares gain,"* Indexes up: Dow 1.2 pct, S&P 1 pct, Nasdaq 0.7 pct   (Updates to late afternoon)"
2015-03-12,8:30 PM,US STOCKS-Wall St bounces back in broad rally; bank shares gain,"* Indexes up: Dow 1.5 pct, S&P 1.3 pct, Nasdaq 0.9 pct   (Updates to close)"
2015-03-12,9:10 PM,US STOCKS-Wall St bounces back in broad rally; bank shares gain,"* Indexes up: Dow 1.5 pct, S&P 1.3 pct, Nasdaq 0.9 pct   (Updates close with latest volume, Disney, Mattel shares up)"
2015-03-12,1:40 PM,CORRECTED-UPDATE 4-Intel cuts revenue forecast as desktop demand weakens,"March 12 Intel Corp slashed nearly $1 billion from its first-quarter revenue forecast as small businesses put off upgrading their personal computers, sending the chipmaker's shares down more than 5 percent."
2015-03-12,11:12 AM,Wall St. bounces back in broad rally; bank shares gain,"NEW YORK U.S. stocks rose in a broad rally on Thursday, bouncing back from two days of losses, helped by weaker retail sales that paused the dollar's recent rally and tempered the outlook for interest rates. | Video"
2015-03-19,6:06 AM,UPDATE 1-Chip designer ARM sees 20 pct market share in servers by 2020,"* Chips would be priced less than leader Intel's   (Adds details, quotes)"
2015-03-19,1:40 PM,"CORRECTED-Tag Heuer unveils smartwatch venture with Intel, Google","BASEL, Switzerland, March 19 Tag Heuer, French luxury group LVMH's biggest watch maker, announced a partnership with Google Inc and Intel Corp to create a luxury smartwatch to compete head-on with Apple Inc ."
2015-03-19,2:20 PM,"UPDATE 2-Tag Heuer, Intel challenge Apple with Android smartwatch","BASEL, Switzerland, March 19 Tag Heuer, French luxury group LVMH's biggest watch maker, said it will launch a smartwatch later this year using Google Inc's  Android operating system in a venture with Intel Corp  to compete head-on with the Apple Watch."
2015-03-19,1:53 PM,"Tag Heuer, Intel challenge Apple with Android smartwatch","BASEL, Switzerland Tag Heuer, French luxury group LVMH's  biggest watch maker, said it will launch a smartwatch later this year using Google Inc's  Android operating system in a venture with Intel Corp  to compete head-on with the Apple Watch."
2015-03-25,12:50 AM,THAILAND PRESS-Intel to support govt's digital economy plan - The Nation,"Intel has announced its support for the government's ""digital economy"" strategy through its technologies and knowledge, the Nation reported, citing Intel Southeast Asia's director of public policy, Worapat Patram."
2015-03-27,7:51 PM,Intel in talks to buy Altera - WSJ,"March 27 Chipmaker Intel Corp is in talks to buy Altera Corp, the Wall Street Journal said, citing people familiar with the matter."
2015-03-27,8:30 PM,US STOCKS-Wall St ends 4-day skid on late tech rally,"* Indexes up: Dow 0.19 pct, S&P 0.24 pct, Nasdaq 0.57 pct   (Updates to market close)"
2015-03-27,9:30 PM,Big win for Altera call buyers on talk of Intel deal,NEW YORK News that chipmaker Intel Corp  is in talks to buy Altera Corp  sparked a flurry of trades in its short-term calls and could spell huge gains for some timely buyers of the options.
2015-03-27,8:15 PM,"UPDATE 3-Intel in talks to buy Altera, shares of firms surge","March 27 Intel Corp is in talks to buy fellow chipmaker Altera Corp in a deal likely to top $10 billion, according to a source familiar with the matter, making it Intel's biggest purchase ever and the latest merger in the quickly consolidating semiconductor sector."
2015-03-27,7:54 PM,"Intel in talks to buy Altera, shares of firms surge","Intel Corp  is in talks to buy fellow chipmaker Altera Corp  in a deal likely to top $10 billion, according to a source familiar with the matter, making it Intel's biggest purchase ever and the latest merger in the quickly consolidating semiconductor sector."
2015-03-30,5:45 AM,Europe Factors to Watch-Shares set to rise; techs in focus,"PARIS, March 30 European stocks were set to rise on Monday, bouncing back from last week's losses with tech shares in focus after news of merger talks in the sector spurred a late-session rally on Wall Street on Friday.     Intel Corp is in talks to buy fellow chipmaker Altera Corp  in a deal likely to top $10 billion, according to a source familiar with the matter, which would make it Intel's biggest acquisition ever and the latest merger in the quickly consolidating semiconductor s"
2015-03-30,7:10 AM,"European stocks bounce back, helped by techs","PARIS, March 30 European stocks rose early on Monday, bouncing back from last week's losses with tech shares rallying after news of merger talks in the sector spurred a late-session rally on Wall Street on Friday."
2015-03-30,8:15 AM,Rallying techs help European stocks bounce back,* Lafarge drops as two Holcim shareholders reject revised deal
2015-03-30,11:25 AM,"US STOCKS-Futures higher, but crude oil weakens",* M&A deal lifts sentiment; UnitedHealth unit to buy Catamaran
2015-03-30,12:45 PM,US STOCKS-Futures point to higher open on M&A activity,* M&A deal lifts sentiment; UnitedHealth unit to buy Catamaran
2015-03-30,2:10 PM,US STOCKS-Wall St higher as biotechs rally on M&A deals,* M&A deal lifts sentiment; biotech coming off big weekly decline
2015-03-30,4:00 PM,US STOCKS-Wall St higher as biotechs rally on M&A deals,* M&A deal lifts sentiment; biotech coming off big weekly decline
2015-03-30,6:50 PM,US STOCKS-Wall St bounces back from recent losses; deals help,* M&A deal lifts sentiment; biotech coming off big weekly decline
2015-03-30,10:40 AM,Deals of the day- Mergers and acquisitions,"March 30 The following bids, mergers, acquisitions and disposals were reported by 1400 GMT on Monday:"
2015-04-01,3:22 PM,"Charities that funded Cage, one time supporter of IS's Emwazi, under pressure","LONDON (This story corrects name in paragraph 18 to Network for Social Change, from Network for Social Change Charitable Trust to March 4 story)"
2015-04-02,12:06 PM,Check Point to buy Israel's Lacoon Mobile Security,"TEL AVIV Internet and network security provider Check Point Software Technologies will buy Israel-based Lacoon Mobile Security for tens of millions of dollars, it said on Thursday."
2015-04-02,4:36 PM,BRIEF-Ingenico Group and Intel to bring payments to the Internet of Things,* Ingenico Group and Intel Corp to bring payments to the Internet of Things
2015-04-06,7:50 PM,Tweet on Altera-Intel talks came after options trades,"NEW YORK, April 6 A March 27 tweet sent the same minute as news broke that chipmaker Intel Corp was in talks to buy Altera Corp appeared to come after very timely trades in Altera's options by several seconds, according to Thomson Reuters data."
2015-04-06,8:00 PM,Tweet on Altera-Intel talks came after options trades,"NEW YORK A March 27 tweet sent the same minute as news broke that chipmaker Intel Corp was in talks to buy Altera Corp appeared to come after very timely trades in Altera's options by several seconds, according to Thomson Reuters data."
2015-04-09,1:20 PM,"Takeover talks between Altera, Intel end - CNBC","April 9 Takeover talks between chipmakers Intel Corp and Altera Corp have broken off, CNBC reported Thursday, citing unnamed sources."
2015-04-09,3:05 PM,"US STOCKS-Wall St searches for direction with data, earnings eyed","* Indexes down: Dow 0.3 pct; S&P 0.2 pct, Nasdaq 0.2 pct   (Adds comment, updates prices)"
2015-04-09,4:45 PM,"US STOCKS-Wall St little changed with data, earnings eyed","* Dow flat, S&P up 0.1 pct, Nasdaq up 0.1 pct   (Updates to early afternoon)"
2015-04-09,10:01 AM,Deals of the day- Mergers and acquisitions,"April 9 The following bids, mergers, acquisitions and disposals were reported by 2000 GMT on Thursday:"
2015-04-09,1:55 PM,"UPDATE 4-Intel, Altera end takeover talks due to price disagreement -source","April 9 Discussions on a takeover by Intel Corp  of smaller chip maker Altera Corp have ended as the companies were unable to agree on price, a person familiar with the matter said, but Altera shares rose, suggesting it is still a potential target."
2015-04-09,1:25 PM,"Intel, Altera end takeover talks due to price disagreement: source","Discussions on a takeover by Intel Corp of smaller chip maker Altera Corp have ended as the companies were unable to agree on price, a person familiar with the matter said, but Altera shares rose, suggesting it is still a potential target."
