date,time,title,abstract
2014-01-17,8:13 PM,Intel to reduce global workforce by five percent in 2014,"SAN FRANCISCO Intel Corp plans to reduce its global workforce of 107,000 by about 5 percent this year as the chipmaker, struggling with falling personal-computer sales, shifts focus to faster-growing areas, a company spokesman said on Friday."
2014-01-20,3:11 AM,India Morning Call-Global Markets,"NEW YORK - The S&P 500 and Nasdaq declined on Friday as results from Intel and General Electric were the latest to dampen the view on fourth-quarter earnings. Volatility picked up late in the session, thanks in part to selling related to options expiration, analysts said. Earnings season is still in the early phase, but S&P 500 companies so far are beating analysts' expectations at a rate that is below what is typical, according to Thomson Reuters data."
2014-01-21,3:16 AM,India Morning Call-Global Markets,NEW YORK - The S&P 500 and Nasdaq declined on Friday as results from Intel and General Electric GE.N were the latest to dampen the view on fourth-quarter earnings.
2014-01-21,10:42 PM,UPDATE 1-Chipmaker AMD forecasts revenue below estimates,"Jan 21 Chipmaker Advanced Micro Devices Inc  forecast a steeper-than-expected fall in current quarter revenue, signaling that sales of gaming consoles were not growing fast enough to offset slowing PC sales."
2014-01-21,12:00 AM,Analysis: Verizon deal may push U.S. cable to offer online TV services,Verizon Communications Inc's acquisition of Intel Corp's venture to create a web-based TV service may be the catalyst that pushes U.S. cable players to start similar products to fend off fast-growing video rivals such as Netflix Inc and Amazon.com Inc.
2014-01-26,1:51 PM,Intel expects to make decision this year on next new chip plant,"TEL AVIV, Jan 26 U.S. chip manufacturer Intel Corp expects to make a decision this year on the location of a new multi-billion dollar semiconductor plant using new 10 nanometre technology, executives at its Israeli unit said on Sunday."
2014-01-26,2:25 PM,Intel expects to make decision this year on next new chip plant,"TEL AVIV U.S. chip manufacturer Intel Corp expects to make a decision this year on the location of a new multi-billion dollar semiconductor plant using new 10 nanometer technology, executives at its Israeli unit said on Sunday."
2014-01-28,1:46 PM,STMicro's fourth-quarter revenue stagnates,STMicroelectronics NV  posted lower quarterly revenue and a narrow loss on Monday underscoring how the European chipmaker is losing ground to rivals as orders from its key customer Nokia  shrink.
2014-01-28,8:11 PM,Facebook eyes options for low-power server technology,"SAN JOSE, Calif., Jan 28 Facebook Inc's  hardware whiz in charge of revolutionizing data centers lauded on Tuesday low-energy server technology which is expected to compete against heavyweight Intel Corp."
2014-01-28,9:47 PM,UPDATE 1-Facebook cites progress on low-power server technology,"SAN JOSE, Calif., Jan 28 Facebook Inc's  executive in charge of revolutionizing data centers on Tuesday lauded low-energy server technology that is expected to compete against heavyweight Intel Corp."
2014-01-30,12:06 AM,"UPDATE 3-Qualcomm says year on track, focuses on China","SAN FRANCISCO, Jan 29 Leading mobile chipmaker Qualcomm Inc posted higher fiscal first-quarter revenue that slightly missed estimates as smartphone growth shifted to China, but it bumped up its full-year earnings outlook and said 2014 was playing out as expected."
2014-02-03,11:36 PM,Intel tightens executive pay as PC demand slows,"SAN FRANCISCO, Feb 3 Intel Corp, wrestling with shrinking personal computer sales and struggling to expand into mobile devices, said on Monday it was tightening its compensation policy to make senior executives more accountable."
2014-02-03,11:36 PM,Intel tightens executive pay as PC demand slows,"SAN FRANCISCO Intel Corp, wrestling with shrinking personal computer sales and struggling to expand into mobile devices, said on Monday it was tightening its compensation policy to make senior executives more accountable."
2014-02-18,8:26 PM,Intel aims to boost corporate demand with high-end server chip,"SAN FRANCISCO, Feb 18 Intel Corp  unveiled a new high-end processor aimed at boosting lackluster demand from corporate customers like banks and retailers."
2014-02-23,6:11 PM,"Alcatel vows to stay out of telecom gear price war, signs Intel deal","BARCELONA, Feb 23 Alcatel-Lucent said it would stay out of a brewing price war in the telecom equipment market and set itself apart with better service and new products, including those from a new partnership announced on Sunday with Intel Corp."
2014-02-23,10:06 PM,"UPDATE 1-Alcatel to stay out of telecom price war, inks Intel deal","BARCELONA, Feb 23 Alcatel-Lucent said it would stay out of a brewing price war in the telecom equipment market and set itself apart with better service and new products, including those from a partnership announced on Sunday with Intel Corp."
2014-03-10,2:00 PM,UPDATE 1-Chinese state-owned firm offers to buy chipmaker Montage,"March 10 A Chinese state-owned company offered to buy Montage Technology Group, a Shanghai-based chipmaker, in a deal valued at about $600 million, roughly four months after failing to buy rival RDA Microelectronics Inc ."
2014-03-11,10:10 PM,"Blackstone buys most of Accuvant, valuing firm at about $225 mln","BOSTON, March 11 Blackstone Group, the world's biggest alternative asset manager, said on Tuesday it has agreed to buy most of cybersecurity firm Accuvant Inc from investment firm Sverica International."
2014-03-13,12:05 PM,"Intel lead on conflict minerals helps, challenges other firms","March 13 (Thomson Reuters Foundation) - Intel Corp has spent more than five years figuring out how to rid its supply chain of minerals that finance violence in the Democratic Republic of Congo region, and now it is offering to show other companies how they can do the same."
2014-03-13,12:10 PM,"Intel lead on conflict minerals helps, challenges other firms","March 13 (Thomson Reuters Foundation) - Intel Corp has spent more than five years figuring out how to rid its supply chain of minerals that finance violence in the Democratic Republic of Congo region, and now it is offering to show other companies how they can do the same."
2014-03-20,9:00 AM,UPDATE 1-Britain's ARM targets 10 percent of server chip design market by 2017,"* Sees value of ARM-based wearables, related devices at $20 bln by 2018"
2014-03-26,3:00 PM,Intel and Altera widen chip manufacturing agreement,"SAN FRANCISCO, March 26 Chipmaker Altera Corp  is working with Intel Corp to combine separate components like processors, memory and programmable chips into customized devices in a technique aimed at reducing manufacturing costs and improving performance."
2014-03-26,5:55 PM,UPDATE 1-Intel widens agreement to manufacture chips for Altera,"* Technology aims to make chips more efficient   (Adds comment from Intel executive, stock prices)"
2014-03-26,3:10 PM,Intel widens agreement to manufacture chips for Altera,"SAN FRANCISCO Chipmaker Altera Corp is working with Intel Corp to combine separate components like processors, memory and programmable chips into customized devices in a technique aimed at reducing manufacturing costs and improving performance."
2014-03-27,4:20 PM,Intel takes stake in Big Data startup Cloudera,"SAN FRANCISCO, March 27 Intel Corp said on Thursday it made a significant investment in Cloudera and will make the fast-growing startup its preferred distributor of software for crunching Big Data."
2014-03-27,4:51 PM,UPDATE 2-Intel takes 'significant' stake in Big Data startup Cloudera,"SAN FRANCISCO, March 27 Intel Corp said on Thursday it made a significant investment in Cloudera and will make the fast-growing startup its preferred distributor of software for crunching Big Data."
2014-03-27,4:21 PM,Intel takes 'significant' stake in Big Data startup Cloudera,SAN FRANCISCO Intel Corp said on Thursday it made a significant investment in Cloudera and will make the fast-growing startup its preferred distributor of software for crunching Big Data.
2014-03-27,10:40 AM,Deals of the day- Mergers and acquisitions,"(Adds Finnair, Cargill, SoftBank, Grupo, DIA, Intel; Updates Yahoo Japan)"
2014-03-27,9:50 PM,Swedish eye tracking technology firm Tobii plans IPO -report,"STOCKHOLM, March 27 Swedish eye tracking technology firm Tobii, co-owned by chipmaker Intel, is planning a stock market listing which could value the firm at around 2 billion crowns ($309 million), business daily Dagens Industri reported."
2014-03-27,9:51 PM,Swedish eye tracking technology firm Tobii plans IPO: report,"STOCKHOLM Swedish eye tracking technology firm Tobii, co-owned by chipmaker Intel, is planning a stock market listing which could value the firm at around 2 billion crowns ($309 million), business daily Dagens Industri reported."
2014-03-31,11:01 AM,Intel invested $740 million to buy 18 percent of Cloudera,"SAN FRANCISCO, March 31 Intel Corp's  investment in Cloudera announced last week amounts to $740 million and gives the chipmaker an 18 percent stake in the distributor of software for crunching Big Data, Cloudera said in a press release on Monday."
2014-03-31,11:06 AM,Intel invested $740 million to buy 18 percent of Cloudera,"SAN FRANCISCO Intel Corp's investment in Cloudera announced last week amounts to $740 million and gives the chipmaker an 18 percent stake in the distributor of software for crunching Big Data, Cloudera said in a press release on Monday."
2014-04-03,8:31 PM,Globalfoundries edges out Intel for IBM chip-making business -WSJ,"April 3 Contract chipmaker Globalfoundries has emerged as the leading candidate to buy IBM's  semiconductor operations, edging out Intel Corp, the Wall Street Journal cited unidentified sources as saying on Thursday."
2014-04-03,8:35 PM,Globalfoundries edges out Intel for IBM chip-making business: WSJ,"Contract chipmaker Globalfoundries has emerged as the leading candidate to buy IBM's semiconductor operations, edging out Intel Corp, the Wall Street Journal cited unidentified sources as saying on Thursday."
2014-04-04,4:16 AM,Market Chatter- Corporate finance press digest,April 4 The following corporate finance-related stories were reported by media:
2014-04-07,9:15 PM,Intel adjusts financial reporting to reflect mobile gadgets,"SAN FRANCISCO, April 7 Chipmaker Intel Corp  said on Monday it was adjusting its financial reporting structure to better reflect its focus on two key areas: mobile and the growing field of linking up electronic devices."
2014-04-07,9:15 PM,Intel adjusts financial reporting to reflect mobile gadgets,SAN FRANCISCO Chipmaker Intel Corp said on Monday it was adjusting its financial reporting structure to better reflect its focus on two key areas: mobile and the growing field of linking up electronic devices.
2014-04-08,6:55 PM,"Intel closes Costa Rica operation, cuts 1,500 jobs","SAN FRANCISCO, April 8 Chipmaker Intel, struggling with a shrinking personal computer market, is shutting its assembly and test operation in Costa Rica and eliminating 1,500 jobs, a spokesman said on Tuesday."
2014-04-08,7:35 PM,"UPDATE 2-Intel closes Costa Rica operation, cuts 1,500 jobs","(Adds details on plan for Costa Rica, background; adds share price)"
2014-04-08,6:59 PM,"Intel closes Costa Rica operation, cuts 1,500 jobs","SAN FRANCISCO Chipmaker Intel, struggling with a shrinking personal computer market, is shutting its assembly and test operation in Costa Rica and eliminating 1,500 jobs, a spokesman said on Tuesday."
2014-04-09,1:00 AM,"UPDATE 3-Intel closes Costa Rica operation, cuts 1,500 jobs","SAN FRANCISCO, April 8 Chipmaker Intel, struggling with a shrinking personal computer market, is shutting its assembly and test operation in Costa Rica and eliminating 1,500 jobs, a spokesman said on Tuesday."
2014-04-10,10:50 PM,'Heartbleed' computer bug threat spreads to firewalls and beyond,"BOSTON, April 10 Hackers could crack email systems, security firewalls and possibly mobile phones through the ""Heartbleed"" computer bug, according to security experts who warned on Thursday that the risks extended beyond just Internet Web servers."
2014-04-11,11:04 AM,"Exclusive: Microsoft, Apple diverge on bankrolling big patent buyer","SAN FRANCISCO Patent buyer Intellectual Ventures has persuaded Microsoft and Sony to invest in its latest acquisition fund while Apple and Intel, which invested with IV previously, declined to participate, according to people briefed on the fundraising."
2014-04-15,8:15 PM,Intel's first-quarter net profit falls as PC market shrinks,"SAN FRANCISCO, April 15 Intel Corp  posted first-quarter net earnings of $1.947 billion, or 38 cents a share, compared with $2.045 billion, or 40 cents a share, in the year-ago quarter as the chipmaker wrestled with shrinking demand for personal computers."
2014-04-15,9:00 PM,US STOCKS-Wall St ends higher as blue chips rally; Intel up late,"* Dow up 0.6 pct; S&P 500 up 0.7 pct; Nasdaq up 0.3 pct   (Updates to close, adds gains in Intel and Yahoo after the bell on results )"
2014-04-15,9:30 PM,"GLOBAL MARKETS-Ukraine worries weigh on global shares, drive up bonds","* Brent oil falls as investors weigh Libya, Ukraine   (Adds close of U.S. markets)"
2014-04-15,8:27 PM,"UPDATE 3-Intel's quarterly net beats Street, CEO talks up tablets","SAN FRANCISCO, April 15 Intel Corp's  first-quarter net profit exceeded Wall Street's estimates as the chipmaker wrestles with slow demand for personal computers and its chief executive officer said an ambitious goal to stake out market share in tablets was on track."
2014-04-15,8:15 PM,"Intel's quarterly net beats Street, CEO talks up tablets",SAN FRANCISCO Intel Corp's first-quarter net profit exceeded Wall Street's estimates as the chipmaker wrestles with slow demand for personal computers and its chief executive officer said an ambitious goal to stake out market share in tablets was on track.
2014-04-30,5:55 PM,Intel submits plan to upgrade Israeli chip plant,"JERUSALEM, April 30 U.S. chip manufacturer Intel Corp said on Wednesday it had submitted a business plan to upgrade a facility in southern Israel."
2014-05-05,10:12 AM,Intel submits plan for nearly $6 bln Israel chip plant upgrade,"JERUSALEM, May 5 Chip giant Intel Corp  submitted a plan to Israel's government to invest 20 billion shekels ($5.8 billion) in upgrading its plant in southern Israel, the Economy Ministry said on Monday."
2014-05-05,4:20 PM,Intel hires ex-Staples exec to head up marketing,"SAN FRANCISCO, May 5 Intel Corp has hired senior Staples executive Steven Fund to oversee its global marketing, a novel hire for the engineering-intensive company and one it hopes can change the way it positions products in a shrinking PC market."
2014-05-05,10:02 PM,UPDATE 1-Intel hires Staples executive to shake up marketing,"(Adds detail on hire, background on Intel marketing; byline)"
2014-05-05,4:25 PM,Intel hires Staples executive to shake up marketing,"SAN FRANCISCO Intel Corp has hired senior Staples executive Steven Fund to oversee its global marketing, a novel pick that the chipmaker hopes will improve its profile in an industry where laptops have become blasé compared to tablets and smartphones."
2014-05-05,10:36 PM,Seven workers exposed in 'hazmat situation' at Intel plant in Arizona,"PHOENIX, May 5 Seven workers were exposed on Monday in a ""hazmat situation"" at an Intel manufacturing complex in Chandler, Arizona, authorities said."
2014-05-05,11:16 PM,UPDATE 2-Workers exposed to chemical leak at Intel plant in Arizona,"PHOENIX, May 5 A chemical leak at Intel Corp's  manufacturing complex in Arizona has been contained and two workers were taken to hospital for observation, a spokesman for the chipmaker said on Monday."
2014-05-05,10:41 PM,Workers exposed to chemical leak at Intel plant in Arizona,"PHOENIX A chemical leak at Intel Corp's manufacturing complex in Arizona has been contained and two workers were taken to hospital for observation, a spokesman for the chipmaker said on Monday."
2014-05-06,3:30 PM,-EU court to rule June 12 on Intel challenge to $1.5 bln EU fine,"BRUSSELS, May 6 Europe's second-highest court will rule next month on U.S. chipmaker Intel Corp's  challenge to a record 1.06-billion-euro ($1.47 billion) fine levied by EU antitrust regulators five years ago, a court official said on Tuesday."
2014-05-14,1:00 PM,Intel trims marketing staff ahead of new chief's arrival,"SAN FRANCISCO, May 14 Intel Corp is shedding jobs in its marketing department ahead of the arrival of new chief marketing officer Steven Fund, who the struggling chipmaker is betting will restore some shine to its brand."
2014-05-17,8:32 PM,Intel's CEO looks to hobbyists for wearable innovations,"SAN MATEO, Calif., May 17 Intel Corp's  Chief Executive Officer Brian Krzanich mingled with electronics buffs at Silicon Valley's annual maker mecca on Saturday as the chipmaker looks to amateur inventors to inspire a new wave of smart clothing."
2014-05-17,10:10 PM,Intel's CEO looks to hobbyists for wearable innovations,"SAN MATEO, California Intel Corp's Chief Executive Officer Brian Krzanich mingled with electronics buffs at Silicon Valley's annual maker mecca on Saturday as the chipmaker looks to amateur inventors to inspire a new wave of smart clothing."
2014-05-18,6:53 PM,Exclusive: Intel CEO promises Broadwell PCs on shelves for holidays,"SAN MATEO, California Intel Corp's next-generation Broadwell processors will ship in time to be used in personal computers sold during the holiday season but probably won't be available for back-to-school shopping, Chief Executive Brian Krzanich said."
2014-05-22,9:50 AM,Russian vanity projects lose lustre,* Chill in Russia-West relations could impact major state projects-analysts
2014-05-23,8:27 PM,"UPDATE 1-Apple, Google, Intel, Adobe to pay $325 mln to settle hiring lawsuit","(Adds comment from plaintiffs' lawyer, details about plaintiffs)"
2014-05-27,4:50 PM,Intel to make mobile chip with China's Rockchip,"SAN FRANCISCO, May 27 Intel Corp said on Tuesday it reached an agreement with Chinese mobile chipmaker Rockchip to make chips for inexpensive tablets running Google Inc's Android platform."
2014-05-27,6:05 PM,UPDATE 2-Intel to make tablet chips with China's Rockchip,"SAN FRANCISCO, May 27 Intel Corp said on Tuesday it reached an agreement with Chinese mobile chipmaker Rockchip to make chips for inexpensive tablets running Google Inc's Android platform."
2014-05-28,8:02 PM,Intel readies 3D-printed robots for handy consumers,"RANCHO PALOS VERDE, California, May 28 Intel Corp introduced a walking, talking robot on Wednesday made from 3D-printed parts that will be available to consumers later this year, if they are willing to assemble it with a kit that costs around $1,600."
2014-05-28,8:55 PM,Intel readies 3D-printed robots for handy consumers,"RANCHO PALOS VERDE California Intel Corp introduced a walking, talking robot on Wednesday made from 3D-printed parts that will be available to consumers later this year, if they are willing to assemble it with a kit that costs around $1,600."
2014-05-29,12:30 AM,Intel readies 3D-printed robots for handy consumers,"RANCHO PALOS VERDE California Intel Corp introduced a walking, talking robot on Wednesday made from 3D-printed parts that will be available to consumers later this year, if they are willing to assemble it with a kit that costs around $1,600."
2014-05-29,7:55 PM,Intel: new tablets a big step toward reaching aggressive target,"SAN FRANCISCO, May 29 New Intel-based tablets from major brands will start hitting store shelves in June, and senior executives at the chipmaker hope the offerings will move it closer to an aggressive sales goal."
2014-05-29,8:10 PM,Intel: new tablets a big step toward reaching aggressive target,"SAN FRANCISCO New Intel-based tablets from major brands will start hitting store shelves in June, and senior executives at the chipmaker hope the offerings will move it closer to an aggressive sales goal."
2014-05-30,9:55 PM,Exclusive: Intel TV creator leaves Verizon months after deal,"SAN FRANCISCO/NEW YORK Erik Huggers is leaving Verizon Communications Inc  just five months after joining the company via the acquisition of the Intel Corp  OnCue streaming service he developed, signaling the communications giants waning interest in providing an Internet-delivered TV service."
2014-06-03,1:00 AM,Intel VP among six Mt. Rainier climbers missing and presumed dead,"SAN FRANCISCO, June 2 An Intel vice president is among six climbers missing and presumed dead in the worst accident in three decades on Washington's Mount Rainier, the company said on Monday as search efforts for the group were scaled back."
2014-06-03,1:05 AM,Intel VP among six Mt. Rainier climbers missing and presumed dead,"SAN FRANCISCO An Intel vice president is among six climbers missing and presumed dead in the worst accident in three decades on Washington's Mount Rainier, the company said on Monday as search efforts for the group were scaled back."
2014-06-12,7:40 AM,EU court rejects Intel's $1.5 bln EU antitrust fine,"LUXEMBOURG, June 12 Europe's second-highest court backed on Thursday a record 1.06 billion euros ($1.44 billion) fine levied on U.S. chipmaker Intel by European Union antitrust regulators five years ago for blocking rival Advanced Micro Devices."
2014-06-12,8:00 AM,UPDATE 2-Intel loses court challenge against $1.4 bln EU fine,"* Intel declines to say if it will go to Europe's top court   (Recasts; adds Intel, lawyer, BEUC comments)"
2014-06-12,8:02 AM,Intel loses court challenge against $1.4 billion EU fine,"LUXEMBOURG U.S. chipmaker Intel lost on Thursday its challenge against a record 1.06 billion euro ($1.44 billion) European Union fine handed down five years ago, as Europe's second highest court said regulators did not act too harshly."
2014-06-12,8:20 PM,CORRECTED-Intel raises outlook on stronger PC demand,"(Corrects to show second quarter ends at end of June, not July, in fourth paragraph)"
2014-06-12,8:42 PM,"UPDATE 2-Intel raises outlook on stronger PC demand, shares jump","SAN FRANCISCO, June 12 Chipmaker Intel Corp  on Thursday raised its outlook for the second quarter and the full year, citing stronger-than-expected demand for personal computers used by businesses."
2014-06-12,8:47 PM,"Intel raises outlook on stronger PC demand, shares jump","SAN FRANCISCO Chipmaker Intel Corp  on Thursday raised its outlook for the second quarter and the full year, citing stronger-than-expected demand for personal computers used by businesses."
2014-06-13,12:12 AM,Intel raises outlook on stronger PC demand,"SAN FRANCISCO Chipmaker Intel Corp  on Thursday raised its outlook for the second quarter and the full year, citing stronger-than-expected demand for personal computers used by businesses."
2014-06-13,11:31 AM,"US STOCKS-Futures flat, indexes on track to close week lower","NEW YORK, June 13 U.S. stock index futures were little changed on Friday, though recent weakness was enough to put the Dow and S&P 500 on track for their first weekly decline after three consecutive weeks of gains."
2014-06-13,12:50 PM,"US STOCKS-Futures imply weak open, S&P on track for down week","* Futures down: Dow 27 pts, S&P 2.5 pts, Nasdaq 1.5 pts   (Adds OpenTable acquisition)"
2014-06-13,2:35 PM,"US STOCKS-Wall St edged higher, S&P set to close week lower","* Dow, S&P 500 and Nasdaq all up 0.2 pct   (Updates to open, adds sentiment data)"
2014-06-13,4:40 PM,"US STOCKS-Intel lifts Wall St, but indexes set for lower week","* Indexes: Dow, S&P 500 up 0.2 pct, Nasdaq up 0.3 pct   (Updates to midday trading)"
2014-06-13,6:41 PM,US STOCKS-Wall St edges up as Intel leads gains in tech,"* Indexes up: Dow 0.1 pct, S&P 500 0.2 pct, Nasdaq 0.3 pct   (Updates to afternoon session)"
2014-06-13,7:11 PM,"GLOBAL MARKETS-Iraq unrest drives up oil, shares edge higher","(Adds oil settlement prices)     * Iraq fighting boosts oil, damps global equity markets     * Intel's outlook drives tech sector, Wall Street higher     * Dollar firms as Iraq conflict drives safe-haven buying      By David Gaffen and Herbert Lash     NEW YORK, June 13 Escalating violence in Iraq drove crude oil prices to nine-month highs on Friday while damping the appetite for risk, even as bullish news from the U.S. tech sector lifted shares on Wall Street and helped buoy stocks"
2014-06-13,8:41 PM,GLOBAL MARKETS-Iraq unrest drives up oil; shares edge higher,"(Adds close of U.S. markets)     * Iraq fighting boosts oil, damps global equity markets     * Intel's outlook drives tech sector, Wall Street higher     * Dollar firms as Iraq conflict drives safe-haven buying      By David Gaffen and Herbert Lash     NEW YORK, June 13 Escalating violence in Iraq drove crude oil prices to nine-month highs on Friday while damping the appetite for risk, even as bullish news from the U.S. tech sector lifted shares on Wall Street and helped buoy stocks"
2014-06-13,8:51 PM,US STOCKS-Wall St edges up on Intel but posts weekly loss,"* Indexes up: Dow 0.3 pct, S&P 0.3 pct, Nasdaq 0.3 pct   (Updates to close)"
2014-06-13,1:38 PM,Wall St. edges up on Intel but posts weekly decline,"NEW YORK U.S. stocks edged up on Friday, boosted by bullish news from the tech sector, but major indexes fell for the week as unrest in Iraq kept investors on edge."
