date,time,title,abstract
2016-09-16,1:15 PM,BRIEF-Intel raises third-quarter revenue expectations,"* Says expects third-quarter revenue to be $15.6 billion, plus or minus $300 million"
2016-09-19,8:10 PM,BRIEF-Intel appoints Bob Swan executive vice president and chief financial officer,* Intel appoints Bob Swan executive vice president and chief financial officer
2016-09-19,8:15 PM,Intel names Robert Swan CFO,"Sept 19 Intel Corp named Robert Swan chief financial officer, replacing Stacy Smith who will move to a new role leading sales, manufacturing and operations."
2016-09-19,9:05 PM,BRIEF-Intel Corp says Robert Swan will receive a hiring bonus,"* Intel Corp says in connection with his appointment, Robert Swan will receive a hiring bonus of $5.5 million"
2016-09-19,8:20 PM,UPDATE 1-Intel hires Robert Swan from General Atlantic as CFO,"Sept 19 Intel Corp named Robert Swan chief financial officer, replacing company veteran Stacy Smith who is moving to a new role leading sales, manufacturing and operations."
2016-09-19,8:20 PM,Intel hires Robert Swan from General Atlantic as CFO,"Intel Corp named Robert Swan chief financial officer, replacing company veteran Stacy Smith who is moving to a new role leading sales, manufacturing and operations."
2016-09-26,6:20 PM,"R3, 8 banks successfully test Intel blockchain platform for bond trading","NEW YORK, Sept 26 U.S.-based financial innovation start-up R3 announced on Monday that it and eight banks, including HSBC and State Street, have successfully tested a blockchain platform powered by Intel Corp technology for bond transactions."
2016-10-18,8:15 PM,"BRIEF-Intel sees Q4 revenue of $15.7 bln, plus or minus $500 mln","* Revenue is expected to be $15.7 billion, plus or minus $500 million in the fourth quarter"
2016-10-18,8:10 PM,CORRECTED-Intel's quarterly revenue rises 9.1 percent,"Oct 18 Intel Corp reported a 9.1 percent rise in quarterly revenue, helped by improving PC demand and growth in its data center and cloud businesses."
2016-10-18,8:50 PM,BRIEF-Intel Q3 NON-GAAP EPS of $0.80,"* Intel reports Q3 rev of $15.8 bln, up 9 pct year-over-year; operating profit of $4.5 billion"
2016-10-18,8:09 PM,UPDATE 2-Intel's results beat estimates; forecast disappoints,"* Q3 adj. EPS 80 cents vs est. 73 cents   (Adds details from call, analyst comment; Updates shares)"
2016-10-18,8:09 PM,Intel's results beat estimates; forecast disappoints,"Intel Corp  reported better-than-expected quarterly earnings and revenue, boosted by improving PC demand and growth in its data center and cloud businesses, but its revenue forecast for the current quarter disappointed Wall Street."
2016-10-19,5:20 AM,French and Benelux stocks-Factors to watch on Oct 19,"PARIS, Oct 19 Below are company-related news and stories from French and Benelux media which could have an impact on the region's markets or individual stocks."
2016-10-19,6:30 AM,"UPDATE 1-ASML Q3 results miss on profit, but sales up on orders of newest machines","* Sees Q4 revenue at 1.7-1.8 bln euros   (Adds details from earnings, CEO comment)"
2016-10-19,1:35 PM,US STOCKS SNAPSHOT-Wall St opens little changed; Intel weighs,"Oct 19 U.S. stocks opened little changed on Wednesday, a day after the S&P 500 index posted its best advance in the month, but Intel had the Nasdaq slightly in the red."
2016-10-19,2:10 PM,US STOCKS-Wall St flat as oil gains offset Intel's drag,"* Dow up 0.15 pct, S&P up 0.01 pct, Nasdaq down 0.15 pct   (Updates to open)"
2016-10-19,4:10 PM,GLOBAL MARKETS-Oil jumps after U.S. data; stocks edge up,"* Energy stocks lead Wall St higher, Intel slumps   (Updates with U.S. market trading, changes throughout)"
2016-10-19,5:05 PM,"US STOCKS-Wall St up on oil, upbeat earnings; Intel limits gains","* Indexes up: Dow 0.41 pct, S&P 0.29 pct, Nasdaq 0.04 pct   (Updates to early afternoon)"
2016-10-19,6:45 PM,"US STOCKS-Wall St climbs on oil, earnings; Intel curbs advance","* Indexes up: Dow 0.39 pct, S&P 0.33 pct, Nasdaq 0.11 pct   (Adds Beige Book, changes byline)"
2016-10-19,7:35 PM,GLOBAL MARKETS-Oil rises after surprise drop in U.S. inventories; stocks tick up,"* Bank, energy stocks lead Wall St higher; Intel slumps   (Updates prices, adds comment)"
2016-10-19,11:35 AM,"US STOCKS-Oil, earnings lift Wall St but Intel drags",* U.S. crude touches 15-month highs on surprise stockpile drop
2016-10-19,11:49 PM,GLOBAL MARKETS-U.S. oil rises after surprise inventory drop; stocks up,* Saudi Arabia sets record with mammoth $17.5 billion bond issue   (Updates to U.S. market close)
2016-10-20,7:55 AM,EU court adviser backs Intel appeal against EU fine,"LUXEMBOURG, Oct 20 A lower court should review U.S. chipmaker Intel's challenge against a record 1.06-billion-euro ($1.16 billion) fine levied by EU antitrust regulators seven years ago, an adviser to Europe's top court said on Thursday."
2016-10-20,7:55 AM,UPDATE 2-EU court adviser backs Intel fight against record EU fine,"LUXEMBOURG/BRUSSELS, Oct 20 Intel's  fight against a record 1.06 billion euro  ($1.16 billion) EU antitrust fine received a boost on Thursday when a top Europe court adviser questioned whether the U.S. chipmaker's actions had really harmed competition."
2016-10-20,7:55 AM,EU court adviser backs Intel fight against record EU fine,LUXEMBOURG/BRUSSELS Intel's  fight against a record 1.06 billion euro  ($1.16 billion) EU antitrust fine received a boost on Thursday when a top Europe court adviser questioned whether the U.S. chipmaker's actions had really harmed competition.
2016-10-24,12:35 PM,"BRIEF-Visa, Intel to work on payment security for connected devices",* Visa and Intel collaborate to drive better payment security for connected devices
2016-11-01,12:20 PM,UPDATE 1-Samsung Elec to invest more than $1 bln in U.S. chip production,"* Firm plans $11.6 billion in semiconductor capex this year   (Updates with comments from Samsung, background)"
2016-11-03,4:50 PM,BRIEF-Intel says acquiring VR startup Voke; financial terms not disclosed,* Acquiring VR startup VOKE for immersive sports; financial terms are not being disclosed  Source text - http://intel.ly/2ek4L65 Further company coverage:
2016-11-15,7:05 PM,BRIEF-Intel announces $250 mln investment for autonomous driving,* Intel announces $250 million investment for autonomous driving
2016-11-16,10:31 PM,BRIEF-Vuzix gets letter from Intel,"* Vuzix Corp - over last two years, Vuzix's collaboration work with Intel has not generated material revenue to company - SEC filing"
2016-11-16,11:51 PM,Vuzix shares slump after Intel halts headset partnership,Nov 16 Wearable display maker Vuzix Corp  said on Wednesday that Intel Corp had decided to halt its collaboration with the company related to the development of Internet-connected headsets.
2016-11-16,11:51 PM,Vuzix shares slump after Intel halts headset partnership,Wearable display maker Vuzix Corp  said on Wednesday that Intel Corp  had decided to halt its collaboration with the company related to the development of Internet-connected headsets.
2016-11-21,10:40 AM,"BRIEF-Brigade Enterprises partners with Microsoft, Intel for real estate accelerator program",* Strategic partnerships with Microsoft & Intel to benefit startups in its technology focused real estate accelerator program  Source text: http://bit.ly/2fjcaTC Further company coverage:
2016-11-29,5:30 AM,"Delphi, Mobileye to use Intel chip for self-driving car system","Nov 29 Auto parts maker Delphi Automotive Plc  and Israeli technology firm Mobileye NV will put an Intel Corp chip at the heart of their joint effort to produce self-driving vehicles by 2019, the companies said on Tuesday."
2016-12-13,5:21 PM,Intel agencies at odds over Russian hacking,The overseers of the U.S. intelligence community have not embraced a CIA assessment that Russian cyber attacks were aimed at helping Republican President-elect Donald Trump win the 2016 election.Three American officials told Reuters that the Office of the Director of National Intelligence (ODNI) did not endorse the CIA analysis because of a lack of conclusive evidence that Moscow was trying to assist Trump at the expense of Democratic rival Hillary Clinton. Trump has called the CIA finding ridi
2017-01-03,10:41 AM,Intel to take stake in German mapping firm HERE in automated driving push,"FRANKFURT U.S. chip maker Intel  will take a 15 percent stake in German digital mapping firm HERE, it said on Tuesday, as it seeks to build its presence in automated driving technology."
2017-01-04,3:03 PM,"BMW, Intel, Mobileye to test 40 driverless cars in second half of 2017","BERLIN BMW's alliance with Intel and Mobileye aims to put a fleet of around 40 self-driving test vehicles on the road in the second half of this year, the companies said."
2017-01-21,9:13 PM,UPDATE 4-Apple files $1 billion lawsuit against chip supplier Qualcomm,"Jan 20 Apple Inc filed a $1 billion lawsuit against supplier Qualcomm Inc on Friday, days after the U.S. government accused the chip maker of resorting to anticompetitive tactics to maintain a monopoly over key semiconductors in mobile phones."
2017-01-21,9:32 PM,Apple files $1 billion lawsuit against chip supplier Qualcomm,"Apple Inc filed a $1 billion lawsuit against supplier Qualcomm Inc on Friday, days after the U.S. government accused the chip maker of resorting to anticompetitive tactics to maintain a monopoly over key semiconductors in mobile phones."
2017-01-23,2:16 PM,BRIEF-Intel declares a quarterly dividend,* Declared a quarterly dividend of 26 cents per share  Source text for Eikon:  Further company coverage:
2017-01-24,8:59 AM,"German regulator clears HERE stake purchases by Intel, NavInfo","DUESSELDORF, Germany, Jan 24 Germany's Federal Cartel Office said on Tuesday it had approved stake purchases in German digital mapping firm HERE by U.S. chip maker Intel  and China's NavInfo."
2017-01-26,9:03 PM,BRIEF-Intel Corp quarterly results press release,Please click on the link below for Intel Corp's quarterly earnings press release:  Source text: http://bit.ly/2juu4ES
2017-01-26,9:08 PM,Intel reports 9.8 pct rise in quarterly revenue,"Jan 26 Intel Corp reported a 9.8 percent rise in quarterly revenue on Thursday, boosted by a stabilizing PC market and a rise in demand for its data center services."
2017-01-26,9:15 PM,BRIEF-Intel reports Q4 EPS of $0.73,"* Q4 client computing group revenue of $9.1 billion, up 4 percent year-over-year"
2017-01-26,9:09 PM,"UPDATE 2-Data center growth drives Intel's 4th-qtr revenue, profit beat","* Q4 adj EPS 79 cents vs est 74 cents   (Adds analyst comments, conference call details, updates shares)"
2017-01-26,9:09 PM,"Data center growth drives Intel's fourth-quarter revenue, profit beat","Intel Corp reported better-than-expected quarterly revenue and profit driven by a stabilizing PC market and growth in its data center business, which offers cloud-based software services."
2017-01-27,2:11 PM,BRIEF-Intel says impact of equity investments and interest for 2017 is estimated to be about $900 mln,"* Intel -impact of equity investments and interest and other, net for 2017 is estimated to be about $900 million on gaap basis, and about $500 million on non-GAAP basis"
2017-01-27,4:58 PM,EU mergers and takeovers (Jan 27),"BRUSSELS, Jan 27 The following are mergers under review by the European Commission and a brief guide to the EU merger process:"
2017-01-30,4:32 PM,BRIEF-Intel promotes three corporate officers,"* Aicha Evans promoted to Senior Vice President; Steven Rodgers promoted to EVP; Leslie Culbertson promoted to SVP, Director of Human Resources  Source text for Eikon:  Further company coverage:"
2017-02-06,1:28 AM,AMD stock could double in a year: Barron's,"Advanced Micro Devices Inc (AMD) shares could double in a year as the chip maker recoups ground lost to Intel Corp and increases its market share in the graphic chips area dominated by Nvidia Corp, Barron's said on Sunday."
2017-02-08,4:42 PM,Trump to meet with Intel CEO on Wednesday -White House,"WASHINGTON, Feb 8 President Donald Trump will meet with Intel Corp chief executive Brian Krzanich on Wednesday afternoon, the White House said, offering no further details."
2017-02-08,6:04 PM,WHITE HOUSE OFFICIAL SAYS THERE WILL BE NO INCENTIVES FROM THE FEDERAL GOVERNMENT FOR INTEL PROJECT,WHITE HOUSE OFFICIAL SAYS THERE WILL BE NO INCENTIVES FROM THE FEDERAL GOVERNMENT FOR INTEL PROJECT
2017-02-08,4:42 PM,Trump to meet with Intel CEO on Wednesday: White House,"WASHINGTON President Donald Trump will meet with Intel Corp  chief executive Brian Krzanich on Wednesday afternoon, the White House said, offering no further details."
2017-02-08,6:12 PM,UPDATE 2-Intel uses White House Oval Office for splash on Arizona factory,"WASHINGTON, Feb 8 Intel Corp chose the White House Oval Office as its backdrop to announce a $7 billion investment in a previously shelved Arizona factory, which it said would create 3,000 jobs when it is up and running."
2017-02-08,6:12 PM,Intel uses White House Oval Office for splash on Arizona factory,"WASHINGTON Intel Corp  chose the White House Oval Office as its backdrop to announce a $7 billion investment in a previously shelved Arizona factory, which it said would create 3,000 jobs when it is up and running. | Video"
2017-02-10,10:20 PM,BRIEF-Intel Corp reports 4.9 percent passive stake in Impinj Inc as of February 2 - SEC filing,* Intel Corp reports 4.9 percent passive stake in Impinj Inc as of February 2 - SEC filing  Source text for Eikon: (http://bit.ly/2kcNnVj) Further company coverage:
2017-02-14,10:11 PM,"BRIEF-Soros Fund Management takes share stake in Tata Motors, dissolves share stake in Coca Cola, Dunkin' Brands",* Soros Fund Management dissolves share stake in Coca Cola Co - SEC filing
2017-02-15,1:22 AM,BRIEF-Oneview Healthcare announces technology development collaboration with Intel,* announces technology development collaboration with Intel  Source text for Eikon:  Further company coverage:
2017-02-21,3:32 PM,BRIEF-Nokia and Intel launch 5G acceleration labs,* Nokia and Intel launch 5G acceleration labs in U.S. and Finland to help operators bring 5G innovations to market
2017-03-06,9:40 PM,BRIEF-Intel says John Donahoe informs he will not stand for re-election to board,"* Intel-On March 2, John J. Donahoe informed co that he will not stand for re-election to Intel's board - SEC filing"
2017-03-08,2:50 PM,"UPDATE 5-China's ZTE pleads guilty, settles U.S. sanctions case for nearly $900 mln","* ZTE to plead guilty to evading U.S. sanctions on Iran, N.Korea"
2017-03-08,7:12 AM,U.S. tech sanctions will rattle China's firewall,HONG KONG (Reuters Breakingviews) - China has been giving fair warning. Telecoms equipment maker ZTE has agreed to plead guilty for violating U.S. export controls. The charges could have been more severe and the $892 million fine is manageable for the $9 billion company. More powerful is the message: the new U.S. administration is prepared to take action against corporate giants to rein in troublesome nations.
2017-03-13,10:01 AM,Intel to buy Mobileye for $14-$15 bln -Israeli media report,"JERUSALEM, March 13 Chipmaker Intel has agreed to buy Israeli technology firm Mobileye for $14-$15 billion dollars, according to TheMarker, one of Israel's leading financial newspapers."
2017-03-13,5:48 PM,Intel puts self-driving pedal to financial metal,"NEW YORK (Reuters Breakingviews) - Intel has put the self-driving pedal to the financial metal. Buying Mobileye for $15.3 billion values the autonomous-car parts supplier at 30 times this year's estimated revenue, according to Thomson Reuters data. Justifying such a racy price tag will take some doing."
2017-03-13,6:37 PM,FACTBOX-Intel invested in five self-driving startups,"March 13 Intel Corp, which on Monday announced the proposed $15.3 billion acquisition of Mobileye NV , had invested in at least five startup companies working on self-driving vehicle technologies."
2017-03-13,6:54 PM,Factbox: Intel invested in five self-driving startups,"Intel Corp , which on Monday announced the proposed $15.3 billion acquisition of Mobileye NV , had invested in at least five startup companies working on self-driving vehicle technologies."
2017-03-13,1:21 PM,Deals of the day-Mergers and acquisitions,"March 13 The following bids, mergers, acquisitions and disposals were reported by 2000 GMT on Monday:"
2017-03-13,8:27 PM,US STOCKS-Wall St drifts along with eyes on Fed; Intel drops,"* Dow down 0.1 pct, S&P 500 up 0.04 pct, Nasdaq up 0.24 pct   (Updates to market close, changes dateline, byline)"
2017-03-13,10:21 AM,UPDATE 8-Intel's $15 bln purchase of Mobileye shakes up driverless car sector,"* Mobileye shares up 28.2 percent to $60.62   (Adds analysts' comments, skepticism about self-driving cars)"
2017-03-13,9:37 PM,Intel banking on Mobileye deal for a drive in the right direction,"March 13 Intel Corp has had a tough time squeezing value out of recent mega-deals, putting some pressure on the success of its proposed $15 billion acquisition of Israeli car-technology firm Mobileye NV."
2017-03-13,9:40 PM,Intel banking on Mobileye deal for a drive in the right direction,"Intel Corp  has had a tough time squeezing value out of recent mega-deals, putting some pressure on the success of its proposed $15 billion acquisition of Israeli car-technology firm Mobileye NV ."
2017-03-13,10:09 AM,Intel's $15 billion purchase of Mobileye shakes up driverless car sector,JERUSALEM/DETROIT Intel Corp  agreed to buy Israeli autonomous vehicle technology firm Mobileye  for $15.3 billion on Monday in a deal that could thrust the U.S. chipmaker into direct competition with rivals Nvidia Corp  and Qualcomm Inc  to develop driverless systems for global automakers. | Video
2017-03-14,4:38 AM,PRESS DIGEST - Wall Street Journal - March 14,March 14 The following are the top stories in the Wall Street Journal. Reuters has not verified these stories and does not vouch for their accuracy.
2017-03-14,12:48 PM,Swiss watch demand improving thanks to China - LVMH watch head Biver,"BRUNNEN, Switzerland, March 14 Demand for Swiss watches has improved, driven by a rebound in Chinese purchases, the head of luxury group LVMH's watch business said on Tuesday."
2017-03-14,1:21 PM,Israel eyes tax cuts as Intel-Mobileye deal to boost coffers by $1 bln,"JERUSALEM, March 14 Israel's government will receive about 4 billion shekels ($1.1 billion) after Intel's  planned $15.3 billion purchase of self-driving car tech firm Mobileye, helping the government cut more taxes, Finance Minister Moshe Kahlon said on Tuesday."
2017-03-14,1:21 PM,Israel eyes tax cuts as Intel-Mobileye deal to boost coffers by $1 billion,"JERUSALEM Israel's government will receive about 4 billion shekels ($1.1 billion) after Intel's  planned $15.3 billion purchase of self-driving car tech firm Mobileye , helping the government cut more taxes, Finance Minister Moshe Kahlon said on Tuesday."
2017-03-14,12:59 PM,UPDATE 1-Connected or mechanical? TAG Heuer tries to bridge gap with module watch,"BRUNNEN, Switzerland, March 14 Swiss watchmaker TAG Heuer, owned by LVMH, sought to appeal to tech geeks and traditionalists alike on Tuesday by launching a connected watch that lets wearers switch between a smart watch head and a traditional mechanical movement."
2017-03-14,3:01 PM,Reuters Select: The optics of Intel's Mobileye acquisition,"Intel is paying more than $15 billion to get into direct competition with Nvidia and Qualcomm to develop driverless systems for automakers. And, as Reuters' Tova Cohen, Ari Rabinovitch and Paul Lienert report, they're paying big to do it: 21 times Mobileye's expected 2017 revenue and 60 times earnings -- high valuations in just about any field, but certainly in this one. Find out why Intel thinks the cost is worth it."
2017-03-15,4:07 AM,"Intel bets on selling Mobileye data, with maps a first test","SAN FRANCISCO, March 14 To understand Intel's $15.3 billion proposed acquisition of Israel's Mobileye, imagine the data created and compiled by a self-driving car scanning the road and objects around it as a potential source of revenue."
2017-03-15,4:01 AM,"Intel bets on selling Mobileye data, with maps a first test","SAN FRANCISCO, March 14 To understand Intel's $15.3 billion proposed acquisition of Israel's Mobileye, imagine the data created and compiled by a self-driving car scanning the road and objects around it as a potential source of revenue."
2017-03-15,4:07 AM,"Intel bets on selling Mobileye data, with maps a first test","SAN FRANCISCO To understand Intel's $15.3 billion proposed acquisition of Israel's Mobileye, imagine the data created and compiled by a self-driving car scanning the road and objects around it as a potential source of revenue."
2017-03-15,2:28 PM,Fitch Affirms Intel at 'A-/F1' on Mobileye Acquisition; Outlook Stable,"(The following statement was released by the rating agency) CHICAGO, March 15 (Fitch) Fitch Ratings has affirmed the ratings for Intel  Corporation (Intel), including the Long- and Short-Term Issuer Default Ratings  (IDR) at 'A+/F1', on news that the company will acquire computer vision for  advanced driver-assistance systems (ADAS) provider, Mobileye NV (Mobileye), for  $14.7 billion in cash. The Rating Outlook is Stable. Fitch's actions affect  $25.3 billion of total debt. A full list of ratin"
2017-03-15,3:02 PM,Bosch sticks to own technology in face of Intel-Mobileye merger,"BERLIN, March 15 Bosch, the world's biggest maker of automotive components, will continue to develop its own visual technology regardless of Intel's $15 billion deal to buy Mobileye, an executive said on Wednesday."
2017-03-15,3:02 PM,Bosch sticks to own technology in face of Intel-Mobileye merger,"BERLIN Bosch [ROBG.UL], the world's biggest maker of automotive components, will continue to develop its own visual technology regardless of Intel's $15 billion deal to buy Mobileye, an executive said on Wednesday."
2017-03-15,5:28 PM,Correction: Fitch Affirms Intel at 'A+/F1' on Mobileye Acquisition; Outlook Stable,"(The following statement was released by the rating agency) CHICAGO, March 15 (Fitch) This release corrects the rating in the title of the  release that went out earlier today. Fitch Ratings has affirmed the ratings for Intel Corporation (Intel), including  the Long- and Short-Term Issuer Default Ratings (IDR) at 'A+/F1', on news that  the company will acquire computer vision for advanced driver-assistance systems  (ADAS) provider, Mobileye NV (Mobileye), for $14.7 billion in cash. The Rating  O"
2017-03-16,8:35 PM,Viewsroom: Intels pricey bet on driverless cars,"NEW YORK (Reuters Breakingviews) - The chipmaker is shelling out $15 bln for autonomous-driving parts firm Mobileye, a cool 30 times estimated revenue. Intel missed the mobile-phone revolution. Is it finally on the right road? Plus: Washington bounces bitcoins bid for mainstream acceptance."
2017-03-21,9:54 PM,BRIEF-Tepco to link up with Intel to manage power grids in Asia and Africa -Nikkei,* Tepco to link up with intel to manage power grids in Asia and Africa -Nikkei
2017-03-22,4:27 PM,Mobileye deal to fuel investment in late-stage Israeli start-ups,"* Israeli start-ups raised nearly $5 billion in 2016, up 11 pct"
2017-03-22,4:27 PM,Mobileye deal to fuel investment in late-stage Israeli start-ups,"TEL AVIV Intel's $15.3 billion acquisition of Mobileye  has catapulted Israeli hi-tech into the global league, and is likely to stimulate investment in the sector's other late-stage startups, where funds are most needed."
2017-03-22,9:58 PM,UPDATE 1-China's ZTE Corp pleads guilty in U.S. court in sanctions case,"NEW YORK, March 22 Chinese telecom equipment maker ZTE Corp  on Wednesday pleaded guilty in U.S. federal court in Texas for conspiring to violate U.S. sanctions by illegally shipping U.S. goods and technology to Iran."
2017-03-23,7:01 AM,RPT-Mobileye deal to fuel investment in late-stage Israeli start-ups,"* Israeli start-ups raised nearly $5 billion in 2016, up 11 pct"
2017-03-23,1:22 PM,BRIEF-Intel elects two new members to the board,* Announced that Omar Ishrak and Greg Smith have been elected to Intel's board of directors.  Source text for Eikon: Further company coverage:
2017-03-23,1:25 PM,BRIEF-Intel raises quarterly dividend by 5 pct,* Intel corp - board of directors has declared a quarterly dividend of $0.2725 cents per share  Source text for Eikon:  Further company coverage:
2017-03-23,7:12 PM,BRIEF-SEC accuses two Israeli residents of insider trading ahead of Intel-Mobileye merger,March 23 SEC Files Lawsuit Accusing Two Israeli Residents Of Insider Trading Ahead Of Intel's
2017-03-23,7:22 PM,SEC charges two Israeli residents with Mobileye insider trading,"NEW YORK, March 23 Two Israeli residents have been charged by the U.S. Securities and Exchange Commission with insider trading in Mobileye NV before the maker of sensors and cameras for driverless vehicles agreed to be acquired by Intel Corp for $15.3 billion."
2017-03-23,8:43 PM,China's ZTE Corp pleads guilty in U.S. court in sanctions case,NEW YORK Chinese telecom equipment maker ZTE Corp  on Wednesday pleaded guilty in U.S. federal court in Texas for conspiring to violate U.S. sanctions by illegally shipping U.S. goods and technology to Iran.
2017-03-23,7:33 PM,UPDATE 2-SEC charges two Israeli residents with Mobileye insider trading,"NEW YORK, March 23 Two Israeli residents have been charged by the U.S. Securities and Exchange Commission with insider trading in Mobileye NV before the maker of sensors and cameras for driverless vehicles agreed to be acquired by Intel Corp for $15.3 billion."
2017-03-29,3:08 PM,BRIEF-Intel appoints Aicha Evans as chief strategy officer,"* Appointment of Aicha S. Evans as chief strategy officer, effective immediately"
