date,time,title,abstract
2016-01-29,1:38 PM,General Electric to invest well over $546 million in Italy: sources,"MILAN General Electric  will sign agreements on Sunday to invest well over 500 million euros ($546 million) in central Italy, three sources close to the matter said on Friday."
2016-01-29,11:15 AM,UPDATE 3-Whirlpool sees North America driving growth in 2016,"* Shares rise as much as 5.3 pct   (Adds details from conference call, shares)"
2016-01-29,1:38 PM,General Electric to invest well over 500 mln euros in Italy - sources,"MILAN, Jan 29 General Electric will sign agreements on Sunday to invest well over 500 million euros ($546 million) in central Italy, three sources close to the matter said on Friday."
2016-01-31,7:05 PM,General Electric signs $600 million investment deal in Italy,MILAN General Electric said on Sunday it had signed an agreement to invest $600 million in Italy in research and development projects in the oil and gas sector over the next five years.
2016-01-31,7:05 PM,General Electric signs $600 mln investment deal in Italy,"MILAN, Jan 31 General Electric said on Sunday it had signed an agreement to invest $600 million in Italy in research and development projects in the oil and gas sector over the next five years."
2016-02-05,2:56 AM,Exclusive: State Street nears deal for GE's asset management arm - sources,"State Street Corp  is nearing a deal to acquire General Electric Co's  $115 billion asset management business, according to people familiar with the matter, as the U.S. industrial conglomerate continues to shed unloved assets."
2016-02-08,8:10 PM,Diamond Offshore-GE service tie-up may prompt other such deals,"Diamond Offshore Drilling Inc's  service agreement with General Electric Co , which is expected to help lower idle time for rigs on hire, could prompt more such deals in an industry battered by sliding oil prices."
2016-02-08,8:10 PM,Diamond Offshore-GE service tie-up may prompt other such deals,"Feb 8 Diamond Offshore Drilling Inc's  service agreement with General Electric Co, which is expected to help lower idle time for rigs on hire, could prompt more such deals in an industry battered by sliding oil prices."
2016-02-16,4:04 AM,GE explores oil and gas business in Iran with top executive visit,"General Electric Co  is exploring potential business opportunities in Iran and the chief executive of its oil and gas division visited the country recently, a company spokeswoman said."
2016-02-16,4:04 AM,GE explores oil and gas business in Iran with top exec visit,"Feb 15 General Electric Co is exploring potential business opportunities in Iran and the chief executive of its oil and gas division visited the country recently, a company spokeswoman said."
2016-02-17,1:01 AM,Spirit Aero names former GE exec as COO,"WASHINGTON, Feb 16 Aircraft parts maker Spirit AeroSystems Holdings Inc on Tuesday said it had named Tom Gentile, a former senior General Electric Co  executive, as executive vice president and chief operating officer, effective April 1."
2016-02-26,11:13 PM,GE units get DoJ subpoenas over subprime mortgages,General Electric Co said the U.S. Department of Justice in January issued subpoenas to WMC Mortgage Corp and GE Capital seeking documents as part of an industry-wide investigation of subprime mortgages.
2016-02-26,10:52 PM,GE units get DoJ subpoenas over subprime mortgages,General Electric Co said the U.S. Department of Justice in January issued subpoenas to WMC Mortgage Corp and GE Capital seeking documents as part of an industry-wide investigation of subprime mortgages.
2016-02-26,10:52 PM,UPDATE 1-GE units get DoJ subpoenas over subprime mortgages,Feb 26 General Electric Co said the U.S. Department of Justice in January issued subpoenas to WMC Mortgage Corp and GE Capital seeking documents as part of an industry-wide investigation of subprime mortgages.
2016-02-26,11:05 PM,How Honeywell turned the tables on United Tech,"Honeywell International Inc  Chief Executive David Cote was sporting the casual jeans and sweater he often likes to wear in the office when he was visited by his then-counterpart at United Technologies Corp  in 2012, Louis Chenevert."
2016-02-26,10:36 PM,GE units get DoJ subpoenas over subprime mortgages,Feb 26 General Electric Co said the U.S. Department of Justice in January issued subpoenas to WMC Mortgage Corp and GE Capital seeking documents as part of an industry-wide investigation of subprime mortgages.
2016-02-29,5:50 PM,GE to 'aggressively' cut costs in 2016: Immelt,"General Electric Co  will continue to ""aggressively"" cut costs this year, Chief Executive Jeff Immelt said, reiterating the company's target for spending on restructuring in 2016."
2016-02-29,5:50 PM,"GE to ""aggressively"" cut costs in 2016: Immelt","Feb 29 General Electric Co will continue to ""aggressively"" cut costs this year, Chief Executive Jeff Immelt said, reiterating the company's target for spending on restructuring in 2016."
2016-03-02,6:35 PM,"GE to sell India financial services business to Aion, former execs",General Electric Co  said it would sell its India commercial lending and leasing businesses to a consortium of former GE Capital executives and Aion Capital Partners as it looks to trim itself and focus on its industrial businesses.
2016-03-02,6:35 PM,"GE to sell India financial services business to Aion, former execs",March 2 General Electric Co said it would sell its India commercial lending and leasing businesses to a consortium of former GE Capital executives and Aion Capital Partners as it looks to trim itself and focus on its industrial businesses.
2016-03-07,5:05 PM,Exclusive: Poland's Alior keen to buy Bank BPH from GE - sources,"WARSAW Poland's mid-tier lender Alior Bank , owned by state-run insurer PZU, is in talks to buy its rival Bank BPH  from General Electric  and hopes to complete a deal around mid-2016, three banking sources told Reuters."
2016-03-08,3:13 PM,Deals of the day- Mergers and acquisitions,"March 8 The following bids, mergers, acquisitions and disposals were reported by 1430 GMT on Tuesday:"
2016-03-11,3:12 PM,"GE Health targets profit margins, reversing weak performance",NEW YORK General Electric Co's  healthcare business said on Friday its top priority is lifting profit margins that were flat in recent years after it failed to cut costs sufficiently.
2016-03-11,3:12 PM,"UPDATE 1-GE Health targets profit margins, reversing weak performance","NEW YORK, March 11 General Electric Co's  healthcare business said on Friday its top priority is lifting profit margins that were flat in recent years after it failed to cut costs sufficiently."
2016-03-11,3:05 PM,"GE Health targets wider profit margins, reversing weak performance","NEW YORK, March 11 General Electric Co's  healthcare business said on Friday its top priority is lifting profit margins, a move to improve flat margins in recent years when it failed to cut costs enough."
2016-03-13,10:04 AM,Indonesia's Pertamina and Marubeni sign gas turbine deal with GE,"JAKARTA A consortium made up of Indonesia's state energy firm PT Pertamina and Japan's Marubeni Corp  has signed a deal with General Electric  for the U.S. firm to provide gas turbines for a $2 billion power plant in Java, Pertamina said."
2016-03-13,10:04 AM,Indonesia's Pertamina and Marubeni sign gas turbine deal with GE,"JAKARTA, March 13 A consortium made up of Indonesia's state energy firm PT Pertamina and Japan's Marubeni Corp has signed a deal with General Electric for the U.S. firm to provide gas turbines for a $2 billion power plant in Java, Pertamina said."
2016-03-21,12:16 PM,GE's Polish arm BPH in $243 million writedown before sale,"WARSAW The Polish arm of General Electric , Bank BPH , has written down 916 million zlotys ($243 million) of goodwill at a group level on the slim chance it will be sold to a investor at a price above BPH's book value, it said on Monday."
2016-03-24,7:40 PM,GE's Immelt hopes move to Boston fuels staff 'paranoia',"BOSTON, March 24 General Electric Co  Chief Executive Jeff Immelt hopes the conglomerate's headquarters move to Boston inspires a sense of staff ""paranoia"" over losing out to upstart rivals with better technology, he said on Thursday."
2016-03-29,9:55 PM,GE to sell $1.4 billion U.S. hotel franchise loan portfolio,General Electric Co  said it had agreed to sell GE Capital's U.S. hotel franchise loan portfolio to a unit of Western Alliance Bancorp .
2016-03-29,9:55 PM,GE to sell $1.4 bln U.S. hotel franchise loan portfolio,March 29 General Electric Co said it had agreed to sell GE Capital's U.S. hotel franchise loan portfolio to a unit of Western Alliance Bancorp.
2016-03-30,11:16 AM,UPDATE 1-State Street to buy GE Asset Management for up to $485 mln,March 30 State Street Corp said it would buy General Electric Co's asset management business for up to $485 million as the industrial conglomerate winds down its financing arm to reduce regulatory burden.
2016-03-30,10:46 AM,State Street to buy GE Asset Management for up to $485 mln,March 30 State Street Corp said it would buy General Electric Co's asset management business for up to $485 million.
2016-03-31,11:30 AM,GE Capital asks U.S. government to lift 'too big to fail' designation,"WASHINGTON, March 31 General Electric Co's  GE Capital financing arm on Thursday formally asked the U.S. government to stop designating it as a ""systemically important financial institution,"" a label given to companies considered ""too big to fail."""
2016-03-31,12:15 PM,UPDATE 4-GE Capital asks U.S. government to lift 'too big to fail' designation,"WASHINGTON, March 31 Lender GE Capital asked the U.S. government on Thursday to stop designating it as ""too big to fail,"" saying it had shrunk to the point where it would not pose a major threat to the nation's financial stability if it experiences distress."
2016-04-01,11:33 AM,GE Capital asks U.S. government to lift 'too big to fail' designation,"WASHINGTON Lender GE Capital asked the U.S. government on Thursday to stop designating it as ""too big to fail,"" saying it had shrunk to the point where it would not pose a major threat to the nation's financial stability if it experiences distress. | Video"
2016-04-08,10:09 AM,Bill Clinton confronts protesters who say his crime reforms hurt blacks,"NEW YORK Former President Bill Clinton on Thursday faced down protesters angry at the impact his 1994 crime reforms have had on black Americans and defended the record of his wife, Hillary Clinton, who is relying on the support of black voters in her quest for the presidency. | Video"
2016-04-11,5:30 PM,GE begins testing GE9X engine for Boeing 777X planes,"April 11 General Electric CO said on Monday it began ground testing the GE9X engine, the world's largest commercial jet engine that will power Boeing Co's  new 777X jetliner."
2016-04-22,3:52 PM,"GE sees pickup in China sales, possible bottom in oil: CFO","NEW YORK General Electric Co's healthcare equipment sales are picking up in China as a crackdown on corruption that had slowed new orders tapers off, Chief Financial Officer Jeff Bornstein said on Friday."
2016-04-22,10:54 AM,"GE underlying revenue falls, but company sticks to target","NEW YORK General Electric Co  reported lower first-quarter underlying revenue, citing weak sales of oil and gas drilling equipment, but it forecast a second-half upturn for power generation products that should help it meet its full-year target. | Video"
2016-04-22,6:25 PM,"RPT-INTERVIEW-GE sees pickup in China sales, possible bottom in oil -CFO","NEW YORK, April 22 General Electric Co's  healthcare equipment sales are picking up in China as a crackdown on corruption that had slowed new orders tapers off, Chief Financial Officer Jeff Bornstein said on Friday."
2016-04-22,10:54 AM,"UPDATE 4-GE underlying revenue falls, but company sticks to target","NEW YORK, April 22 General Electric Co  reported lower first-quarter underlying revenue, citing weak sales of oil and gas drilling equipment, but it forecast a second-half upturn for power generation products that should help it meet its full-year target."
2016-04-22,2:10 PM,GE expects key revenue measure to rise 5 percent in second half,"NEW YORK General Electric Co  said on Friday it expects a key revenue measure to rise 5 percent in second half of 2016, including foreign exchange effects, largely on anticipated strength in its power business."
2016-04-22,2:10 PM,GE expects key revenue measure to rise 5 percent in second half,"NEW YORK, April 22 General Electric Co  said on Friday it expects a key revenue measure to rise 5 percent in second half of 2016, including foreign exchange effects, largely on anticipated strength in its power business."
2016-04-22,10:55 AM,GE profit tops estimates but organic revenue falls 1 percent,"NEW YORK, April 22 General Electric Co  reported a 5 percent rise in quarterly profit on Friday, topping analysts' estimates, but organic revenue fell 1 percent, raising questions about the company's full-year revenue target."
2016-04-22,10:50 AM,BRIEF-GE reaffirms 2016 EPS guidance of $1.45-$1.55,* Reaffirms 2016 industrial operating + verticals EPS guidance $1.45-$1.55
2016-04-24,2:36 PM,Iraq signs strategic agreement with GE to boost power grid,"BAGHDAD Iraq's Oil Ministry said on Sunday it had signed a long-term ""strategic framework agreement"" with General Electric which comprised several projects to boost national power resources."
2016-04-24,2:36 PM,UPDATE 1-Iraq signs strategic agreement with GE to boost power grid,"BAGHDAD, April 24 Iraq's Oil Ministry said on Sunday it had signed a long-term ""strategic framework agreement"" with General Electric which comprised several projects to boost national power resources."
2016-04-24,2:25 PM,Iraq signs strategic agreement with GE to boost power grid,"BAGHDAD, April 24 Iraq's Oil Ministry said on Sunday it had signed a long-term ""strategic framework agreement"" with General Electric which comprised several projects to boost national power resources."
2016-05-03,11:20 AM,"GE wants become big player in offshore wind, eyes Adwen takeover","PARIS General Electric  wants to become a major player in the offshore wind industry and is interested in buying the Areva-Gamesa   offshore joint venture Adwen, GE's new head of renewables said on Tuesday."
2016-05-06,2:05 PM,"BRIEF-General Electric says Linda Boff has been promoted to Vice President, Chief Marketing Officer, GE","* Patrick Brown, has been promoted to vice president, tax for GE Power, GE Energy Connections, and GE Renewable Energy"
2016-05-06,6:25 AM,GE's Czech bank Moneta prices IPO at CZK 68 per share,"PRAGUE, May 6 Czech lender Moneta Money Bank  on Friday priced shares in its initial public offering (IPO) at 68 crowns each - the bottom of its initial range - valuing the bank at 34.75 billion crowns ($1.47 billion)."
2016-05-10,8:07 AM,Exclusive: GE to buy power plant unit of Korea's Doosan Engineering,"SEATTLE General Electric Co  has agreed to buy a unit of South Korea's Doosan Engineering and Construction Co  that produces key components of combined-cycle power plants, the head of the U.S. company's power division said on Tuesday."
2016-05-18,4:20 PM,General Electric reaffirms forecast despite weaker growth,"NEW YORK General Electric Co  expects to hit its 2016 earnings targets despite tough conditions in its oil and gas business, lower industrial margins and slower revenue growth, Chief Executive Jeff Immelt said on Wednesday."
2016-05-18,4:20 PM,UPDATE 2-General Electric reaffirms forecast despite weaker growth,"NEW YORK, May 18 General Electric Co  expects to hit its 2016 earnings targets despite tough conditions in its oil and gas business, lower industrial margins and slower revenue growth, Chief Executive Jeff Immelt said on Wednesday."
2016-05-18,4:20 PM,General Electric reaffirms forecast despite weaker growth,"NEW YORK, May 18 General Electric expects to hit its earnings targets this year despite tough conditions in its oil and gas business and lower industrial margins and slower revenue growth, Chief Executive Jeff Immelt told analysts on Wednesday."
2016-05-23,9:46 AM,GE says to double Saudi workforce as economy reforms,"DUBAI Saudi Arabia won support for its economic reform plan from one of the world's biggest companies on Monday as General Electric Co (GE)  said it would double its workforce in the kingdom to 4,000 people by 2020."
2016-05-23,7:10 AM,"China April crude imports from Russia top Saudis, hit record","BEIJING/SINGAPORE Russia was China's largest crude oil supplier for a second month this year, customs data showed on Monday, with shipments in April surpassing imports from Saudi Arabia and hitting a record high as demand from independent refiners remained strong."
2016-05-25,4:35 PM,Alstom sues GE for breach of train signal sales contract,French rail transport company Alstom SA  has filed a U.S. lawsuit accusing General Electric Co  of breach of contract related to last November's sale of the American industrial conglomerate's train-signaling business.
2016-05-25,3:13 PM,Alstom sues GE for breach of train signal sales contract,NEW YORK French rail transport company Alstom SA  has filed a U.S. lawsuit accusing General Electric Co  of breach of contract related to last November's sale of the American industrial conglomerate's train-signaling business.
2016-05-25,3:13 PM,UPDATE 1-Alstom sues GE for breach of train signal sales contract,"NEW YORK, May 25 French rail transport company Alstom SA has filed a U.S. lawsuit accusing General Electric Co of breach of contract related to last November's sale of the American industrial conglomerate's train-signaling business."
2016-05-25,3:10 PM,Alstom sues GE for breach of contract,May 25 The French industrial company Alstom SA  has filed a U.S. lawsuit accusing General Electric Co  of breaching a contract related to the latter's sale of a rail signaling business last November.
2016-05-26,6:30 AM,South Korea picks GE to supply engines for homegrown fighter jets,"SEOUL South Korea has picked General Electric Co  to supply engines for its homegrown KF-X fighter jet project, preferring the U.S. giant over a European consortium in a deal that could be worth an estimated $3.5 billion."
2016-05-26,6:30 AM,S. Korea picks GE as preferred bidder for homegrown fighter jet engines,"SEOUL, May 26 General Electric Co has been chosen as the preferred bidder to supply engines for South Korea's KF-X homegrown fighter jets, the country's arms procurement agency said, beating Eurojet in what could be an estimated $3.5 billion deal."
2016-05-29,5:50 PM,Boeing mulls larger engine for biggest 737 MAX-sources,* Boeing mulls putting engine like LEAP-1A on largest 737 MAX
2016-06-02,8:11 AM,BRIEF-GE and Engro to launch alliance,* Ge and engro launch strategic alliance to support digital industrial growth throughout pakistan and region
2016-06-03,1:45 PM,BRIEF-General Electric announces offers to register outstanding notes,* General Electric Company announces offers to register outstanding notes of GE Capital International funding company unlimited company issued in October 2015 exchange offer  Source text for Eikon:  Further company coverage:    (Bengaluru Newsroom: +1-646-223-8780)
2016-06-06,8:15 PM,BRIEF-Qingdao Haier acquires GE appliances,* Qingdao Haier acquires GE appliances  Source text for Eikon:  Further company coverage:    (Bengaluru Newsroom: +1 646 223 8780)
2016-06-06,8:10 PM,BRIEF-GE completes sale of appliances business to Haier,* GE completes sale of appliances business to Haier  Source text for Eikon:  Further company coverage:    (Bengaluru Newsroom: +1 646 223 8780)
2016-06-09,9:25 PM,GE starts production of solar power inverters in Brazil,"SAO PAULO, June 9 General Electric Co has started producing solar power inverters at its plant in Betim, Brazil, looking to supply the country's nascent solar power industry and possibly export the equipment to countries in the region, a GE executive said on Thursday."
2016-06-09,6:03 AM,Unlikely casualty in California's renewable energy boom: natural gas,"In February of 2001, then California Governor Gray Davis stood at the site of Calpine Corp's new Sutter natural gas power plant and unveiled his plan to fast-track construction of similar stations to add 20,000 megawatts of modern, efficient generation to the state in three years."
2016-06-10,3:45 PM,BRIEF-GE sets quarterly dividend of $0.23/shr,* Sets quarterly dividend of $0.23 per share  Source text for Eikon:  Further company coverage:
2016-06-14,7:00 AM,BRIEF-GE introduces digital power plant for steam to enhance efficiency  of coal-fired plants,* Fired plants  Source text for Eikon:  Further company coverage:
2016-06-14,7:00 AM,BRIEF-GE opens new digital office in Paris,* GE expands industrial internet investment to fuel digitization of industry in Europe
2016-06-16,9:20 AM,GE in talks to buy offshore wind joint-venture Adwen -Figaro,"PARIS, June 16 General Electric is in talks with the French state and several companies about acquiring Areva-Gamesa's  offshore wind joint venture Adwen, GE chief Jeff Immelt told French daily Le Figaro."
2016-06-21,8:48 AM,GE seeks to sell remaining Hyundai Capital stake: Hyundai Motor,"SEOUL South Korean car maker Hyundai Motor Co  said on Tuesday General Electric  seeks to sell out of its 20 percent stake in their joint venture, unlisted lender Hyundai Capital, to a third party."
2016-06-21,8:48 AM,GE seeks to sell remaining Hyundai Capital stake - Hyundai Motor,"SEOUL, June 21 South Korean car maker Hyundai Motor Co said on Tuesday General Electric  seeks to sell out of its 20 percent stake in their joint venture, unlisted lender Hyundai Capital, to a third party."
2016-06-23,6:30 AM,BRIEF-GE gets offer from Cerberus Capital for its consumer finance business in France,* Ge receives binding offer from cerberus capital management for sale of consumer finance business in france
2016-06-24,2:50 PM,BRIEF-GE CEO says respect decision of British people; remain committed to UK and Europe,"* GE has 22,000 employees in UK and 100,000 employees in Europe overall that will continue to focus on delivering great outcomes for our customers"
2016-06-27,9:20 PM,BRIEF-General Electric to sell bulk of U.S. restaurant finance assets,* GE to sell bulk of U.S. restaurant finance assets in separate transactions to three buyers
2016-06-27,9:20 PM,GE Capital to sell bulk of U.S. restaurant franchise financing assets,June 27 General Electric Co said on Monday it would sell a bulk of GE Capital's U.S. restaurant franchise financing assets to three banks in separate deals.
2016-06-29,1:30 PM,"BRIEF-GE Capital cancels status as ""systemically important""",* GE Capital receives approval for rescission of status as systemically important financial institution
2016-06-29,1:15 PM,"U.S. lifts ""too big to fail"" designation of GE's financing unit","WASHINGTON, June 29 Lender GE Capital on Wednesday became the first firm to lose its designation as ""systemically important,"" a label born of the financial crisis that the U.S. government gives to institutions with potential to wreck the economy in the event of distress."
2016-06-30,9:30 PM,General Electric wins $919 million Pentagon contract,"WASHINGTON General Electric Co's GE Aviation unit has been awarded a $919 million cost-plus-incentive-fee contract for designing, fabricating, integrating and testing turbofan adaptive engines, the Pentagon said on Thursday."
2016-06-30,9:30 PM,General Electric wins $919 million Pentagon contract,"WASHINGTON, June 30 General Electric Co's  GE Aviation unit has been awarded a $919 million cost-plus-incentive-fee contract for designing, fabricating, integrating and testing turbofan adaptive engines, the Pentagon said on Thursday."
2016-07-07,11:15 AM,"GE, Senvion prepare bids for French wind group Adwen -sources","FRANKFURT/MADRID, July 7 General Electric  and German wind turbine maker Senvion are preparing bids for French windpower group Adwen, which is jointly owned by Spain's Gamesa and France's Areva, people familiar with the matter said."
2016-07-11,1:30 PM,"BRIEF-GE, Microsoft enter partnership to bring Predix technology to Azure cloud","* General Electric Co, Microsoft announce partnership that will make GE's Predix platform for industrial internet available on Microsoft Azure Cloud  Source text for Eikon:  Further company coverage:    (Bengaluru Newsroom: +1 646 223 8780)"
2016-07-14,10:31 AM,AIRSHOW-CFM International signs new deals worth $8.2 bln at Airshow,"FARNBOROUGH, England, July 14 Aircraft engine maker CFM International, jointly owned by General Electric  and France's Safran, said on Thursday it had won new deals worth $8.2 billion at the Farnborough Airshow."
2016-07-20,1:30 AM,GE takes digital strategy to China with Huawei tie-up,"SHANGHAI General Electric Co  on Wednesday said it would partner with Huawei Technologies Co Ltd [HWT.UL] to develop smart machines designed to boost productivity, part of a drive to promote its ""industrial internet"" business in China."
2016-07-20,1:55 AM,General Electric to make $500 million productivity savings from industrial internet,"SHANGHAI General Electric Co  will make $500 million of productivity savings in 2016 from using industrial internet applications, a company executive said on Wednesday."
2016-07-20,1:50 AM,General Electric to make $500 mln productivity savings from industrial internet,
2016-07-20,1:30 AM,General Electric to partner with China's Huawei on 'industrial internet',"SHANGHAI, July 20 General Electric Co on Wednesday said it will partner with China's Huawei Technologies Co Ltd to develop its ""industrial internet"" strategy."
