date,time,title,abstract
2015-03-09,3:55 PM,"Siemens tops global wind turbine market, Vestas slips, GE rises","COPENHAGEN, March 9 Siemens gained over Vestas to top the global wind turbine market as measured by market share of newly installed machines connected to the grid in 2014, according to an industry report, but the gap between the top three companies is small."
2015-03-10,10:02 PM,"GE CEO Immelt gets salary, cash bonus bump for 2014","General Electric Co  Chief Executive Officer Jeff Immelt earned roughly 8 percent increases in his salary and cash bonus in 2014, the U.S. conglomerate said in its proxy statement on Tuesday, despite a sluggish performance by GE's shares last year."
2015-03-10,9:56 PM,"GE CEO Immelt gets salary, cash bonus bump for 2014","March 10 General Electric Co Chief Executive Officer Jeff Immelt earned roughly 8 percent increases in his salary and cash bonus in 2014, the U.S. conglomerate said in its proxy statement on Tuesday, despite a sluggish performance by GE's shares last year."
2015-03-11,9:33 PM,GE weighs deeper cuts to banking business: WSJ,"General Electric Co  is considering making deeper cuts in its banking business, the Wall Street Journal reported, citing people familiar with the matter."
2015-03-11,9:24 PM,GE weighs deeper cuts to banking business - WSJ,"March 11 General Electric Co is considering making deeper cuts in its banking business, the Wall Street Journal reported, citing people familiar with the matter."
2015-03-11,6:43 PM,State could buy Alstom shares from Bouygues in coming months,"PARIS, March 11 A deal allowing the French state to buy up to 20 percent in engineering group Alstom  from construction group Bouygues will become effective ""in the coming months"", Economy Minister Emmanuel Macron said on Wednesday."
2015-03-11,4:28 PM,General Electric seeks to sell 500 of new gas turbines by 2030,"Niskayuna, NEW YORK, March 11 General Electric Co expects to sell 500 of its more highly efficient gas power turbines in the next 15 years, a company executive said on Wednesday during a meeting to spotlight the U.S. conglomerate's ability to innovate."
2015-03-11,2:46 PM,GE to base its renewables unit in France: Alstom chief,"PARIS General Electric Co  will base its renewable energy unit in Paris and put a Frenchman in charge of the division after it completes the purchase of the energy activities of France's Alstom , Alstom chief Patrick Kron said on Wednesday."
2015-03-11,2:41 PM,GE to base its renewables unit in France - Alstom chief,"PARIS, March 11 General Electric Co will base its renewable energy unit in Paris and put a Frenchman in charge of the division after it completes the purchase of the energy activities of France's Alstom, Alstom chief Patrick Kron said on Wednesday."
2015-03-13,8:47 AM,GE delivers turbines to Egypt as part of $1.9 billion deal,"SHARM EL-SHEIKH, Egypt General Electric Co  has delivered a shipment of gas turbines to Egypt as part of a $1.9 billion deal to boost power capacity, and will invest $200 million in a planned economic zone near the Suez Canal, the firm said on Friday."
2015-03-13,8:36 AM,UPDATE 2-GE delivers turbines to Egypt as part of $1.9 bln deal,"SHARM EL-SHEIKH, Egypt, March 13 General Electric Co has delivered a shipment of gas turbines to Egypt as part of a $1.9 billion deal to boost power capacity, and will invest $200 million in a planned economic zone near the Suez Canal, the firm said on Friday."
2015-03-16,6:10 PM,GE's Immelt touts value of conglomerate's scale to investors,General Electric Co  Chief Executive Officer Jeff Immelt is sticking by his company's model for housing diverse businesses under one roof at a time when other U.S. conglomerates are looking at hiving off units to please investors.
2015-03-16,6:00 PM,GE's Immelt touts value of conglomerate's scale to investors,March 16 General Electric Co Chief Executive Officer Jeff Immelt is sticking by his company's model for housing diverse businesses under one roof at a time when other U.S. conglomerates are looking at hiving off units to please investors.
2015-03-16,5:00 PM,Bouygues delays nomination of GE's Gaymard to board,"PARIS Bouygues  said on Monday that it had postponed a proposal for Clara Gaymard, head of General Electric  in France, to join the board of the French construction group."
2015-03-16,4:55 PM,Bouygues delays nomination of GE's Gaymard to board,"PARIS, March 16 Bouygues said on Monday that it had postponed a proposal for Clara Gaymard, head of General Electric in France, to join the board of the French construction group."
2015-03-17,12:20 PM,EU mergers and takeovers (March 17),"BRUSSELS, March 17 The following are mergers under review by the European Commission and a brief guide to the EU merger process:"
2015-03-17,1:35 PM,DIARY-U.S. MEETINGS/WEEK AHEAD,"Thomson Reuters March 16, 2015 - Corporate Meetings for US companies for Week ahead.         S&P 500 Earnings - MONTH AHEAD     Dividends                            Non S&P 500 - Weekly             Federal Reserve events               ConferenceCall/Webcast - Weekly  Meetings - Weekly                                Xtra users can see more details on conference calls & webcasts by hovering your mouse  over the RIC, right click, now click on Related Co Data, now click on Co Events."
2015-03-17,11:01 AM,EU deadline on GE's $13 billion Alstom deal extended to Aug. 6,BRUSSELS European Union antitrust regulators have extended their deadline for a decision on General Electric's  12.4 billion euro ($13.15 billion) bid for Alstom's  power equipment business after a request from the U.S. group.
2015-03-17,11:00 AM,EU deadline on GE's $13 bln Alstom deal extended to Aug. 6,"BRUSSELS, March 17 European Union antitrust regulators have extended their deadline for a decision on General Electric's 12.4 billion euro ($13.15 billion) bid for Alstom's power equipment business after a request from the U.S. group."
2015-03-26,12:17 AM,GE expands job cuts at Lufkin oil unit to 575 from 330,"General Electric Co  said it increased planned job cuts in its Lufkin oilfield equipment unit to 575, as it grapples with pressure on the unit from the drop in oil prices."
2015-03-26,1:15 AM,UPDATE 1-GE expands job cuts at Lufkin oil unit to 575 from 330,"March 25 General Electric Co said it increased planned job cuts in its Lufkin oilfield equipment unit to 575, as it grapples with pressure on the unit from the drop in oil prices."
2015-03-26,12:15 AM,GE expands job cuts at Lufkin oil unit to 575 from 330 -Bloomberg,"March 25 General Electric Co increased planned job cuts in its Lufkin oilfield equipment unit to 575, as it grapples with pressure on the unit from the drop in oil prices, Bloomberg reported. (http://bloom.bg/1Ozj9lF)"
2015-04-01,12:03 PM,"GE could fund turnaround of Puerto Rico utility, documents show","NEW YORK General Electric would commit to financing a new natural gas plant in Puerto Rico under a debt restructuring plan proposed by creditors of the island's struggling power utility, according to plan documents obtained by Reuters."
2015-04-01,10:00 AM,"RPT-GE could fund turnaround of Puerto Rico utility, documents show","NEW YORK, April 1 General Electric would commit to financing a new natural gas plant in Puerto Rico under a debt restructuring plan proposed by creditors of the island's struggling power utility, according to plan documents obtained by Reuters."
2015-04-01,6:51 AM,"GE could fund turnaround of Puerto Rico utility, documents show","NEW YORK General Electric would commit to financing a new natural gas plant in Puerto Rico under a debt restructuring plan proposed by creditors of the island’s struggling power utility, according to plan documents obtained by Reuters."
2015-04-01,6:30 AM,"GE could fund turnaround of Puerto Rico utility, documents show","NEW YORK, April 1 General Electric would commit to financing a new natural gas plant in Puerto Rico under a debt restructuring plan proposed by creditors of the island's struggling power utility, according to plan documents obtained by Reuters."
2015-04-03,3:00 PM,"Fire hits part of GE's Louisville facility, no injuries reported","LOUISVILLE, Ky. A huge fire ripped through a section of General Electric's Louisville, Kentucky facility used for warehousing and offices on Friday, forcing the giant industrial park to shut down for at least the coming week, the company and union officials said. | Video"
2015-04-03,3:35 PM,"UPDATE 5-Fire hits part of GE's Louisville facility, no injuries reported","LOUISVILLE, Ky., April 3 A huge fire ripped through a section of General Electric's Louisville, Kentucky facility used for warehousing and offices on Friday, forcing the giant industrial park to shut down for at least the coming week, the company and union officials said."
2015-04-09,5:48 PM,GE close to selling nearly all its real estate holdings: source,"General Electric Co is nearing a deal to sell practically all of its $30 billion real estate portfolio to a consortium led by Blackstone Group and Wells Fargo & Co, according to a person familiar with the matter."
2015-04-09,6:05 PM,UPDATE 3-GE close to selling nearly all its real estate holdings -source,"* Shares rise 2.4 pct   (Adds analyst comment, updates GE share price)"
2015-04-09,10:01 AM,Deals of the day- Mergers and acquisitions,"April 9 The following bids, mergers, acquisitions and disposals were reported by 2000 GMT on Thursday:"
2015-04-09,5:45 PM,GE close to selling part or all of its real estate holdings - WSJ,"April 9 General Electric Co is close to selling part or all of its real estate holdings, the Wall Street Journal reported, citing people familiar with the matter."
2015-04-10,11:22 PM,Blackstone swooped on regulation-weary GE to do mega real estate deal,"It took Blackstone Group LP less than four weeks after an approach from General Electric Co to clinch the biggest real estate deal since the financial crisis. Yet the seeds of that deal were planted seven years ago, during the crisis."
2015-04-10,11:20 PM,Blackstone swooped on regulation-weary GE to do mega real estate deal,"April 10 It took Blackstone Group LP less than four weeks after an approach from General Electric Co  to clinch the biggest real estate deal since the financial crisis. Yet the seeds of that deal were planted seven years ago, during the crisis."
2015-04-10,12:25 AM,"GE to sell bulk of finance unit, return up to $90 billion to investors",General Electric Co will shed most of its finance unit and return as much as $90 billion to shareholders as it becomes a “simpler” industrial business instead of an unwieldy hybrid of banking and manufacturing. | Video
2015-04-10,10:45 PM,GE's CEO and his stock win a boost after a long dry spell,"General Electric Co Chief Executive Jeff Immelt has had a bumpy ride for the past seven years, navigating economic turbulence, swapping in and out of businesses and struggling to energize his sluggish stock."
2015-04-10,10:40 PM,GE's CEO and his stock win a boost after a long dry spell,"April 10 General Electric Co Chief Executive Jeff Immelt has had a bumpy ride for the past seven years, navigating economic turbulence, swapping in and out of businesses and struggling to energize his sluggish stock."
2015-04-10,8:36 PM,US STOCKS-GE sparks broad Wall St rally; indexes post weekly gains,* GE set for $50 bln buyback plan; shares most active on NYSE
2015-04-10,10:35 AM,Deals of the day- Mergers and acquisitions,"April 10 The following bids, mergers, acquisitions and disposals were reported by 2000 GMT on Friday:"
2015-04-10,7:43 PM,GE plan further shrinks its money market presence,"NEW YORK General Electric Co.'s plan to retrench from the finance business will further reduce its already diminishing presence in the U.S. money market, which it has leaned on to fund consumer and business loans."
2015-04-10,7:41 PM,GE plan further shrinks its money market presence,"NEW YORK, April 10 General Electric Co.'s  plan to retrench from the finance business will further reduce its already diminishing presence in the U.S. money market, which it has leaned on to fund consumer and business loans."
2015-04-10,11:10 AM,"UPDATE 5-GE to sell bulk of finance unit, return up to $90 billion to investors","April 10 General Electric Co will shed most of its finance unit and return as much as $90 billion to shareholders as it becomes a ""simpler"" industrial business instead of an unwieldy hybrid of banking and manufacturing."
2015-04-11,10:08 AM,"GE to sell bulk of finance unit, return up to $90 billion to investors",General Electric Co will shed most of its finance unit and return as much as $90 billion to shareholders as it becomes a “simpler” industrial business instead of an unwieldy hybrid of banking and manufacturing. | Video
2015-04-13,8:36 PM,US STOCKS-Wall St ends down as earnings worries deepen,"* Indexes down: Dow 0.5 pct, S&P 0.5 pct, Nasdaq 0.2 pct   (Updates to close)"
2015-04-13,10:31 AM,Deals of the day- Mergers and acquisitions,"April 13 The following bids, mergers, acquisitions and disposals were reported by 2000 GMT on Monday:"
2015-04-13,6:41 PM,"US STOCKS-Dow, S&P 500 edge lower as earnings worries deepen",* Netflix to raise share authorization in step to split stock
2015-04-13,7:46 AM,Abu Dhabi's Mubadala GE Capital says no plans to change shareholdings,"ABU DHABI, April 13 Mubadala GE Capital, a venture between Abu Dhabi state fund Mubadala and GE Capital, said its ownership and strategy would remain unchanged despite General Electric's decision to divest most of its finance unit."
2015-04-15,8:46 PM,GE points way for 'too big to fail' peers,"If shedding its financing arm did wonders for General Electric’s stock price, maybe too-big-to-fail bank peers like Citibank and JP Morgan should consider similar moves."
2015-04-15,3:45 PM,GE CEO must convince skeptics his industrial strategy can win,"April 15 As General Electric Co stock soared last Friday to its biggest one-day gain in six years, investor Patrick Kaser's fund made a choice: Sell it all."
2015-04-15,3:06 PM,Fitch: GE Divestment Highlights SIFIs' Capital Allocation Focus,"(The following statement was released by the rating agency) NEW YORK, April 15 (Fitch) General Electric's planned divestment of the majority  of GE Capital Corporation (GECC) highlights the increasing capital allocation  focus for U.S. systemically important financial institutions (SIFIs), says Fitch  Ratings. Fitch believes that management's key aim with the divestitures is to  boost GE's equity valuation through the disposal of substantial parts of GECC  while refocusing on its core industrial"
2015-04-16,8:06 AM,GE points way for 'too big to fail' peers,"If shedding its financing arm did wonders for General Electric’s stock price, maybe too-big-to-fail bank peers like Citibank and JP Morgan should consider similar moves."
2015-04-17,11:48 AM,"Wall Street falls steeply with China, Greece fears paramount","The S&P 500 posted its biggest percentage loss since March 25 on Friday as investors shunned risk amid new trading regulations in China, renewed worries about Greece running out of money, and tepid U.S. corporate earnings."
2015-04-17,8:55 PM,"US STOCKS-Wall St falls steeply with China, Greece fears paramount","* Indexes down: Dow 1.5 pct, S&P 1.1 pct, Nasdaq 1.5 pct   (Updates to close)"
2015-04-17,7:25 PM,"US STOCKS-Wall St selloff accelerates amid China, earnings fears","* Indexes down: Dow 1.8 pct, S&P 1.4 pct, Nasdaq 1.8 pct   (Updates to late afternoon)"
2015-04-17,6:42 PM,"Strong dollar hit to GE, Honeywell may bode poorly for other industrials","General Electric Co  and Honeywell International Inc  said on Friday they will take steps to cushion the impact of a stronger dollar, which hurt first-quarter results at both companies."
2015-04-17,6:40 PM,"Strong dollar hit to GE, Honeywell may bode poorly for other industrials","April 17 General Electric Co and Honeywell International Inc said on Friday they will take steps to cushion the impact of a stronger dollar, which hurt first-quarter results at both companies."
2015-04-17,5:20 PM,"US STOCKS-Wall St tumbles, hit by weak earnings, China","* Indexes down: Dow 1.34 pct, S&P 0.99 pct, Nasdaq 1.43 pct   (Updates to afternoon prices, commentary)"
2015-04-17,10:44 AM,"GE industrial first-quarter profit rises, revenue falls on stronger dollar","General Electric Co's  quarterly industrial earnings rose 9 percent, helped by cost cuts that expanded profit margins, as the U.S. conglomerate banks on manufacturing of jet engines, turbines and other big-ticket products as it unloads most of its finance business. | Video"
2015-04-17,3:40 PM,"US STOCKS-Wall St tumbles, hit by weak earnings, China","* Indexes down: Dow 1.46 pct, S&P 1.11 pct, Nasdaq 1.45 pct   (Adds comment, updates prices)"
2015-04-17,11:16 AM,"UPDATE 3-GE industrial 1st-qtr profit rises, revenue falls on stronger dollar","April 17 General Electric Co's quarterly industrial earnings rose 9 percent, helped by cost cuts that expanded profit margins, as the U.S. conglomerate banks on manufacturing of jet engines, turbines and other big-ticket products as it unloads most of its finance business."
2015-04-17,1:20 PM,TRLPC-GE Capital sale shakes up U.S. middle market lending,"NEW YORK, April 17 General Electric Co's  plans to sell most of its finance unit, GE Capital, will create opportunities for new lenders in U.S. middle market leveraged loans as a dominant player in commercial lending and sponsor finance leaves the field."
2015-04-20,1:55 PM,Deals of the day- Mergers and acquisitions,"April 20 The following bids, mergers, acquisitions and disposals were reported by 2000 GMT on Monday:"
2015-04-20,4:23 PM,"GE in talks to sell lending, leasing portfolio to Wells Fargo: source","General Electric Co is in early-stage talks with Wells Fargo & Co about selling its entire $74 billion U.S. commercial lending and leasing (CLL) portfolio to the bank, according to a source familiar with the situation."
2015-04-20,4:40 PM,"UPDATE 2-GE in talks to sell lending, leasing portfolio to Wells Fargo-source","April 20 General Electric Co is in early-stage talks with Wells Fargo & Co about selling its entire $74 billion U.S. commercial lending and leasing (CLL) portfolio to the bank, according to a source familiar with the situation."
2015-04-20,4:20 PM,GE in talks to sell $74 bln portfolio to Wells Fargo,"April 20 General Electric Co is in early-stage talks with Wells Fargo about selling the bank its entire $74 billion U.S. commercial lending and leasing portfolio, according to a source familiar with the situation."
2015-04-22,6:37 AM,GE to sell Czech bank unit in two years: newspaper,"PRAGUE General Electric (GE)  will sell its Czech banking unit within two years, the bank's Chief Executive Sean Morrissey was quoted saying on Wednesday in newspaper Hospodarske Noviny."
2015-04-22,6:32 AM,GE to sell Czech bank unit in 2 years -Hospodarske Noviny paper,"PRAGUE, April 22 General Electric (GE)  will sell its Czech banking unit within two years, the bank's Chief Executive Sean Morrissey was quoted saying on Wednesday in newspaper Hospodarske Noviny."
2015-04-24,10:22 PM,GE fights unsealing of documents in microwave lawsuit,General Electric is challenging a federal judge's order to unseal court documents regarding its analysis of consumer injuries and complaints over microwave ovens with glass doors that are allegedly prone to shattering.
2015-04-24,9:10 PM,"GE buyout-lending unit draws interest from SunTrust, Apollo, Ares: Bloomberg","SunTrust Banks Inc, Apollo Global Management and Ares Management LP are considering offers for buying General Electric Co's unit that lends to private-equity firms in the United States, Bloomberg reported, citing people with knowledge of the matter."
2015-04-24,9:01 PM,"GE buyout-lending unit draws interest from SunTrust, Apollo, Ares - Bloomberg","April 24 SunTrust Banks Inc, Apollo Global Management and Ares Management LP are considering offers for buying General Electric Co's unit that lends to private-equity firms in the United States, Bloomberg reported, citing people with knowledge of the matter."
2015-05-03,2:41 PM,Bangladesh's Summit Group and GE start joint power plant,"DHAKA A joint venture of Summit Group, Bangladesh’s leading power producer, and a unit of General Electric Co has started a plant initially supplying up to 240 megawatts (MW) of electricity to the country's national grid as it seeks to plug a shortfall in electricity supply."
2015-05-04,7:12 PM,GE boss to meet EU antitrust chief probing Alstom deal - source,"BRUSSELS General Electric's CEO will meet Europe's antitrust chief on Tuesday, according to a source, in what is expected to be a push for unconditional EU approval for its 12.4-billion-euro ($13.8 billion) bid for an Alstom  business."
2015-05-04,4:19 PM,"GE ties up with Qualcomm, Apple in new lighting business bet",General Electric Co on Monday announced collaborations with Qualcomm Inc and Apple Inc as it uses digital technology and the growing appetite for data to reinvigorate its 130-year-old lighting business.
2015-05-04,2:01 PM,GE boss to meet EU antitrust chief probing Alstom deal: source,"BRUSSELS General Electric's  CEO will meet Europe's antitrust chief on Tuesday, according to a source, in what is expected to be a push for unconditional EU approval for its 12.4-billion-euro ($13.8 billion) bid for an Alstom  business."
2015-05-04,2:40 PM,UPDATE 2-GE boss to meet EU antitrust chief probing Alstom deal - source,"BRUSSELS, May 4 General Electric's CEO will meet Europe's antitrust chief on Tuesday, according to a source, in what is expected to be a push for unconditional EU approval for its 12.4-billion-euro ($13.8 billion) bid for an Alstom business."
2015-05-04,4:15 PM,"GE ties up with Qualcomm, Apple in new lighting business bet",May 4 General Electric Co on Monday announced collaborations with Qualcomm Inc and Apple Inc as it uses digital technology and the growing appetite for data to reinvigorate its 130-year-old lighting business.
2015-05-04,1:50 PM,GE CEO to meet EU antitrust chief now probing Alstom bid - source,"BRUSSELS, May 4 General Electric's chief executive, Jeff Immelt, will meet the EU's antitrust chief on Tuesday, a person familiar with the matter said on Monday, amid an ongoing investigation into the U.S. group's 12.4-billion-euro ($13.8 billion) bid for Alstom."
2015-05-06,6:31 AM,"UPDATE 2-Alstom swings to loss on U.S. fine, Russian write-offs","* Maintains medium-term earnings targets   (Adds analyst forecasts, CEO comments)"
2015-05-07,6:11 AM,BRIEF-Cembra Money takes note of GE's announcement to sell its stake in Cembra,* Takes note of General Electric's announcement to sell its stake in Cembra and intends to participate in GE's accelerated bookbuilding offering
2015-05-08,9:36 PM,"GE wins deal worth up to $2 billion for engines for Taiwan, others","WASHINGTON General Electric Co  has won a five-year contract valued at up to $2 billion to supply helicopter engines to the government of Taiwan and support a number of U.S. military services, the Defense Department said on Friday."
2015-05-08,9:35 PM,"GE wins deal worth up to $2 bln for engines for Taiwan, others","WASHINGTON, May 8 General Electric Co has won a five-year contract valued at up to $2 billion to supply helicopter engines to the government of Taiwan and support a number of U.S. military services, the Defense Department said on Friday."
2015-05-11,1:45 PM,GE would offer concessions to win EU approval of Alstom deal: executive,NEW YORK/BRUSSELS General Electric Co  said on Monday for the first time it would be willing to consider concessions in order to win European approval to acquire the power equipment unit of France's Alstom .
2015-05-11,3:15 PM,UPDATE 2-GE would offer concessions to win EU approval of Alstom deal-exec,"NEW YORK/BRUSSELS, May 11 General Electric Co  said on Monday for the first time it would be willing to consider concessions in order to win European approval to acquire the power equipment unit of France's Alstom."
2015-05-11,7:10 PM,GE would offer concessions to win EU approval for Alstom deal -exec,May 11 A General Electric Co executive said on Monday that the company would be willing to consider concessions in order to win European approval to acquire the power equipment unit of France's Alstom.
2015-05-12,2:20 PM,CEE bank sales offer investors a shot at growth markets,"WARSAW/PRAGUE - May 12 More mid-sized banks are coming up for sale in central Europe as foreign owners retrench and stubbornly low interest rates squeeze others, creating openings for investors looking for a foothold in economies offering faster growth than the euro zone."
2015-05-12,1:05 PM,DIARY-U.S. MEETINGS/WEEK AHEAD,"Thomson Reuters May 12, 2015 - Corporate Meetings for US companies for Week ahead.         S&P 500 Earnings - MONTH AHEAD     Dividends                            Non S&P 500 - Weekly             Federal Reserve events               ConferenceCall/Webcast - Weekly  Meetings - Weekly                                Xtra users can see more details on conference calls & webcasts by hovering your mouse  over the RIC, right click, no click on Related Co Data, now click on Co Events.             ** For"
2015-05-12,9:25 AM,"EU regulators to decide on GE, Alstom deal by Aug. 21","BRUSSELS, May 12 European Union antitrust regulators have resumed their investigation into General Electric's 12.4-billion-euro ($13.97 billion) bid for Alstom's energy unit after receiving requested data from the U.S. conglomerate."
2015-05-13,11:26 AM,EU mergers and takeovers (May 13),"BRUSSELS, May 13 The following are mergers under review by the European Commission and a brief guide to the EU merger process:"
