date,time,title,abstract
2017-11-13,2:05 PM,"General Electric to focus to power, healthcare and aviation, cuts outlook","Nov 13 General Electric Co said on Monday it will narrow its focus to power, healthcare and aviation business, and set an earnings target between $1.00 and $1.07 per share for next year, a drop from its earlier forecast, the company said on Monday."
2017-11-13,11:39 AM,GE slashes quarterly dividend,General Electric Co  said on Monday it would halve its quarterly dividend to 12 cents per share.
2017-11-13,11:39 AM,GE slashes quarterly dividend,Nov 13 General Electric Co said on Monday it would halve it quarterly dividend to 12 cents per share.
2017-11-13,11:32 AM,BRIEF-GE to reduce quarterly dividend in conjunction with revised capital allocation framework,* GE plans to reduce quarterly dividend in conjunction with revised capital allocation framework
2017-11-13,11:00 AM,RPT-Membership revoked? Veteran GE's spot in exclusive Dow may be shaky,"NEW YORK, Nov 12 It is hard to imagine the Dow Jones Industrial Average without General Electric Co. The U.S. industrial conglomerate's stock is the lone original component of the venerable blue-chip index that debuted in 1896."
2017-11-14,12:33 PM,"GE, energy shares drag Wall Street lower; bond proxies rise",NEW YORK U.S. stock indexes fell on Tuesday as General Electric shares plunged for a second straight day and a drop in crude oil prices hit energy stocks. | Video
2017-11-14,12:33 PM,"US STOCKS-GE, energy shares drag Wall St lower; bond proxies rise","* Dow down 0.13 pct, S&P 500 down 0.23 pct, Nasdaq down 0.29 pct (Updates to close, changes comment; adds byline)"
2017-11-14,6:16 PM,GE tumbles for a second day after announcing major overhaul,General Electric Co's  shares slumped for a second straight day on Tuesday as investors wondered if a massive overhaul by new Chief Executive John Flannery to save billions and make the conglomerate smaller was enough to revive the 125-year-old Dow component.
2017-11-14,6:16 PM,UPDATE 1-GE tumbles for a second day after announcing major overhaul,Nov 14 General Electric Co's shares slumped for a second straight day on Tuesday as investors wondered if a massive overhaul by new Chief Executive John Flannery to save billions and make the conglomerate smaller was enough to revive the 125-year-old Dow component.
2017-11-14,6:09 PM,GE stock deflates for a second day after announcing major overhaul,Nov 14 General Electric Co's shares drifted lower for a second straight day on Tuesday after investors wondered if a massive overhaul by new Chief Executive John Flannery to save billions and make the conglomerate smaller was enough to revive the 125-year old Dow component.
2017-11-14,1:52 PM,"CORRECTED-BRIEF-GE expects 25 pct reduction of corporate staff worldwide this year, largely completed - CFO (Nov. 13)","* General Electric Co expects 25 percent reduction of corporate staff worldwide this year, largely completed - CFO Jamie Miller​ Further company coverage:"
2017-11-14,2:36 PM,Breakingviews - GE's shaman exorcises ghosts of false expectations,"NEW YORK (Reuters Breakingviews) - It doesn’t take much imagination at work to grasp the religious undertones in General Electric  boss John Flannery's plan for the $178 billion conglomerate. He says he is ""looking for the soul of the company again."" Now, some 100 days into the job, Flannery has categorically exorcised the ghosts of false expectations past by halving its dividend, reducing earnings guidance and questioning entire swaths of the company's portfolio of industrial assets"
2017-11-14,12:17 PM,"GE says plans new wind farms in Finland, Sweden","HELSINKI General Electric's  power generation unit is planning to build new wind farms in Finland and Sweden, a company executive said on Tuesday."
2017-11-14,12:17 PM,"GE says plans new wind farms in Finland, Sweden","HELSINKI, Nov 13 General Electric's power generation unit is planning to build new wind farms in Finland and Sweden, a company executive said on Tuesday."
2017-11-14,5:47 AM,"Shrinking GE rattles investors, shares hit 5-year low","General Electric Co's  new Chief Executive John Flannery on Monday outlined steps that will turn the biggest U.S. industrial conglomerate into a smaller, more focused company, surprising some investors who sold the company's shares to a five-year low. | Video"
2017-11-15,1:53 PM,BRIEF-General Electric names Raghu Krishnamoorthy chief human resources officer,"* GE - Raghu Krishnamoorthy, vice president of human resources at GE healthcare, named chief human resources officer; Susan Peters to retire from GE Further company coverage:"
2017-11-16,10:16 PM,"BRIEF-GE director Steven​ Mollenkopf buys 5,500 shares of co's common stock","* General Electric director Steven​ ‍mollenkopf reports purchase of 5,500 shares of co's common stock on Nov 16 at $18.24 per share - SEC filing Source text: (http://bit.ly/2yP8kJa)"
2017-11-17,2:47 PM,GE shares rise after CEO Flannery buys stock,"Shares of General Electric Co  opened higher on Friday after Chief Executive John Flannery disclosed that he bought 60,000 shares of the industrial conglomerate's stock."
2017-11-17,2:47 PM,GE shares rise after CEO Flannery buys stock,"Nov 17 Shares of General Electric Co opened higher on Friday after Chief Executive John Flannery disclosed that he bought 60,000 shares of the industrial conglomerate's stock."
2017-11-17,1:33 PM,"BRIEF-General Electric CEO John Flannery reports open market purchase of 60,000 shares of co's common stock on Nov 15 at $18.27 per share","* General Electric Co CEO John L. Flannery reports open market purchase of 60,000 shares of co's common stock on November 15 at $18.27per share - SEC Filing Source text: [http://bit.ly/2j1qEbq] Further company coverage:"
2017-11-21,11:12 AM,Battered GE shares lure some buyers but worst may not be over,"NEW YORK General Electric Co  shares stabilized after a brutal slide last week sent the stock near six-year lows, but the worst may not be over."
2017-11-22,10:07 AM,"BRIEF-General Electric, Iraqi Ministry of Electricity sign $400 mln contract",* Says Iraqi Ministry Of Electricity and GE sign $400 million contract to build 14 electric substations
2017-11-28,8:58 PM,"Fitch cuts GE rating, outlook negative","Fitch Ratings on Tuesday downgraded General Electric Co  and its finance arm, GE Capital, citing deterioration in the industrial conglomerate's operating and financial performance."
2017-11-28,8:58 PM,"Fitch cuts GE rating, outlook negative","Nov 28 Fitch Ratings on Tuesday downgraded General Electric Co and its finance arm, GE Capital, citing deterioration in the industrial conglomerate's operating and financial performance."
2017-11-28,7:33 PM,Fitch Downgrades GE to 'A+/F1'; Outlook Negative,"(The following statement was released by the rating agency) CHICAGO, November 28 (Fitch) Fitch Ratings has downgraded the Long- and Short-Term Issuer Default Ratings (IDRs) for General Electric Company (GE) and GE Capital Global Holdings, LLC (GE Capital) to 'A+' and 'F1' from 'AA-' and 'F1+'. The Rating Outlook is Negative. A full list of ratings follows at the end of this release. KEY RATING DRIVERS GE Industrial The downgrade of GE's ratings considers the deterioration in the company's operat"
2017-12-01,10:58 PM,General Electric lays off workers at power business in New York,"NEW YORK General Electric Co  said on Friday it was laying off workers at its power division in Schenectady, New York, as it tries to reduce costs after a steep profit drop at the division."
2017-12-01,10:58 PM,General Electric lays off workers at power business in New York,"NEW YORK, Dec 1 General Electric Co said on Friday it was laying off workers at its power division in Schenectady, New York, as it tries to reduce costs after a steep profit drop at the division."
2017-12-04,6:07 PM,"BRIEF-S&P Lowers GE Rating To 'A' From 'AA-', Outlook Stable","* S&P SAYS GENERAL ELECTRIC CO. RATING LOWERED TO 'A' FROM 'AA-' ON HIGHER LEVERAGE, LOWER CASH FLOW; OUTLOOK STABLE Source text : [ID:http://bit.ly/2kk3v8n] Further company coverage:"
2017-12-05,8:48 PM,"General Electric to cut 4,500 jobs in Europe - report","PARIS, Dec 5 U.S. firm General Electric will cut 4,500 jobs across Europe after reviewing assets it purchased from France's Alstom in 2015, French newspaper Les Echos said on Tuesday."
2017-12-05,7:02 AM,Japan Airlines invests $10 mln in supersonic jet company Boom,"Dec 5 Denver-based startup Boom Supersonic said on Tuesday Japan's No.2 carrier Japan Airlines Co Ltd has invested $10 million in the company, which is building a supersonic passenger aircraft it claims will be faster, quieter and more affordable to fly than Concorde."
2017-12-06,8:53 PM,"General Electric to cut 4,500 jobs in Europe: source","General Electric Co  plans to cut as many as 4,500 jobs in Europe as the U.S. industrial conglomerate shrinks its troubled power generation business, a labor union source said on Tuesday."
2017-12-06,8:53 PM,"UPDATE 2-General Electric to cut 4,500 jobs in Europe -source","Dec 6 General Electric Co plans to cut as many as 4,500 jobs in Europe as the U.S. industrial conglomerate shrinks its troubled power generation business, a labor union source said on Tuesday."
2017-12-06,11:27 AM,BRIEF-GE Renewable Energy Selected For The Supply Of Two Hydropower Plants In Brazil,* GE RENEWABLE ENERGY SELECTED FOR THE SUPPLY OF TWO HYDROPOWER PLANTS IN BRAZIL
2017-12-07,11:33 AM,"General Electric to cut 12,000 jobs in power business revamp","ZURICH/LAS VEGAS General Electric Co  said Thursday it is axing 12,000 jobs at its global power business, the struggling industrial conglomerate's latest effort to shrink itself into a more focused company. | Video"
2017-12-07,11:33 AM,"UPDATE 3-General Electric to cut 12,000 jobs in power business revamp","ZURICH/LAS VEGAS, Dec 7 General Electric Co said Thursday it is axing 12,000 jobs at its global power business, the struggling industrial conglomerate's latest effort to shrink itself into a more focused company."
2017-12-07,4:42 PM,General Electric says France to be spared power business job cuts,"ZURICH General Electric's  decision to ax 12,000 jobs from its struggling power business will not hit its French operations, a senior GE executive told Reuters on Thursday."
2017-12-07,4:20 PM,General Electric says France to be spared power business job cuts,"ZURICH, Dec 7 General Electric's decision to axe 12,000 jobs from its struggling power business will not hit its French operations, a senior GE executive told Reuters on Thursday."
2017-12-07,10:04 AM,Qatar flexes financial muscle with 12 billion euros of French deals,"DOHA Qatar will buy fighter jets and armored vehicles as part of 12 billion euros worth of commercial contracts it agreed with France on Thursday, bolstering its military capability and its international ties as it faces a boycott by other Arab states. | Video"
2017-12-07,12:58 PM,"CORRECTED-UPDATE 1-General Electric to cut 12,000 jobs in power business revamp","ZURICH, Dec 7 General Electric Co is axing 12,000 jobs at its global power business, the struggling industrial conglomerate's latest effort to shrink itself into a more focused company."
2017-12-07,12:20 PM,"GE to cut 1,100 power business jobs in Britain","LONDON General Electric Co  plans to cut around 1,100 jobs or 6 percent of its workforce across its power business in Britain following a significant deterioration in its markets, it said on Thursday."
2017-12-07,12:28 PM,US STOCKS-Futures sluggish; eyes on tax bill talks and General Electric,"* Futures: Dow down 13 pts, S&P up 1.5 pts, Nasdaq up 15.75 pts"
2017-12-07,12:18 PM,"GE to cut 1,100 power business jobs in Britain","LONDON, Dec 7 General Electric Co plans to cut around 1,100 jobs or 6 percent of its workforce across its power business in Britain following a significant deterioration in its markets, it said on Thursday."
2017-12-07,12:18 PM,"BRIEF-GE Power's Planned 12,000 Headcount Reduction To Affect Employees Primarily Outside The U.S.","* GE SAYS GE POWER'S PLANNED 12,000 HEADCOUNT REDUCTION TO AFFECT EMPLOYEES PRIMARILY OUTSIDE THE U.S."
2017-12-11,9:28 PM,BRIEF-Lowell Mcadam Resigns From GE Board,"* GE SAYS ON DEC 8, LOWELL MCADAM RESIGNED FROM BOARD - SEC FILING Source text: (http://bit.ly/2ALyrT3) Further company coverage:"
2017-12-12,12:40 PM,BRIEF-Drawbridge Health And Thorne Research Announce Strategic Collaboration,* GENERAL ELECTRIC CO - DRAWBRIDGE HEALTH AND THORNE RESEARCH ANNOUNCE STRATEGIC COLLABORATION Source text - http://bit.ly/2AMRkVN Further company coverage:
2017-12-14,8:37 PM,Argentina's YPF to sell 25 percent of electricity unit to GE: source,"BUENOS AIRES Argentina's state-owned oil company YPF SA  will sell a 25 percent stake in its electricity generation unit to U.S. industrial conglomerate General Electric Co , a source close to the deal told Reuters on Thursday."
2017-12-14,8:37 PM,Argentina's YPF to sell 25 pct of electricity unit to GE -source,"BUENOS AIRES, Dec 14 Argentina's state-owned oil company YPF SA will sell a 25 percent stake in its electricity generation unit to U.S. industrial conglomerate General Electric Co, a source close to the deal told Reuters on Thursday."
2017-12-14,12:48 PM,"Tata Group, GE partner to make LEAP engine components in India","Steel-to-software conglomerate Tata Group and General Electric Co (GE) entered into a partnership in November to manufacture components for engine-maker CFM International in India, the two companies said in a statement on Thursday."
2017-12-14,12:48 PM,"Tata Group, GE partner to make LEAP engine components in India","Dec 14 Steel-to-software conglomerate Tata Group and General Electric Co (GE) entered into a partnership in November to manufacture components for engine-maker CFM International in India, the two companies said in a statement on Thursday."
2017-12-14,10:43 AM,"BRIEF-Tata Group, GE Partner To Manufacture Leap Engine Components In India",* GE AND TATA GROUP ENTER INTO STRATEGIC PARTNERSHIP TO MANUFACTURE LEAP ENGINE COMPONENTS IN INDIA
2017-12-18,1:55 PM,BRIEF-GE Power Says Selected By Alco Bio Fuel To Deploy Predix-Based Asset Performance Management Solution To Refinery's Unit's Refinery Field Operations,* GE POWER SAYS SELECTED BY ALCO BIO FUEL TO DEPLOY PREDIX-BASED ASSET PERFORMANCE MANAGEMENT SOLUTION TO REFINERY’S UNIT’S REFINERY FIELD OPERATIONS Source text: (http://bit.ly/2B8OePa) Further company coverage:
2017-12-22,3:13 PM,Canada's CN Rail to buy 200 GE locomotives for future growth,"TORONTO Canadian National Railway Co will buy 200 locomotives in the next three years from General Electric Co, Canada's biggest railway operator said on Friday, to support expected growth and drive efficiencies."
2017-12-22,3:13 PM,UPDATE 1-Canada's CN Rail to buy 200 GE locomotives for future growth,"TORONTO, Dec 22 Canadian National Railway Co will buy 200 locomotives in the next three years from General Electric Co, Canada's biggest railway operator said on Friday, to support expected growth and drive efficiencies."
2017-12-22,3:10 PM,Canada's CN Rail to buy 200 General Electric locomotives,"Dec 22 Canadian National Railway Co said on Friday it will buy 200 locomotives in the next three years from General Electric Co, betting on higher demand for crude oil transportation."
2017-12-22,2:18 PM,BRIEF-CN To Purchase 200 New Locomotives From GE Transportation Over The Next Three Years,* CN TO PURCHASE 200 NEW LOCOMOTIVES FROM GE TRANSPORTATION OVER THE NEXT THREE YEARS
2017-12-22,2:15 PM,BRIEF-General Electric Names Alec Burger President Of GE Capital,* GENERAL ELECTRIC CO SAYS ALEC BURGER NAMED PRESIDENT OF GE CAPITAL; RICHARD LAXER TO RETIRE
2017-12-27,10:52 AM,Deals of the day-Mergers and acquisitions,"Dec 27 The following bids, mergers, acquisitions and disposals were reported by 2100 GMT on Wednesday:"
2017-12-27,10:04 AM,GE raises stake in Sweden's Arcam by buying shares from hedge funds,General Electric Co  said on Wednesday it would raise its stake in Swedish 3D printer maker Arcam AB  to around 95 percent from 77 percent after buying shares from hedge funds Elliott and Polygon.
2017-12-27,10:04 AM,UPDATE 2-GE raises stake in Sweden's Arcam by buying shares from hedge funds,Dec 27 General Electric Co said on Wednesday it would raise its stake in Swedish 3D printer maker Arcam AB to around 95 percent from 77 percent after buying shares from hedge funds Elliott and Polygon.
2017-12-27,3:20 PM,GE to keep Rochester plant open,"U.S. industrial conglomerate General Electric Co said on Wednesday it would keep its plant running in Rochester, New York, retaining all employees at the facility for now."
2017-12-27,2:12 PM,BRIEF-General Electric Says Will Be Keeping Manufacturing And Assembly Operations For Industrial Communications Product Line In Rochester,* GENERAL ELECTRIC SAYS WILL BE KEEPING MANUFACTURING AND ASSEMBLY OPERATIONS FOR INDUSTRIAL COMMUNICATIONS PRODUCT LINE IN ROCHESTER Further company coverage:
2017-12-27,10:01 AM,GE to increase stake in Sweden's Arcam to more than 90 pct,Dec 27 General Electric Co said on Wednesday it will increase its stake in Swedish 3D printer maker Arcam AB to more than 90 percent from 77 percent.
2017-12-27,9:27 AM,BRIEF-Ge To Increase Its Ownership Of Arcam To More Than 90 Percent,* GE TO INCREASE ITS OWNERSHIP OF ARCAM TO MORE THAN 90 PERCENT
2017-12-28,12:09 PM,"In Pakistan, questions raised over GE's flagship power turbines","ISLAMABAD/SINGAPORE General Electric's flagship gas turbines ran into problems in Pakistan earlier this year, leading to delays and lengthy outages at three newly built power stations, according to several senior Pakistani officials and power executives."
2017-12-28,12:09 PM,"INSIGHT-In Pakistan, questions raised over GE's flagship power turbines",* Pakistan ordered record-setting GE turbines to ease shortfall
2017-12-28,12:01 PM,"CORRECTED-INSIGHT-In Pakistan, questions raised over GE's flagship power turbines",* Pakistan ordered record-setting GE turbines to ease shortfall
2017-12-29,9:08 PM,BRIEF-Willis Lease Finance Says Entered Agreement With GE For Purchase Of 5 Modern Technology GE Aircraft Engines ‍​,"* WILLIS LEASE FINANCE - ON DEC 22, ENTERED DEFINITIVE AGREEMENT WITH GENERAL ELECTRIC FOR PURCHASE, DELIVERY OF 5 MODERN TECHNOLOGY GE AIRCRAFT ENGINES ‍​"
2018-01-08,1:30 PM,BRIEF-GE -  Harbin Electric Corp Awarded GE Power Order For 2 9F.05 Gas Turbines For State Power Investment Corporation's Langfang Power Plant,* GE -  HARBIN ELECTRIC CORPORATION AWARDED GE POWER ORDER FOR 2 9F.05 GAS TURBINES FOR STATE POWER INVESTMENT CORPORATION’S LANGFANG POWER PLANT Source text (http://bit.ly/2Fc5wcN) Further company coverage:
2018-01-16,11:57 AM,"GE reignites break-up talk after $11 billion insurance, tax hit",NEW YORK General Electric Co  indicated it is looking closely at breaking itself up on Tuesday as the conglomerate announced more than $11 billion in charges from its long-term care insurance portfolio and new U.S. tax laws. | Video
2018-01-16,12:40 PM,"Wall St. eases as oil prices, General Electric fall","NEW YORK Wall Street paused its rally on Tuesday, weighed down by weakness in General Electric shares and as lower oil prices dragged down the energy sector. | Video"
2018-01-16,10:01 PM,BRIEF-GE Enters 3 Unsecured Revolving Credit Facilities,"* GE- ENTERED THREE UNSECURED REVOLVING CREDIT FACILITIES WITH INITIAL PRINCIPAL COMMITMENT AMOUNTS OF UP TO $5 BILLION, $4 BILLION AND $4 BILLION EACH -SEC FILING"
2018-01-16,12:40 PM,"US STOCKS-Wall St eases as oil prices, General Electric fall",* GE slides after saying it would take $6.2 bln 4th-quarter charge
2018-01-16,9:12 PM,"US STOCKS SNAPSHOT-Wall Street indexes fall with oil prices, General Electric","NEW YORK, Jan 16 Wall Street paused its rally on Tuesday, weighed down by weakness in General Electric shares and as lower oil prices dragged down the energy sector."
2018-01-16,10:11 AM,UPDATE 2-Siemens' Healthineers in pre-IPO cost-cutting drive,"* Sees adj 2018 profit margin of 17-18 pct, vs 18.1 in fiscal 2017"
2018-01-16,3:56 PM,BRIEF-GE CEO Says Examining Options For Company's Businesses - Conf Call‍​,* GE EXPECTS 2017 EPS TO BE AT THE LOW END OF ITS GUIDANCE - CONF CALL‍​
2018-01-16,1:12 PM,"BRIEF-GE- Review For GE Capital’S Run-Off Insurance Portfolio, Nalh, Will Result In An After-Tax GAAP Charge Of $6.2 Bln For Q4 2017","* GE- REVIEW FOR GE CAPITAL’S RUN-OFF INSURANCE PORTFOLIO, NALH, WILL RESULT IN AN AFTER-TAX GAAP CHARGE OF $6.2 BILLION FOR Q4 2017"
2018-01-16,11:48 AM,GE to take $6.2 bln charge in its finance arm in fourth quarter,Jan 16 U.S. industrial conglomerate General Electric Co said on Tuesday it would record an after-tax charge of $6.2 billion for the fourth quarter related to its finance arm's run-off insurance portfolio.
2018-01-17,6:20 PM,GE's 2018 gains wiped out as worries about turnaround plan persist,"Shares of General Electric Co  continued its slide on Wednesday and wiped out all its gains in 2018, a day after the U.S. industrial conglomerate announced more than $11 billion in charges and hinted about a potential breakup."
2018-01-17,6:20 PM,GE's 2018 gains wiped out as worries about turnaround plan persist,"Jan 17 Shares of General Electric Co continued its slide on Wednesday and wiped out all its gains in 2018, a day after the U.S. industrial conglomerate announced more than $11 billion in charges and hinted about a potential breakup."
2018-01-17,10:57 AM,BRIEF-Xiangxue Pharmaceutical Signs Letter Of Intent With General Electric's Shanghai Affiliate,* SAYS IT SIGNS LETTER OF INTENT WITH GENERAL ELECTRIC'S SHANGHAI AFFILIATE ON MEDICAL-RELATED COOPERATION Source text in Chinese: http://bit.ly/2mEzBt4 Further company coverage: (Reporting by Hong Kong newsroom)
2018-01-17,10:10 AM,GE appoints new CEO for Europe,"Industrial conglomerate General Electric  has appointed Peter Stracar chief executive and president of its European region, the company said in a statement."
2018-01-17,10:10 AM,GE appoints new CEO for Europe,"Jan 17 Industrial conglomerate General Electric has appointed Peter Stracar chief executive and president of its European region, the company said in a statement."
2018-01-17,9:02 AM,BRIEF-GE announces appointment of Peter Stracar as CEO of European region,* GE SAYS APPOINTMENT OF PETER STRACAR AS PRESIDENT & CEO OF GE’S EUROPEAN REGION
2018-01-18,1:44 PM,"BRIEF-GE Says Co's Power Services Business Signed Long-Term Agreements With Consortium Formed By Macquarie Capital, Techint Valued At About Over $330M ‍​","* GE - CO'S POWER SERVICES BUSINESS SIGNED LONG-TERM AGREEMENTS WITH CONSORTIUM FORMED BY MACQUARIE CAPITAL, TECHINT VALUED AT ABOUT OVER $330M ‍​ Source text: (http://bit.ly/2EUMaaT) Further company coverage:"
2018-01-19,6:18 PM,GE shares stumble to worst week since financial crisis,"NEW YORK General Electric  shares tumbled for a fifth straight session on Friday, sending the stock to its biggest weekly percentage drop since the financial crisis, after the company flagged a possible breakup and more than $11 billion in charges earlier in the week."
2018-01-19,6:11 PM,General Electric shares drop for fifth straight session,"NEW YORK, Jan 19 General Electric shares tumbled for a fifth straight session on Friday, flirting with their biggest weekly percentage drop since the financial crisis, after the company flagged a possible breakup and more than $11 billion in charges earlier in the week."
2018-01-22,7:03 PM,Pakistan's PM says confident GE will fix 'technical' issues with gas turbines,"ISLAMABAD Prime Minister Shahid Khaqan Abbasi said on Monday that some of General Electric's flagship new gas turbines in Pakistan were still suffering from technical issues such as ""vibration"" but he was confident the American company will fix the problems."
2018-01-22,7:03 PM,"Pakistan's PM says confident GE will fix ""technical"" issues with gas turbines","ISLAMABAD, Jan 22 Prime Minister Shahid Khaqan Abbasi said on Monday that some of General Electric's flagship new gas turbines in Pakistan were still suffering from technical issues such as ""vibration"" but he was confident the American company will fix the problems."
2018-01-22,1:25 PM,GECAS CEO says believes GE views aircraft finance unit as a 'keeper',"DUBLIN, Jan 22 General Electric Co is unlikely to divest its aircraft finance unit GECAS as it likes its stable returns and global footprint, the unit's chief executive Alec Burger said on Monday."
2018-01-23,5:47 AM,"RPT-Pakistan's PM says confident GE will fix ""technical"" issues with gas turbines","ISLAMABAD, Jan 22 Prime Minister Shahid Khaqan Abbasi said on Monday that some of General Electric's flagship new gas turbines in Pakistan were still suffering from technical issues such as ""vibration"" but he was confident the American company will fix the problems."
2018-01-24,11:54 AM,SEC investigating GE charge; company posts $10 billion loss,"NEW YORK U.S. securities regulators are probing a massive insurance charge recently announced by General Electric Co , the latest blow to the nation's largest industrial conglomerate as it struggles to reverse steep declines in some of its units and is looking to sell off $20 billion of assets. | Video"
2018-01-24,12:58 AM,"GLOBAL MARKETS-Dollar extends rout, at 3-yr low after Mnuchin remarks; gold jumps",* U.S. Treasury prices fall after Mnuchin endorses weak dollar
2018-01-24,11:54 AM,UPDATE 6-SEC investigating GE charge; company posts $10 bln loss,"NEW YORK, Jan 24 U.S. securities regulators are probing a massive insurance charge recently announced by General Electric Co, the latest blow to the nation's largest industrial conglomerate as it struggles to reverse steep declines in some of its units and is looking to sell off $20 billion of assets."
